year,series_id,title,gumilyov_level
2004,1,Деви-гита из Девибхагавата-пураны,1
2004,1,Психология акта самопожертвования в изображении драматургов 7-го века,1
2004,1,Литературные реминисценции в «Гаудавахо» Вакпатираджи,1
2004,1,Проблема интерпретации специальной санскритской терминологии: термин адхьякша в индийской традиции,1
2004,1,Шанкара как критик категорий вайшешики,1
2004,1,Концепция спхоты в «Спхотасиддхи» Манданамишры,1
2004,1,О взаимоотношении религиозных конфессий в средневековом Тамилнаде,2
2004,1,О «священной географии» в творчестве Тирунянасамбандара (шиваитский поэтический комплекс «Деварам»),1
2004,1,Буддизм в творчестве Джаяшанкара Прасада,1
2004,1,Сюжет «Повести о Насикете» Садала Мишры в контексте истории прозы хинди,1
2004,1,Богини и деревья желаний в индуизме Центральных Гималаев,1
2006,1,К проблеме древнеиндийской хронологии,1
2006,1,Завершающие строфы «Махабхараты»: лексика и семантика,1
2006,1,Тема деревни в «Саттасаи»,1
2006,1,О соотношении санскритского и тибетского текстов «Гимна,1
2006,1,Вытеснение согласного во избежание возникновения тяжелой группы трех шумных согласных в индоиранском,1
2006,1,Технические приспособления для рубрикации корней в,1
2006,1,Представления об обществе и власти в «Бхагавата-пуране»,1
2006,1,Место «Девибхагавата-пураны» в процессе эволюции шактизма,1
2006,1,Изображение и текст: древнеиндийские рельефы и буддийские вербальные тексты,1
2006,1,Царь − установитель дхармы. Практический аспект идеологической концепции,1
2006,1,Некоторые наблюдения над царской титулатурой индо-греков,1
2006,1,Санскритское upa-śru-: «слышать» или «вслушиваться»? Об одном древнеиндийском способе гадания,1
2006,1,Отряхивающийся ныряльщик: о специфическом фольклорном мотиве в эпических и пуранических версиях «Сказания о Вепре» (Varāha-kathā),1
2006,1,Об особенностях самосознания представителей «низких каст» в современных условиях,1
2006,1,Символика и способы почитания богини Тары в индуизме (с демонстрацией видеоматериалов),1
2006,1,Комментарий к комментарию (Г.С.Лебедев и культурная жизнь Калькутты в 1790-х годах),1
2006,1,Интерпретация идей Упанишад у Раммохона Роя и Дебендронатха Тагора,1
2006,1,Безымянный герой (о романах Хазарипрасада Двиведи),1
2006,1,К вопросу о сюжетных и стилистических истоках ранних приключенческих романов на хинди,1
2006,1,Модели христианского и индо-буддийского времени в современной литературе,3
2006,1,Индийские философские тексты: композиция как часть содержания,1
2006,1,Механизмы передачи сакрального текста в школах раннего буддизма (К постановке проблемы),1
2006,1,Бхартрихари и Дхармакирти о возможности рефлексивного акта познания,1
2006,1,Тема уточняется,1
2006,1,«Ādau vāda āsīt»: о переводах Библии на санскрит,1
2007,1,Санскритское письмо как последовательная фонетическая транскрипция,1
2007,1,«Великие» и «малые» в надписях Ашоки,1
2007,1,«Очерки Цейлона и Индии» И. П. Минаева как источник по изучению культурной истории Индии,1
2007,1,Описания военной техники в индийском сочинении XI века «Шри Калачакра тантра раджа»,1
2007,1,От смерти к новому рождению. Учение о промежуточном существовании в «Абхидхармакоше» Васубандху,1
2007,1,В чем непосредственность непосредственного восприятия в буддийской эпистемологии?,1
2007,1,Философ Нагарджуна – персонаж пракритского романа «Лилаваи»,1
2007,1,«Гимн Таре» Сарваджнямитры и его тибетские переводы,1
2007,1,К вопросу о статусе «естественного описания» в индийской поэтике,1
2007,1,Сезонный и суточный циклы в санскритской драме (структура санскритской драмы),1
2007,1,Плач в составе древней махакавьи,1
2007,1,О быках и людях (Образ «Стада» в скотоводческом эпосе Южной Индии),1
2007,1,Индийские памятники героям в сравнительном освещении (К вопросу о материальном соответствии поэтической формуле «непреходящая слава»),1
2007,1,К вопросу об эндогамии касты,1
2007,1,Миф о Махишасурамардани в Девибхагавата- и Калика-пуранах,1
2007,1,«Мадхан-кам» – народная драма Северной Бенгалии (с демонстрацией видеоматериалов),1
2007,1,«Рассказ о рани Кетаки» Инш-алла Хана в контексте развития ранней прозы на хинди и урду,1
2007,1,Дидактические шатаки в литературе телугу (К характеристике жанровых особенностей),1
2007,1,Некоторые проблемы становления вишишта-адвайты,1
2007,1,Язык как источник аргументации (на примере рассуждений о самбандхе),1
2007,1,Теоретические аспекты учения тантрической школы кула (согласно «Куларнава-тантре»),1
2007,1,Образ Чайтаньи в традиционных бенгальских текстах,1
2007,1,Лингвофилософское в «Пара-тримшика-виварана» Абхинавагупты,1
2010,1,«Рагхуванша» Калидасы глазами тамилиста,1
2010,1,Царица в дворцовом парке,1
2010,1,«Археология» раннебуддийского доктринального текста на примере главы о буддхакшетрах («полях Будд») из Махавасту,1
2010,1,Миф о Ветале и Бхайраве в «Калика-пуране»,1
2010,1,Сравнительный анализ генезиса рефлексии в индийской и европейской философских традициях: визуальные и лингвистические детерминанты,1
2010,1,Потенциальное и актуальное в буддийском учении о восприятии,1
2010,1,Проблема уникальности природы человеческой души в философской системе Ямуначарьи,1
2010,1,Индийский эпос «Дхола-Мару» и «Сказка о царе Салтане» А.С.Пушкина,1
2010,1,Концепция игры в индийской традиции (кридаяника в «Натьяшастре»),1
2010,1,Ордалия раскаленной монетой (taptamàşa): текст и реальность,1
2010,1,Mārgī/deśī: о двух способах интерпретации индийского танца,1
2011,1,Тема весны в старой тамильской поэзии,1
2011,1,О композиции вступительных глав «Сказания о Шакунтале»,1
2011,1,Прием почетного гостя-атитхи по материалам древнеиндийских ритуальных текстов,1
2011,1,Индия в поэзии йафиитов (Южная Аравия),1
2011,1,Существует ли психофизическая проблема (mind-body problem) в буддизме?,1
2011,1,Метафора в «Махабхарате»,1
2011,1,Драупади в Зале собрания (роль бога Дхармы),1
2011,1,Интерпретация учения об аватарах Вишну в «Девибхагавата-пуране»,1
2011,1,Поэтические жанры индийской литературы в тибетском буддийском каноне,1
2011,1,Об изучении четвертой главы «Абхисамая-аланкары»,1
2011,1,Интерпретация символов ‘ом’ и ‘сиддхам’ в мангала-шлоках санскритских рукописей,1
2011,1,Проблема энергии в тантре,1
2011,1,Энергийный прагматизм в тамильской культуре,1
2011,1,Некоторые аспекты полемического дискурса в индийских религиозно-философских традициях,1
2011,1,Samarasa и svasamvedya в абхишека-патале Хеваджра-тантры согласно Муктавалихеваджрапаньджике Ратнакарашанти,1
2011,1,Другой в традиции индуизма и философии Бенгальского Возрождения: Опыт сопоставления,1
2011,1,Санскритизация и философские проблемы языковой политики,1
2011,1,Рабиндранат Тагор: уровни поэтического высказывания,1
2011,1,Словесные фигуры и принцип «непрямого высказывания» (вакрокти) в средневековой поэтике,1
2011,1,«Ярость» Рушди,1
2011,1,«Будда из пригорода» Ханифа Курейши: иммигрантский текст индо-британской литературы,1
2011,1,Концепт svadharma в кастовой идеологии,1
2011,1,Мифологии северных мунда как источник для реконструкции сюжета создания человека у населения евразийских степей в эпоху бронзы,3
2011,1,Половозрастная стратификация общества в ведийских текстах,1
2011,1,"«Юные» в окружении царя Раджасинхи II—го (XVII век, Шри Ланка)",1
2011,1,Герасим Лебедев и британская элита колониальной Калькутты,1
2011,1,О первых христианских миссионерах в Индии,1
2011,1,Глава о надзирателе за архивом в «Артхашастре» Каутильи в контексте информации надписей времени Гуптов,1
2011,1,Саттрия: рождение нового индийского классического танца в Ассаме,1
2012,1,«Рамаяна»  в драме Бхавабхути «Последние деяния Рамы»,1
2012,1,Практики движения праны в текстах кашмирских авторов,1
2012,1,Особенности композиции «Апастамба-дхармасутры»,1
2012,1,Агамический текст как способ самоопределения ведической традиции (на примере «Шива сутры»),1
2012,1,Версия мифа о Вритре в «Девибхагаватапуране»,1
2012,1,Еще раз о теме разлуки в тамильской поэзии,1
2012,1,Дискуссия о значении термина анангу в тамильской литературе,1
2012,1,Текст по культу Ваджрапани и восьми царей нагов в свитке XIII века Дх-178 из собрания ИВР РАН,1
2012,1,"Ян Потоцкий и тибетская рукопись, найденная в Калмыкии",1
2012,1,Непосредственное восприятие как знание из слов по материалам «Веданта-парибхаши» Дхармараджи,1
2012,1,Матрики вне буддийских текстов,1
2012,1,Две парадигмы монизма в интерпретации «Бхагавадгиты»: Шанкара и Рамануджа,1
2012,1,Г. Оберхаммер и его принципы изучения религиозно-философских текстов школы вишишта-адвайта-веданты,1
2012,1,Формула «бхукти — мукти» и сотериологический антиномизм индуистской тантры,1
2012,1,Эволюция буддистского учения о не-«я»: две концепции анатмавады,1
2012,1,Дхарма и буддология. Актуальные проблемы,1
2012,1,Образ индуизма в религиозно-философской мысли Бенгальского Ренессанса,1
2012,1,Загадки поэмы Джаяси «Падмават»,1
2012,1,«Кадамбари» в современном мире,1
2012,1,Эволюция жанра шахрашуб в контексте взаимодействия персоязычной литературы и литературы урду,1
2012,1,«Третье измерение» в непальской поэзии,1
2012,1,Индия и индийцы в автобиографической книге  В. С. Найпола «The Writer's People»,1
2012,1,Символические фигуры «Ригведы» (на примере  гимна «К Речи»),1
2012,1,Осел/бык в индоиранской картине мира,1
2012,1,Чудесный сосуд Манимехалей: попытка интерпретации,1
2012,1,Неварский «повествовательный свиток» в собрании  МАЭ РАН (коллекция И. П. Минаева). Предварительное сообщение,1
2012,1,Живая традиция ритуальных росписей Питхоро в Гуджарате: полевые данные 2012 г,1
2012,1,«Юный» как представитель измененного состояния сознания,1
2012,1,Особенности календарной обрядности у раджпутов,1
2012,1,"«Бенгальский стиль» в индийском танце: традиционное, креативное, политическое измерения",1
2013,1,Страсти и бесстрастие Бхартирихари,1
2013,1,История Агададатты в романе Сангхадасы «Странствия Васудевы»,1
2013,1,Жемчужный остров в «Девибхагавата-пуране»,1
2013,1,Буддийские рукописи в Индийском фонде ИВР РАН,1
2013,1,Образ Махендры/Махинды в записках китайских паломников,1
2013,1,Эпитеты Будды в тексте «Аджатасена-вьякараны»,1
2013,1,Тамильские женские божества в средневековой литературе,1
2013,1,"Садханы Харихарихаривахана-Авалокитешвары (Авалокитешвары, восседающего на Вишну, гаруде и льве) из тибетского буддийского канона",1
2013,1,Проблема языка в веданте и европейском романтизме,1
2013,1,"Варна – это фонема, буква, звук или …?",1
2013,1,Классификация наук в традиционной индийской культуре,1
2013,1,Восьмиугольные понятийные схемы в индийской рациональности,1
2013,1,Читта и бодхичитта. Раздумья о переводе некоторых буддийских терминов,1
2013,1,Представление о Брахмане в ранней вишишта-адвайте,1
2013,1,Концепт «майя» у Шанкары и Абхинавагупты: сходство и различие,1
2013,1,Элементы культурного синтеза в бенгальской поэзии XVII века,1
2013,1,Образ Кришны в поэзии Миры Баи,1
2013,1,«Открытие Индии» сквозь призму традиционного текста: опыт мыслителей Бенгальского Возрождения,1
2013,1,Реальное и ирреальное в «„Новой поэзии“ хинди»,1
2013,1,Причастие-герундий в хинди и бенгальском языке,1
2013,1,О формульности надписей на санскрите,1
2013,1,О символическом языке вещей,1
2013,1,Герасим Лебедев и британская элита колониальной Калькутты: момент разрыва,1
2013,1,Современные баулы: от деревни до концертного зала,2
2013,1,Современное искусство адиваси: некоторые особенности музейной репрезентации в Индии и Европе,1
2013,1,Образ Локешвара в календарном обряде непальцев,1
2013,1,"Материальные атрибуты (лук, стрелы, топорик) как этнические символы автохтонов Шри Ланки",1
2013,1,Айодхья через 20 лет после конфликта: о современных проявлениях индуистского фундаментализма (наблюдения и немного размышлений),2
2013,1,"«Песни якшей», игры людей: о социальных, культурных и художественных особенностях якшаганы Карнатаки",1
2014,1,Абхидхармакоша: проблема авторства,1
2014,1,И. П. Минаев как собиратель рукописей,1
2014,1,Ранние китайские версии биографии Будды: сюжет подношения рисовой каши,1
2014,1,"О гимне Авалокитешваре, приписываемом тибетскому царю Сонгцэн-гампо",1
2014,1,What is Ahi Budhnya: some remarks on the Serpent of the Deep as in the Rigveda and elsewhere,1
2014,1,"The ideal man in the Mahābhārata. The consciousness of the ""budhyamāna"" on one's way to salvation",1
2014,1,Древнеиндийская риторика и традиция санскритского театра (Тригата в «Натьяшастре»),1
2014,1,Концепция аватар Вишну в поэме Магхи «Шишупалавадха»,1
2014,1,Версия «Рамаяны» в «Махабхагавата-пуране»,1
2014,1,Тангутские ксилографы письмом ‘сиддхам’ из собрания ИВР РАН,1
2014,1,«Апофатический» подход в буддийской теории восприятия,1
2014,1,"Мандала-классификация нечестных трансакций в ответ на упрек (Ангуттара-никая. Аттаканипата, Ассаколанкасутта)",1
2014,1,Психология Бога в кашмирском шиваизме и у Якоба Беме,1
2014,1,"Спхота, джати, пашьянти и пратибха в «Вакьяпадии» — к проблеме разграничения терминов",1
2014,1,«Стотра-ратна» Ямуны: философия vis-à-vis поэзия,1
2014,1,Южноиндийские божества: некоторые аспекты гендерных взаимоотношений,1
2014,1,Животный мир пословиц и поговорок хинди,1
2014,1,Традиционная классификация санскритских стихотворных размеров,1
2014,1,«Лирическая героиня» Миры Баи,1
2014,1,Форма смыслового глагола в модальных конструкциях возможности/способности в хинди,1
2014,1,Феномен Рамакришны Парамахамсы и формирование неоиндуизма в Бенгалии XIX века,2
2014,1,Религия как инструмент внутренней политики Индии,1
2014,1,Гимн-падигам как основная форма поэзии тамильских шиваитов,1
2014,1,Значение творчества Тирумулара для формирования изобразительного канона Шивы Натараджи в Чидамбараме,1
2014,1,К реконструкции ритуальной семантики дравидского kāvaṭi,1
2014,1,Древние южноазиатско-африканские связи (по данным фольклора и мифологии),3
2014,1,Концепция «марьяда» в непальских надписях,1
2014,1,Хити/дхара — «неиссякаемый источник»: Иконография и функции (по материалам Непала),1
2014,1,Неварский «повествовательный свиток» на темы «Лалитавистары»: «одомашнивание» классической буддийской сутры,1
2014,1,Брахманы намбудири: некоторые особенности традиции передачи ведийских текстов,1
2014,1,Грамматика Панини и механизм кодирования ведийского текста,1
2014,1,В деревне Ампития (Шри Ланка) через 100 лет после Людмилы Мерварт,1
2014,1,О стереотипизации адиваси в популярной культуре Индии,1
2014,1,Община парсов в мультикультурном Бомбее (по произведениям Рохинтона Мистри),1
2014,1,Духи умерших в представлениях и обрядовой жизни веддов Шри Ланки,2
2014,1,"Одержимость, служение и лицедейство. Традиции Bhoota-kolam и Theyyam Тулунаду",1
2014,1,", Dr. Prof., Head of the department for Indian Philology and Religion, Cotman University (Panama). Nâgârjuna - tetraktus & catuskotis - Pythagorean sources of Buddhism",1
2018,1,101 синоним воды в ведийском словаре «Нигханту»,1
2018,1,Мантра и сутра как форма построения ведийских текстов,1
2018,1,От демонической к человеческой сексуальности? Индо-иранский миф о первобытном инцесте Ями и Ямы и его индоевропейские корни,1
2018,1,Женские образы древнеиндийского эпоса и позднейшего фольклора на фоне норм дхармашастры,1
2018,1,Оговорка как композиционный прием в санскритской драме,1
2018,1,Индийские истоки тибетской историографии буддизма,1
