stable_key_candidate,before_presentation_id,after_presentation_id,year,series,title,first_speaker
b514975ad2cd6c4c,PRES_c1bf1faf,PRES_506598c7ac,2026,Zograf Readings,Златоликие образы,Рыбакова Анна Геннадьевна
b55faba1195252bf,PRES_74afcb49,PRES_c2c612cc11,2025,Zograf Readings,Новые древнеиндийские праформы на материале этимологий лексики языка куллуи,Крылова Анастасия Сергеевна
b587b19171ab36ad,PRES_R_f5a02487,PRES_4fb8f1be68,2016,Roerich Readings,Еретики локаятики и ортодокс Каутса,Тавастшерна Сергей Сергеевич
b6645328f3c8ef00,PRES_32e1a9cc,PRES_057a97bae3,2013,Zograf Readings,Тамильские женские божества в средневековой литературе,П. В. Хрущева
b70b3bf423817370,PRES_00800359,PRES_1735d0acd6,2021,Zograf Readings,Ведийский санскрит и индийская философия в творчестве композитора А. Н. Скрябина*,Мехакян Арег Гайкович
b752b8c6eb913f49,PRES_R_e77e642d,PRES_266b728e8b,2018,Roerich Readings,Живопись и графика Гималайского региона в коллекции И.П.Минаева (МАЭ РАН): некоторые аспекты атрибуции и интерпретации,Бабин Александр Николаевич
b877c30e311aa3e9,PRES_R_e9012119,PRES_eb97bf0c2c,2021,Roerich Readings,Предварительные замечания к проблеме речевого сбоя в древнеиндийской теории драмы,Е. А. Юдицкая
b99979025579b627,PRES_29f00ab7,PRES_b702dbd607,2026,Zograf Readings,Предание в тексте и,Александрова Наталия Владимировна
b9d1b3a10d9f491e,PRES_R_1c28ffb1,PRES_f066c545a3,2022,Roerich Readings,О предельном предмете в «Парамартхасаре» Абхинавагупты,С. Ч. Офертас
ba9f10fdc3042878,PRES_R_33e75ef9,PRES_c8b0cc48ff,2012,Roerich Readings,Традиционный индийский комментарий как источник по изучению синтаксиса древнеиндийских языков,Тавастшерна Сергей Сергеевич
baa97aa315afef72,PRES_8b61707c,PRES_a50b3e15f8,2012,Zograf Readings,Версия мифа о Вритре в «Девибхагаватапуране»,Игнатьев Андрей Александрович
bb26fa2c91ac74ec,PRES_ef70d072,PRES_ee8b4ce60f,2025,Zograf Readings,Рождение концепции иконографии Шивы Натараджи в скульптуре пещерных храмов Южной Индии,Воробьева Дарья Николаевна
bb3f7206597e9f92,PRES_d072f69b,PRES_2dc3ad751c,2021,Zograf Readings,Проблемы понимания санскритской метрики,Тавастшерна Сергей Сергеевич
bb8eb0c77a0fcbad,PRES_R_38cfcd5d,PRES_1423cbe251,2024,Roerich Readings,Буддизм в Восточном Туркестане,Б. У. Китинов
bbc4fa173e0782d8,PRES_42183e71,PRES_99ab54bf5f,2018,Zograf Readings,Женские образы древнеиндийского эпоса и позднейшего фольклора на фоне норм дхармашастры,Васильков Ярослав Владимирович
bc58682c4819d8d9,PRES_4d580746,PRES_d79f059c9b,2026,Zograf Readings,Миф о Потопе и тыкве у племен,Ренковская Евгения Алексеевна
bc981df750fbb073,PRES_R_ddf46b4d,PRES_2d4b756bde,2017,Roerich Readings,К вопросу о могольском изобразительном «мультилингвизме» и культурной экстравертности,Ю.С. Атманова
bcc244bb2867fc02,PRES_3928725b,PRES_e0d1b1d401,2019,Zograf Readings,Трансформации культурной идентичности парсов Бомбея,Н. В. Гузеватая
bcd9c07be7d3acee,PRES_de1cc096,PRES_799c20d409,2014,Zograf Readings,Древнеиндийская риторика и традиция санскритского театра (Тригата в «Натьяшастре»),Лидова Наталья Ростиславовна
bce138eb32e53246,PRES_35eea910,PRES_591cda8e1c,2007,Zograf Readings,«Очерки Цейлона и Индии» И. П. Минаева как источник по изучению культурной истории Индии,Ермакова Татьяна Викторовна
bd18d02f598ba5ec,PRES_18b65d41,PRES_09d5665737,2018,Zograf Readings,История индийской философии глазами Свами Вивекананды: опыт реконструкции,Скороходова Татьяна Григорьевна
bd242f5b04c7da73,PRES_bcd5fc6c,PRES_77b17b6c45,2006,Zograf Readings,Комментарий к комментарию (Г.С.Лебедев и культурная жизнь Калькутты в 1790-х годах),Е. К. Бросалина
bd6b43ec43211506,PRES_afcb9530,PRES_51ef5fa711,2020,Zograf Readings,К вопросу об определении понятия apratiṣṭhita-nirvāṇa,Бурмистров Сергей Леонидович
bdfe02f409c58c04,PRES_6c24d8ee,PRES_a166280b4f,2013,Zograf Readings,Читта и бодхичитта. Раздумья о переводе некоторых буддийских терминов,Терентьев Андрей Анатольевич
be596fe35c9710d2,PRES_78669ded,PRES_7eb7b61f87,2007,Zograf Readings,Сезонный и суточный циклы в санскритской драме (структура санскритской драмы),Ю. М. Алиханова
be8ac049e7127b7d,PRES_R_c09a3d28,PRES_542ccd5cc4,2020,Roerich Readings,Санскрит и индийская философия в творчестве композитора А.Н. Скрябина,Мехакян Арег Гайкович
bee1b4960c6d04a7,PRES_8c10a829,PRES_922fa097ff,2025,Zograf Readings,"Ведийский гапакс batá- и частица bata / vata: семантика, контекст, этимология",Куликов Леонид Игоревич
bef553807c78587d,PRES_e956a0d4,PRES_9c9231314d,2018,Zograf Readings,Вьявахара как универсум установления достоверности знания в индийской эпистемологии и логике (праманаваде),Канаева Наталия Алексеевна
bf1c08b1125ee0a8,PRES_e9f19fbe,PRES_90209bb9a4,2025,Zograf Readings,Индийские истоки и источники философствования Р. Тагора: «Садхана» как опыт объяснения Своего Другому,Скороходова Татьяна Григорьевна
c02edd25634fb1fd,PRES_e9723a6a,PRES_aa3e770ddc,2022,Zograf Readings,,Шомахмадов Сафарали Хайбуллоевич
c051c7736ebf1003,PRES_R_543dbf47,PRES_1c47da0ce2,2020,Roerich Readings,Феномен речевого сбоя как средство художественной выразительности в структуре классической санскритской драмы,Е. А. Юдицкая
c05896e99ec58856,PRES_d2566ea6,PRES_af3bd17213,2025,Zograf Readings,«Наишкармья-сиддхи» (I. 52) Сурешвары как структура для реконструкции учения Шанкары об освобождении,Толчельников Иван Евгеньевич
c079ecbd1cdb2b9a,PRES_R_0384e3d1,PRES_56ef042326,2017,Roerich Readings,Поэма «Десять песен»: перевод и чтение на тамильском языке,Дубянский Александр Михайлович
c080b04e21c86e29,PRES_f751c5ec,PRES_67af1ca2d2,2025,Zograf Readings,Еще раз о структуре Чарьягити,Лекарева Ева Павловна
c0e3e13801ea65b8,PRES_R_277a75ac,PRES_b868f0964f,2023,Roerich Readings,Надписи на колонне Гелиодора,Вигасин Алексей Алексеевич
c0e4684a1f852614,PRES_a7fe1880,PRES_6f43d19587,2011,Zograf Readings,Тема весны в старой тамильской поэзии,Дубянский Александр Михайлович
c11590bccd4cc4f2,PRES_R_8bd6c533,PRES_b97f8a31f0,2024,Roerich Readings,О нарративной символике бронзовой фигурки танцующего Бала-Кришны,Немчинов Виктор Михайлович
c130d13f81b774d1,PRES_R_0e153d3a,PRES_9a9c741162,2017,Roerich Readings,Тамильская баллада «Сказание о Кусалаване» (kucalavaṉ katai): особенности трактовки фрагмента «Рамаяны»,Дубянский Александр Михайлович
c1dbc5d544e826d8,PRES_5b03a1d3,PRES_771b9da8b0,2021,Zograf Readings,Кофейная Одиссея Индии,Шарапова Александра Владимировна
c1f0e03c6e714cb1,PRES_1921ab01,PRES_d1ef40e702,2010,Zograf Readings,Царица в дворцовом парке,Ю. М. Алиханова
c22243b1b1fe409b,PRES_R_8a802aa0,PRES_1a67e5a7cf,2017,Roerich Readings,Теория и практика заимствований санскритской литературной традиции,Ю. М. Алиханова
c2aa3a1d7330f17d,PRES_8d05f7b9,PRES_d34abd1812,2007,Zograf Readings,Образ Чайтаньи в традиционных бенгальских текстах,С. В. Ватман
c2cc3a7712e6cd2e,PRES_d682ea04,PRES_70fb8906f9,2014,Zograf Readings,Версия «Рамаяны» в «Махабхагавата-пуране»,Игнатьев Андрей Александрович
c3a17decee9fc6ee,PRES_R_f319ed92,PRES_890eda4f29,2016,Roerich Readings,Механизмы интертекста в раннебуддийской текстовой традиции,Жутаев Дмитрий Игоревич
c43717718acd1415,PRES_f62d45e1,PRES_2848b34f22,2018,Zograf Readings,Раджа Рави Варма: художник и основатель «Рави Варма Пресс»,Столярова Екатерина Владимировна
c47adb2ce8db54a1,PRES_51855590,PRES_a5ebd42e70,2025,Zograf Readings,Социально-политический контекст романов Даймонд Шамшера Рана,Стрельцова Лилия Александровна
c47afa8d7eaeb052,PRES_R_dd4b5710,PRES_640984ea12,2016,Roerich Readings,Ритуальный текст о структуре вселенной (опыт литературного перевода),Жутаев Дмитрий Игоревич
c4df2e53bdfa0f83,PRES_R_70d1cd7a,PRES_cf421cdc13,2018,Roerich Readings,Имперская идея или этнический стереотип? Концепт «монгол» в первой половине XIII в,Дробышев Юлий Игорьевич
c55d91e902ed89f8,PRES_R_2e8dee12,PRES_3fcf42f2f1,2016,Roerich Readings,Культ Нарасинхи в трактатах по вастувидье в пуранах,Тюлина Елена Владимировна
c562db83b6a54add,PRES_R_2563e2d9,PRES_5058755e81,2019,Roerich Readings,"Семь сокровищ чакравартина и их пространственная локализация (палийский канон, «Артхашастра»)",Вырщиков Евгений Геннадьевич
c57aac45993ada17,PRES_R_4165f09b,PRES_db00ae9f93,2024,Roerich Readings,Похищение и возвращение жён в древнеиндийском эпосе и параллели в древнегреческих сюжетах,Молина Анна Валерьевна
c5e0cdb0868d3054,PRES_d0cc312d,PRES_63fbe719ca,2023,Zograf Readings,"«… Есть некая рыба, которая чюдовидна имать»: возможные истоки и неочевидные связи одного композитного существа индийской миниатюры.Танонова Елена Викторовна (Санкт-Петербург). Коллекция тамильских рукописей М.С. Андреева из Индийского фонда ИВР РАН.Соболева Елена Станиславовна (Санкт-Петербург). Этнографические сборы В.И. Липского на Цейлоне в начале XX в.Меренкова Ольга Николаевна (Санкт-Петербург). Вспомнить все: ганджифа и забытая карточная игра «Сидаста» из коллекции А.М. и Л.А. Мервартов.Воробьева Дарья Николаевна (Москва). Скульптура Нритья Шивы из храма Мандапешвара в Мумбаи. Стиль, иконография, аналогии.Рыжакова Светлана Игоревна (Москва). Падаяни, мудиетту, тиятту: ритуальные исполнительские традиции центральной Кералы",Бабин Александр Николаевич
c66e46658247baf1,PRES_165f966b,PRES_ed9a1d68a4,2018,Zograf Readings,Опись Л. А. Мерварт коллекции № 3015 в собрании МАЭ РАН как образец музейного документа,О. Н. Меренкова
c6f5c5f3f6c1c7a7,PRES_R_345a61ae,PRES_fac39ef4c3,2023,Roerich Readings,Представление о годе в концепции времени пуран,Тюлина Елена Владимировна
c6f7f5c4e5af5c9f,PRES_R_87bd3dcb,PRES_d81abe7262,2016,Roerich Readings,Всадник Шамбалы (танка из собрания Мемориального кабинета Ю.Н. Рериха ИВ РАН),Е. Д. Огнева
c720782da6707ca1,PRES_f4f2da27,PRES_5c60e6b93b,2018,Zograf Readings,«Тирумурейканда-пуранам» Умапати Шивачарьи как завершающее звено в формировании тамильского шиваитского канона,Вечерина Ольга Павловна
c73f94df335a12e8,PRES_R_5d4b30db,PRES_e78695056a,2022,Roerich Readings,Композиция «Апастамба-шраутасутры»: базовые ритуалы (prakṛti) и их модификации (vikṛti),Корнеева Наталья Афанасьевна
c7825194d55482a9,PRES_238b38d3,PRES_4318542bdb,2018,Zograf Readings,"Будда Дипанкара, идущий по дороге. Сюжеты пророчества в ранней буддийской литературе",Александрова Наталия Владимировна
c793dfd539089b64,PRES_baec6aac,PRES_300d41548c,2021,Zograf Readings,Высмеивание пороков врачей в санскритской литературе (на примере «Кали-видамбханам» Нилакантхи Дикшиты)*,Дружинин Владимир Юрьевич
c822fd68e3cc84a5,PRES_ee2149f1,PRES_ff14b5e1b1,2026,Zograf Readings,Идеи йогачары в трактате Асанги,Сергеева Варвара Алексеевна
c89e2eb3369ae0da,PRES_6656e15d,PRES_9bdb8b8f74,2020,Zograf Readings,Санскритские наречия в трудах бенгальских грамматистов (Дживы Госвамина и Баларамы Панчананы),Блиндерман Радха Тимуровна
c90206f58fbd19c4,PRES_cef67702,PRES_1aad145e2e,2021,Zograf Readings,О «новых» теориях действия в грамматических трудах Нагеши Бхатты*,Блиндерман Радха Тимуровна
c95fb376cbf3301e,PRES_3f3f68ac,PRES_051fdd066f,2011,Zograf Readings,Рабиндранат Тагор: уровни поэтического высказывания,Е. К. Бросалина
c9a158b8929cc7f4,PRES_cf69ba5f,PRES_61ff83090b,2013,Zograf Readings,Классификация наук в традиционной индийской культуре,Канаева Наталия Алексеевна
c9a8f3a6a1606067,PRES_234e2a9d,PRES_27d5137236,2025,Zograf Readings,Ауробиндо Гхош: между разумом и мистической интуицией,Канаева Наталия Алексеевна
c9f174da1b4094f1,PRES_R_4fd30b33,PRES_5757eb528f,2021,Roerich Readings,Зороастрийский культ огня и ритуалы парсов Индии,Мейтарчиян Маргарита Борисовна
caab05d53a179cde,PRES_R_1d8c59b1,PRES_d663349bc6,2019,Roerich Readings,Образ Ганеши в японском буддизме,Е. С. Лепехова
cad7f4f51518913a,PRES_ea14aac8,PRES_d9b27c46a3,2006,Zograf Readings,Интерпретация идей Упанишад у Раммохона Роя и Дебендронатха Тагора,Т. Т. Скороходова
cc0da71b41e65659,PRES_R_b0bf4834,PRES_cb07759015,2021,Roerich Readings,Любовные и религиозные мотивы в средневековой тамильской поэме «Тирукковейар» Маниккавасахара,Гордийчук Николай Валентинович
cc1f7f25a2688896,PRES_R_3e64fcca,PRES_45e96223ae,2015,Roerich Readings,Юрий Рерих и буддийский храм в Санкт- Петербурге,Шустова Алла Михайловна
cc485eaf5ba6ea21,PRES_R_46a9dd79,PRES_32147e6ef7,2020,Roerich Readings,Антропоморфная образность «игры знания»: телесная метафора и метафора путешествия,Кузина Елизавета Олеговна
cc84c64198f968d8,PRES_c2180c92,PRES_350ddf4b3d,2013,Zograf Readings,Восьмиугольные понятийные схемы в индийской рациональности,Парибок Андрей Всеволодович
cc9a90c0944630b5,PRES_R_2b0359c9,PRES_c1fdacd093,2020,Roerich Readings,Ю.Н. Рерих о кочевниках Тибета,Шустова Алла Михайловна
ccd791898f584731,PRES_8530c66a,PRES_ed67df80ce,2021,Zograf Readings,Народно-разговорная речь и приемы ее стилизации в поэзии североиндийского бхакти,Цветкова Софья Олеговна
cd9990c0564c9a33,PRES_R_ee6a7951,PRES_a8a16ef16d,2017,Roerich Readings,Тибетский идиом области Амдо в наши дни: между диалектом и языком,А.К. Васильев
cdff2e195ddc5333,PRES_R_ceb85bcc,PRES_cea6fbd627,2024,Roerich Readings,Новый поворот традиции шраута: Сагничит Трисахасра Атиратра Сомаяга 2024 в Западной Бенгалии,Корнеева Наталья Афанасьевна
ce0755bc965cb5e0,PRES_R_99ced854,PRES_03ba01428d,2025,Roerich Readings,Почему у монаха-дигамбара рог на голове? Попытка интерпретации одной строфы из философского диспута в прахасане «Латакамелака»,Комиссаров Дмитрий Андреевич
ce21e74a68ec5e98,PRES_2879f09b,PRES_9a27aa8159,2026,Zograf Readings,Сон Урмилы в современной индийской,Сабирова Римма Наилевна
ce88714f0cd3c262,PRES_af491948,PRES_5cac6ba63f,2025,Zograf Readings,Миф о Потопе и тыкве у дравидийских племен: к вопросу об истории контактов дравидов и мунда,Ренковская Евгения Алексеевна
cead6e4b00878beb,PRES_05b278ed,PRES_24c01dc791,2023,Zograf Readings,Дворец небесный и дворец земной: две схожие главы  «Лалитавистары» и их функциональная роль в общей композиции текста,Александрова Наталия Владимировна
cf40296c41693ba6,PRES_R_609dfb61,PRES_057148b120,2020,Roerich Readings,Некоторые особенности текстов по вастувидье в пуранах и их интерпретация в современной массовой культуре,Тюлина Елена Владимировна
cf70a520d2ab41c4,PRES_R_8f4ee2a0,PRES_eef2c4fdd5,2017,Roerich Readings,Синтаксические конструкции с ti и -bhāva в языке пали,Тавастшерна Сергей Сергеевич
cf765facfd0ae7d1,PRES_9c32394f,PRES_886b762cde,2026,Zograf Readings,Уроки Герхарда Оберхаммера. По,Парибок Андрей Всеволодович
cf923d3cf7070457,PRES_R_880ce8d4,PRES_c22bbf63b5,2018,Roerich Readings,Богиня с гхантой и гхатом. Дурга (?) в иконографической программе буддийского храма Аурангабада,Воробьева Дарья Николаевна
cf929762f41128c2,PRES_R_184cec36,PRES_ccd96b58d3,2016,Roerich Readings,Санскара «посвящение в ученики» (упанаяна): её место и значение в ряду других  санскар и в древней разработке стратификации индийского общества,Алешина Ирина Евгеньевна
cfaf329d29fe3a84,PRES_98d6de6b,PRES_6ab39301b6,2010,Zograf Readings,Ордалия раскаленной монетой (taptamàşa): текст и реальность,Корнеева Наталья Афанасьевна
d038eb25283ab499,PRES_84687ae9,PRES_91920b49ed,2006,Zograf Readings,Отряхивающийся ныряльщик: о специфическом фольклорном мотиве в эпических и пуранических версиях «Сказания о Вепре» (Varāha-kathā),Васильков Ярослав Владимирович
d044dec386030aeb,PRES_R_d6435afb,PRES_c335235106,2016,Roerich Readings,Мотив dad-u dām в могольском монаршем портрете: к вопросу о генезисе и семантике,Ю.Г. Атманова
d0517c40908a8f19,PRES_R_ad0c37ee,PRES_1b8041b089,2012,Roerich Readings,Песенная техника проповеди Миры Баи: подступы к исследованию,Цветкова Софья Олеговна
d074edff4cc76f7f,PRES_71dae6c6,PRES_eaf1e7f25e,2020,Zograf Readings,Инклюзивизм как концептуальное средство для изучения индийской культуры,Десницкая Евгения Алексеевна
d0f0ffe08aee2eac,PRES_29e81fdf,PRES_4bb5f8e666,2019,Zograf Readings,"Отношение к женщине в эпосе (на примере «Рамаяны» Вальмики, «Адбхута Рамаяны» и «Адхьятма Рамаяны»)",Сабирова Римма Наилевна
d1526b5ac1389f9f,PRES_4d9beacd,PRES_194e32b9e2,2025,Zograf Readings,Скрытое / явное: представления о знании у племенных народов Южной Карнатаки,Рыжакова Светлана Игоревна
d23ee90e11b99e45,PRES_R_7ad5a0ec,PRES_1afb02f3a1,2015,Roerich Readings,О термине татхагата в палийском каноне,Вырщиков Евгений Геннадьевич
d268e060ed1a9732,PRES_R_80104302,PRES_cb6eb89d97,2021,Roerich Readings,«История Тирумулара»: биография бхакта и биография сиддха,Вечерина Ольга Павловна
d27038dfab0e4f31,PRES_79062930,PRES_8fd3e69c9e,2020,Zograf Readings,О философской и религиозной значимости некоторых текстов Веданта Дешики,Сафина Наталья Алексеевна
d289b53625fcc3a1,PRES_8c10cac7,PRES_c64a8b5a2f,2026,Zograf Readings,Синтез сложных слов tatpuruṣa и,Волошина Оксана Анатольевна
d2dccf503081a1f3,PRES_R_75067781,PRES_07f5f9116f,2017,Roerich Readings,Первые известные изображения раг. Тексты и контекст,Бабин Александр Николаевич
d2df15bc033bd972,PRES_7a5224cf,PRES_36689fddb2,2025,Zograf Readings,Женщины и сатьяграха: взгляд М. К. Ганди,Битинайте Елена Алексеевна
d316e22b87828176,PRES_R_78032944,PRES_f9a02b263c,2021,Roerich Readings,Образы бодхисаттвы Авалокитешвары в коллекции Кабинета Рериха: Авалокитешвара – податель прозрения,Е. Д. Огнева
d334b9ea40c62b0e,PRES_358ed5d9,PRES_55f1bca92b,2013,Zograf Readings,Современные баулы: от деревни до концертного зала,Донченко Сергей Сергеевич
d442cb17b1165602,PRES_4b1fd1ab,PRES_64860927de,2012,Zograf Readings,Загадки поэмы Джаяси «Падмават»,Цветкова Софья Олеговна
