stable_key_candidate,before_presentation_id,after_presentation_id,year,series,title,first_speaker
003c390e8b4fc03f,PRES_d3d56cbc,PRES_389fc0cde7,2022,Zograf Readings,Многообразие,Столярова Екатерина Владимировна
004cfc121d86f360,PRES_R_97f8e59c,PRES_8ce3960b91,2019,Roerich Readings,Монгольские ритуалы в русских летописях,Дробышев Юлий Игорьевич
00b2e00b5c4f19de,PRES_afa7db1a,PRES_c6225fb22a,2012,Zograf Readings,Живая традиция ритуальных росписей Питхоро в Гуджарате: полевые данные 2012 г,К. М. Воздиган
0117b23ba7e0464e,PRES_R_3d31659c,PRES_eac815faab,2015,Roerich Readings,"Белый Старец. Танка из коллекции Кабинета Юрия Рериха (ИВ РАН, Москва)",Е. Д. Огнева
0144555269ca18a4,PRES_800dbabd,PRES_16588312ee,2011,Zograf Readings,Индия в поэзии йафиитов (Южная Аравия),М. А. Родионов
019f147efbb842b1,PRES_8fb19167,PRES_40d25e452d,2025,Zograf Readings,Анализ переводов М. Зощенко на хинди и на бенгали с помощью метрик readability,Гладкова Анна Геннадьевна
01e5254b1b339aee,PRES_R_8ded9203,PRES_c252ed4677,2017,Roerich Readings,Из санскритской поэзии,Тавастшерна Сергей Сергеевич
01f65ca50d4a8367,PRES_672cfbf5,PRES_bf17912568,2011,Zograf Readings,Саттрия: рождение нового индийского классического танца в Ассаме,Рыжакова Светлана Игоревна
020cada110122841,PRES_R_32fe357b,PRES_24fc2e1142,2012,Roerich Readings,Сновидение в древнеиндийских философских текстах,Е.С. Юдицкая
0265c47f6a0730c6,PRES_R_37052668,PRES_50a3bd5e05,2020,Roerich Readings,Мотивный анализ сюжета «Джатаки о павлине» Харибхатты (IV–V вв. н.э.),Фивейская Анастасия Васильевна
02c258f0728917d6,PRES_R_ca4a3dda,PRES_3be5cd2d6b,2016,Roerich Readings,Китайские переводы ранних буддийских сутр: возможности реконструкции истории индийского текста,Александрова Наталия Владимировна
02d428838c84bd85,PRES_R_e6bd9258,PRES_13e9ef2756,2018,Roerich Readings,Тибетский принцип чой-йон и его значение для тибето-цинских отношений,Люлина Анастасия Геннадьевна
02f26d58681d881d,PRES_992951f7,PRES_50741659fb,2018,Zograf Readings,Индийские истоки тибетской историографии буддизма,Островская Елена Петровна
03990b64877efff5,PRES_e91ce68a,PRES_bc466ed694,2004,Zograf Readings,Буддизм в творчестве Джаяшанкара Прасада,Г. В. Стрелкова
03b5c03840cdc028,PRES_R_ff717a1a,PRES_8f9fdee289,2024,Roerich Readings,«Наука поэзии» (Кавьяшастра) в трудах ранних аланкариков,Лидова Наталья Ростиславовна
03c093c8989783b3,PRES_a3278541,PRES_17636e7871,2022,Zograf Readings,,Дружинин Владимир Юрьевич
045d38b95048ec62,PRES_R_28b24732,PRES_f54075bda2,2021,Roerich Readings,Вклад Ю.Н. Рериха в формирование «транскультурного пространства» Калимпонга (1950-е гг. ХХ в.),Д. А. Кораблин
04a7e60698508df8,PRES_08022065,PRES_13b1475949,2019,Zograf Readings,Структура «Чарья-гити»,Е. К. Бросалина
04bf3f7d5e1af2e5,PRES_2ff412ca,PRES_0a4999b088,2025,Zograf Readings,Бенгальский стихотворный размер пояр и его разновидности,Донченко Сергей Сергеевич
04c3a61c6647aa0d,PRES_R_03c4fc3a,PRES_760ec0f422,2019,Roerich Readings,Роль представителя династии Тхакури (Тхакуджуджу) в ритуальной передаче власти в Непале,К. П. Шрестха
04f38d4655b36f25,PRES_940eec2c,PRES_56c1074977,2020,Zograf Readings,Тело бхакта и тело Шивы: о проблемах телесности в тамильском шайва-бхакти,Вечерина Ольга Павловна
059ddca02a0255d0,PRES_R_060da5b4,PRES_a0c39c4f08,2024,Roerich Readings,Индийские классификации: принципы различения поэтических украшений (аланкар),Цветкова Софья Олеговна
070a0f0490023d17,PRES_16570529,PRES_931d8f87e4,2018,Zograf Readings,Культ Рудры-Кхандобы в исследованиях Г. Д. Зонтхаймера  и его индоевропейские параллели,И. О. Негреев
0738401b5d6cb652,PRES_fe449d06,PRES_fdb9592886,2026,Zograf Readings,Структура ниданы,Шомахмадов Сафарали Хайбуллоевич
076b2734b511e731,PRES_5c61cc35,PRES_395527e78e,2013,Zograf Readings,О формульности надписей на санскрите,Д. Н. Лелюхин
07a57c7caca6e3f3,PRES_R_18918575,PRES_63d939b5e4,2025,Roerich Readings,Описание Центральной Азии в «Хождении в пять индийских царств»,А.В. Мрачковская
07ab9b827a4db8d3,PRES_7c5773f3,PRES_d68918076d,2026,Zograf Readings,"""Башни с нишами"" в",Яковлева Мария Николаевна
07b1fda8b42c1168,PRES_R_0d30cb27,PRES_308af4a879,2015,Roerich Readings,Язык жреца – язык поэта. О сакральности речи в древнейших формах санскритской драмы,Лидова Наталья Ростиславовна
07f06eee3a5b7336,PRES_6444852b,PRES_fe1a75c2f9,2014,Zograf Readings,Концепция «марьяда» в непальских надписях,Д. Н. Лелюхин
07f5ee1979baf6e4,PRES_038dcba4,PRES_7afa05ea24,2020,Zograf Readings,Так называемый парадокс беллетристики и подсказки от компаративной онтологии,Шохин Владимир Кириллович
084bdf3f69c0fa7b,PRES_984baa39,PRES_74912d68fa,2025,Zograf Readings,"Начальный сюжет в житийной литературе раннего буддизма, его вариативность и смысловое наполнение",Александрова Наталия Владимировна
08a9ee455747d8f0,PRES_c14aa4be,PRES_379d455d28,2022,Zograf Readings,Комментарий,Митруев Бембя Леонидович
095251643a14a02c,PRES_R_87b0e196,PRES_26686316fa,2012,Roerich Readings,О формульности индийских дарственных надписей,Д. Н. Лелюхин
0a41c991afd503b5,PRES_821dca60,PRES_f3f19a5e54,2019,Zograf Readings,«Унмада нирукта». «Безумная этимология»: об особенностях мистической герменевтики тантры (на примере интерпретации первой мангала-шлоки «Тантралоки»),Ерченков Олег Николаевич
0abd74d09811a3bf,PRES_988474cb,PRES_9b4055ea0a,2019,Zograf Readings,«Гадья» Рамануджи: венец или крест исследователя философии вишишта-адвайты?,Псху Рузана Владимировна
0b22cae52e53cf8a,PRES_R_25778f9b,PRES_d4444092a0,2025,Roerich Readings,Сита и Агни в «Рамаяне» Вальмики,Молина Анна Валерьевна
0b26ddac1be74d51,PRES_R_e5243da2,PRES_890a83cc48,2016,Roerich Readings,Европейская феноменология и буддизм в свете спора представителей кашмирской школы Пратьябхиджня с буддистами,С. Ч. Офертас
0bb71bed4b77af9d,PRES_ae4ba125,PRES_66a1a7d2f9,2011,Zograf Readings,О первых христианских миссионерах в Индии,Альбедиль Маргарита Федоровна
0c1343c2f742d91d,PRES_74ec0111,PRES_c99c7b6baa,2026,Zograf Readings,Тело агхори как «живой текст»:,Грановская Хелена
0c1bffcc7418502a,PRES_R_b4bd26e4,PRES_0918cfcb68,2017,Roerich Readings,Смена мотивировок в средневековом тексте: две «Рамаяны»,Гурия Анастасия Георгиевна
0c1edb577e431ffa,PRES_259fdcdf,PRES_360aa3df49,2018,Zograf Readings,«Функциональный подход» в «Вакьяпадии» и артхакрия в философии Дхармакирти,Десницкая Евгения Алексеевна
0c6f5a4cfb439d79,PRES_R_eb48a639,PRES_547038e275,2012,Roerich Readings,Летописный текст и  феномен «изображение» в буддийской традиции Тибета,В.В. Деменова
0d9297ba34f7617c,PRES_R_1e2d1afd,PRES_740b15bcbd,2017,Roerich Readings,Место и роль Сундарара в структуре шиваитского канона «Панниру Тирумурей»,Вечерина Ольга Павловна
0da55edf872f0c89,PRES_5d4ff5ea,PRES_52d48212b9,2026,Zograf Readings,Имперфект в древнеиндийском,Егорова Мария Александровна
0dc778887bc3329a,PRES_R_3d7a19db,PRES_bf0a2a24f6,2017,Roerich Readings,Переводы стихов на язык непали,К. П. Шрестха
0ddce7f6d50888c8,PRES_09e6d773,PRES_644c4b2790,2021,Zograf Readings,Проблемы датировки «Нандикешваракашики»*,Кавалевская А. П.
0df77956fe55e1f9,PRES_R_b7ee4c74,PRES_a50be852d6,2024,Roerich Readings,Сюжет «обращения братьев Кашьяпов» в «Сутре о благом явлении царевича»: неожиданные повороты,Александрова Наталия Владимировна
0e181da40a62ca48,PRES_R_b902842f,PRES_87cf54f9ed,2012,Roerich Readings,Рамаяна в драме Бхавабхути «Последние приключения Рамы»,Ю. М. Алиханова
0e1965b508b08491,PRES_135cc058,PRES_a91350387c,2022,Zograf Readings,Формирование,Бурмистров Сергей Леонидович
0e5d98fb61e4c828,PRES_866a9268,PRES_48313a6d1c,2018,Zograf Readings,Мантра и сутра как форма построения ведийских текстов,Волошина Оксана Анатольевна
0f17e82bfa3f46ab,PRES_eb16f8d4,PRES_79ea7ca652,2007,Zograf Readings,В чем непосредственность непосредственного восприятия в буддийской эпистемологии?,Лысенко Виктория Георгиевна
0f6ac46e53979dad,PRES_4e477951,PRES_f5acc41768,2014,Zograf Readings,"Мандала-классификация нечестных трансакций в ответ на упрек (Ангуттара-никая. Аттаканипата, Ассаколанкасутта)",Парибок Андрей Всеволодович
0f780829ac0215d0,PRES_c6c3a710,PRES_3e654ff62e,2019,Zograf Readings,Почитание Индры в Непале: живая архаика,Альбедиль Маргарита Федоровна
0f98fecac1e36fed,PRES_5960f079,PRES_934a1b4566,2012,Zograf Readings,Эволюция жанра шахрашуб в контексте взаимодействия персоязычной литературы и литературы урду,Е. О. Акимушкина
100c366c9cc0b991,PRES_9f0d77c9,PRES_0bfeb36e60,2004,Zograf Readings,Психология акта самопожертвования в изображении драматургов 7-го века,Ю. М. Алиханова
100d0d9f862302b5,PRES_66bc8c24,PRES_af48d5b07b,2011,Zograf Readings,Половозрастная стратификация общества в ведийских текстах,Кулланда Сергей Всеволодович
10a7d173f969fab1,PRES_R_b36cc092,PRES_fd3ad39262,2018,Roerich Readings,Деепричастия пассивного залога в языке пали?,Тавастшерна Сергей Сергеевич
11311c1a66df576c,PRES_9b9a1c17,PRES_6af1acb57b,2014,Zograf Readings,О стереотипизации адиваси в популярной культуре Индии,К. М. Воздиган
1182344e6ffb4587,PRES_6e26e3fe,PRES_9e5fcc2f80,2018,Zograf Readings,«Чариягити» и Тагор,Е. К. Бросалина
11fe1ee6a3d32741,PRES_878079a4,PRES_dcbbb14e70,2022,Zograf Readings,Новый,Челнокова Анна Витальевна
12635051085db1c2,PRES_R_2cb7a2b8,PRES_009c33d727,2017,Roerich Readings,Дивьядхвани и девадундубхи – иконографические мотивы божественной музыки в джайнской скульптуре Эллоры,Воробьева Дарья Николаевна
13211ca75810d33c,PRES_bfb01e9a,PRES_7ce3a86c44,2004,Zograf Readings,Проблема интерпретации специальной санскритской терминологии: термин адхьякша в индийской традиции,Д. Н. Лелюхин
134db429549b563b,PRES_ebd7827e,PRES_1b4474c750,2019,Zograf Readings,"Серайкела, Майюрбхандж, Пурулиа: феномен чхау на плато Чхота Нагпур (Восточная Индия)",Рыжакова Светлана Игоревна
13c693031e3a09bd,PRES_05ba7f9d,PRES_3c44662ea5,2019,Zograf Readings,Индийские и тибетские лингвистические штудии Д. Г. Мессершмидта,Зорин Алексей Валерьевич
13e4f3a399be90a4,PRES_R_da5a3da9,PRES_c577b567c6,2017,Roerich Readings,Война в контексте истории буддистов-ойратов,Б. У. Китинов
14019d0bff2e6ff3,PRES_06716aa5,PRES_8ca7e6ff9c,2021,Zograf Readings,Истоки учения о Шри в вишишта-адвайта веданте,Сафина Наталья Алексеевна
143adb6bbff14ba1,PRES_R_5f899ff5,PRES_86f5eb1636,2024,Roerich Readings,Ведантийско-буддийский полемический диалог в «Брахмасутрабхашье»,Шохин Владимир Кириллович
144d60932ed73d40,PRES_6110f747,PRES_904488052d,2012,Zograf Readings,«Кадамбари» в современном мире,Г. В. Стрелкова
145393da7a18a449,PRES_3d480e39,PRES_323891f8b1,2021,Zograf Readings,Полемика с мимансаками об атмане в «Таттвасанграхе» Шантаракшиты*,Титлин Лев Игоревич
146c14a915fc5a2d,PRES_be54663b,PRES_0f9cca576d,2020,Zograf Readings,Буддизм пудгалавады: к постановке вопроса о субъекте-пудгале,Титлин Лев Игоревич
155df64fcda3030f,PRES_1d34300e,PRES_9231a2dc0e,2014,Zograf Readings,Гимн-падигам как основная форма поэзии тамильских шиваитов,М. Б. Павлова
15d840b03b57f615,PRES_896f71fb,PRES_bbeb5e1fd0,2006,Zograf Readings,Тема деревни в «Саттасаи»,М. Н. Русанов
15f538f53f4cd4c1,PRES_R_de9bc325,PRES_5affb90467,2019,Roerich Readings,«Белые шапки»: интерпретации и эндемичность религиозного символа в начале XVIII в,Б. У. Китинов
162ad897769839a7,PRES_R_a88fa2d9,PRES_0ced3d6edc,2022,Roerich Readings,", Б.У. Китинов (ИВ РАН). «Стела монастыря Шакья 释迦院碑» 1257 г. в Монголии – изучение и анализ текста",Люлина Анастасия Геннадьевна
167cd592c9672622,PRES_39134063,PRES_ab5d7b5980,2026,Zograf Readings,Седукова Надежда Александровна,Мотылёва Вера Леонидовна
16ebb1d50995e4ec,PRES_f3d386c6,PRES_a3785cbf61,2010,Zograf Readings,«Рагхуванша» Калидасы глазами тамилиста,Дубянский Александр Михайлович
179b0adc4065eac1,PRES_00ede10e,PRES_c6a9e18c17,2026,Zograf Readings,"Санньяса и Брахмалока: смерть,",Толчельников Иван Евгеньевич
182a9d82557125a2,PRES_e4c3ad00,PRES_3c024b664d,2007,Zograf Readings,Индийские памятники героям в сравнительном освещении (К вопросу о материальном соответствии поэтической формуле «непреходящая слава»),Васильков Ярослав Владимирович
18b95e8eae6de4dc,PRES_e0c00c71,PRES_2ded0b9ab3,2021,Zograf Readings,«Йога-сутры» Патанджали в арабском переводе ал-Бируни,Псху Рузана Владимировна
18dbf3b974c4f8d4,PRES_R_60e21cc6,PRES_2ae8aa3f07,2018,Roerich Readings,Традиция «Лалитавистары» и ее истоки. Новые наблюдения,Александрова Наталия Владимировна
1928c7d1f82f75e7,PRES_29d33871,PRES_fcb0dcecb9,2020,Zograf Readings,О телесном и духовном бессмертии в индуистском тантризме,Пахомов Сергей Владимирович
194f570d4f6e02fa,PRES_df29073b,PRES_7016188270,2012,Zograf Readings,Особенности композиции «Апастамба-дхармасутры»,Корнеева Наталья Афанасьевна
19bbe9219f499f05,PRES_1a3f9d5a,PRES_42441dd422,2026,Zograf Readings,«Местный колорит» в,Кешарпу Екатерина Витальевна
1a04ce102331eb1b,PRES_d2879f2e,PRES_ac3485128f,2007,Zograf Readings,Теоретические аспекты учения тантрической школы кула (согласно «Куларнава-тантре»),Пахомов Сергей Владимирович
1ad0b6449bf77dca,PRES_R_b4c48e50,PRES_9214fca7b0,2025,Roerich Readings,Треугольник Паскаля или Пингалы?,Уланский Евгений Андреевич
1ae0cb3df3247296,PRES_R_9b890689,PRES_0ad2cb23b2,2012,Roerich Readings,К проблеме складывания сикхского двора и придворной культуры при последних шести гуру,Демичев Кирилл Андреевич
1b2bfa81f14bd72f,PRES_c7fba1bf,PRES_31585d391a,2007,Zograf Readings,К вопросу о статусе «естественного описания» в индийской поэтике,Цветкова Софья Олеговна
1c01f3dd05a411f3,PRES_0c579250,PRES_a8e1836f19,2011,Zograf Readings,"«Юные» в окружении царя Раджасинхи II—го (XVII век, Шри Ланка)",Краснодембская Нина Георгиевна
1c4b47d1497da4ec,PRES_f667db13,PRES_e239e18e90,2026,Zograf Readings,Метод кодировки чисел в трудах,Федорова Наталья Леонидовна
1d45512f9be0b536,PRES_f1d0c639,PRES_92c5238532,2021,Zograf Readings,Конструкция odanam pacyate и ее анализ в традиции Панини*,Клебанов Андрей Александрович
1d4bf41a5ac00e26,PRES_522e7b85,PRES_b6c7816c84,2021,Zograf Readings,«Давай поженимся»: Свадебные ритуалы в неварском буддизме*,Рыбакова Анна Геннадьевна
1d5a9b3d7be91cce,PRES_R_6a016720,PRES_71bb657d88,2015,Roerich Readings,Изменение межкастовых взаимоотношений в домусульманском Кашмире,Т.П. Селиванова
1e071f1894680033,PRES_b7d5d14d,PRES_18734ace5e,2014,Zograf Readings,Ранние китайские версии биографии Будды: сюжет подношения рисовой каши,Александрова Наталия Владимировна
1ec79dbe5e344541,PRES_f21a7cd8,PRES_ada012ff20,2013,Zograf Readings,Реальное и ирреальное в «„Новой поэзии“ хинди»,Стрельцова Лилия Александровна
1f636a7b7b16e01a,PRES_R_cb10ca87,PRES_b7601c078f,2012,Roerich Readings,Танцовщица и покровитель: начни и расик восточных областей Индии. Контексты взаимоотношений,Рыжакова Светлана Игоревна
1f8df7caad52a1c8,PRES_fd12be88,PRES_971efcd244,2013,Zograf Readings,"Материальные атрибуты (лук, стрелы, топорик) как этнические символы автохтонов Шри Ланки",Зимина Татьяна Александровна
1f988b1f1642b3e9,PRES_fb9d3356,PRES_1e61c2de20,2020,Zograf Readings,Традиции и ритуалы почитания манускриптов в писаниях шайва,Ковалевская Анна Петровна
1fd820d995410ee8,PRES_4599f027,PRES_87af30a035,2026,Zograf Readings,А.А. Сталь-Гольштейн,Ермакова Татьяна Викторовна
2093c2ecab9a3c1d,PRES_588ca6ba,PRES_f5f80ef798,2025,Zograf Readings,Опровержение позиции вайшешики Дигнагой,Лысенко Виктория Георгиевна
210649683321a7c5,PRES_8ef6e23c,PRES_bd3e085c3b,2023,Zograf Readings,О не-волшебной помощнице в сказках парья: вариант фольклорного мотива.Комиссаров Дмитрий Алексеевич (Москва). Склонность к конфликтам в образе Махакашьяпы в буддийских канонических текстах,Оранская Татьяна Иосифовна
2119c2f2c2fdfd93,PRES_R_53957cce,PRES_ebf69480a0,2016,Roerich Readings,"Восхождение на Кайласу. История шайва-бхактов Сундарара и Черамана Перумаля, рассказанная в «Перияпуранам» Секкижара и на фреске храма Брихадишвары в Танджоре",Вечерина Ольга Павловна
216f7a2e3c079dad,PRES_d06b0f74,PRES_d3b23ec3c6,2019,Zograf Readings,Каталоги знаков хараппской письменности: материалы к сравнению,Коровина Евгения Владимировна
220075e6e6586824,PRES_R_17235edc,PRES_2cb61d70ff,2018,Roerich Readings,Брахмадева и его комментарий к «Дравья-санграха-вритти» в контексте джайнской текстовой традиции,Железнова Наталья Анатольевна
22545fdb95668b14,PRES_3b6fbd2b,PRES_8a0a019807,2010,Zograf Readings,Сравнительный анализ генезиса рефлексии в индийской и европейской философских традициях: визуальные и лингвистические детерминанты,Д. О. Парамонов
2267c73446d0dd1f,PRES_b18abbca,PRES_1ddfb0bbad,2013,Zograf Readings,Элементы культурного синтеза в бенгальской поэзии XVII века,Е. К. Бросалина
22a2055d97c587f3,PRES_9f1617f6,PRES_207ea236b7,2023,Zograf Readings,Об особенностях индийской философии на основе южноазиатской схемы рациональности.Лысенко Виктория Георгиевна (Москва). Трудности в изучении философского наследия Дигнаги: опыт переводчика и историка философии.Псху Рузана Владимировна (Москва). Переоценка различных методологических подходов по исследованию индийской философии: по следам книги В. Адлури и Д. Багчи «The Nay Science: A History of German Indology».Лобанов Сергей Владимирович (Москва). Проблема интерпретации действия в комментарии Шанкары на Бхагавадгиту,Парибок Андрей Всеволодович
22f0560a0c9f5a2d,PRES_8966ceca,PRES_93f7fb72c9,2018,Zograf Readings,Родство по крови и родство по духу: М. К. Ганди о мотивах отказа Арджуны от сражения,Битинайте Елена Алексеевна
