presentation_id,year,series,title,existing_theme_code,l1_baseline,l1_conf,l3_baseline,l3_conf,review_status,notes
PRES_ffd2c4b14a,2020,Roerich Readings,Две тханки из собрания И.П. Минаева (МАЭ РАН) и традиция странствующих рассказчиков (лама манипа) в Гималайском регионе,unspecified,unspecified,0.0,unspecified,0.0,todo,Mapped from old baseline
PRES_54c018c9f5,2020,Roerich Readings,Некоторые особенности праздника семи неварских селений юго-западной части Долины Катманду,unspecified,unspecified,0.0,unspecified,0.0,todo,Mapped from old baseline
PRES_15b5fbdc83,2020,Roerich Readings,Что отличает индийскую эпистемическую культуру от западной?,unspecified,unspecified,0.0,unspecified,0.0,todo,Mapped from old baseline
PRES_23ce849cd3,2020,Roerich Readings,Некоторые особенности текстов по вастувидье в пуранах и их интерпретация в современной массовой культуре,unspecified,unspecified,0.0,unspecified,0.0,todo,Mapped from old baseline
PRES_4222cc5294,2020,Roerich Readings,Проблемы атомизма по «Вимшике» Васубандху и «Аламбана-парикше» Дигнаги,unspecified,unspecified,0.0,unspecified,0.0,todo,Mapped from old baseline
PRES_492441fb51,2020,Roerich Readings,Небывальщины и парадоксы в древнеиндийской поэзии,literature_and_poetry,,0.0,,0.0,todo,
PRES_37b0efbebb,2020,Roerich Readings,Поэтический цикл Кабилара о князе Пари,unspecified,unspecified,0.0,unspecified,0.0,todo,Mapped from old baseline
PRES_5927c1b975,2020,Roerich Readings,О некоторых основных понятиях пратьябхиджни,unspecified,unspecified,0.0,unspecified,0.0,todo,Mapped from old baseline
PRES_89290bf4b4,2019,Zograf Readings,Парибхаша — интерпретационные правила грамматики Панини,linguistics_and_philology,,0.0,,0.0,todo,
PRES_8c7d8555e5,2019,Zograf Readings,Реминисценции мифа Вала в припамирском регионе,unspecified,unspecified,0.0,unspecified,0.0,todo,Mapped from old baseline
PRES_a0ad164252,2019,Zograf Readings,Британское колониальное чиновничество в литературном наследии Дж. Оруэлла,literature_and_poetry,,0.0,,0.0,todo,
PRES_3bdb9503d4,2019,Zograf Readings,Атман как синоним дравьи в «Вакьяпадии» (ВП 3.2.1),unspecified,unspecified,0.0,unspecified,0.0,todo,Mapped from old baseline
PRES_4f163c69ab,2019,Zograf Readings,Понимание искусства в учении Ошо,unspecified,unspecified,0.0,unspecified,0.0,todo,Mapped from old baseline
PRES_c5e6e276eb,2019,Zograf Readings,Этико-интуитивистский подход М.К. Ганди к пониманию традиционных текстов,unspecified,unspecified,0.0,unspecified,0.0,todo,Mapped from old baseline
PRES_d26f35d7c4,2019,Zograf Readings,Роль Умапати Шивачарьи в формировании окончательной редакции канона шайва-сиддханты,unspecified,unspecified,0.0,unspecified,0.0,todo,Mapped from old baseline
PRES_5828dbb0bc,2019,Zograf Readings,Структура «Чарья-гити»,unspecified,unspecified,0.0,unspecified,0.0,todo,Mapped from old baseline
PRES_d4e401111e,2019,Zograf Readings,Трансформации культурной идентичности парсов Бомбея,unspecified,unspecified,0.0,unspecified,0.0,todo,Mapped from old baseline
PRES_e62fab8a32,2019,Zograf Readings,Современные баулы: мистики или артисты,unspecified,unspecified,0.0,unspecified,0.0,todo,Mapped from old baseline
PRES_109df3d4a0,2019,Zograf Readings,"Народные песни о Хардоле, принце Орччхи",unspecified,unspecified,0.0,unspecified,0.0,todo,Mapped from old baseline
PRES_2996ce6acf,2019,Zograf Readings,О некоторых специфических жестах в бытовом этикете сингалов,unspecified,unspecified,0.0,unspecified,0.0,todo,Mapped from old baseline
PRES_4b661944b6,2019,Zograf Readings,Элементы шаманских практик в воинских традициях Индии,unspecified,unspecified,0.0,unspecified,0.0,todo,Mapped from old baseline
PRES_5dc51ccca1,2019,Zograf Readings,Почитание Индры в Непале: живая архаика,unspecified,unspecified,0.0,unspecified,0.0,todo,Mapped from old baseline
PRES_7ab7bd7cb2,2019,Zograf Readings,Функции вождя в традиционном обществе веддов в прошлом и настоящем,unspecified,unspecified,0.0,unspecified,0.0,todo,Mapped from old baseline
PRES_8f2ec6926d,2019,Zograf Readings,Каталоги знаков хараппской письменности: материалы к сравнению,unspecified,unspecified,0.0,unspecified,0.0,todo,Mapped from old baseline
PRES_aa6a4858fc,2019,Zograf Readings,Мифология танца и образ Индры в джайнизме,religion_and_philosophy,,0.0,,0.0,todo,
PRES_c82fd78b93,2019,Zograf Readings,"Серайкела, Майюрбхандж, Пурулиа: феномен чхау на плато Чхота Нагпур (Восточная Индия)",unspecified,unspecified,0.0,unspecified,0.0,todo,Mapped from old baseline
PRES_0f8aeee7b2,2019,Roerich Readings,Музыкальные колонны Южной Индии,unspecified,unspecified,0.0,unspecified,0.0,todo,Mapped from old baseline
PRES_40c79b3a10,2019,Roerich Readings,"О стихах, приписываемых Бхартрихари",unspecified,unspecified,0.0,unspecified,0.0,todo,Mapped from old baseline
PRES_6274f89872,2019,Roerich Readings,Вербальный панегирик индийского монаршего портрета эпохи Моголов. 9.12.19,unspecified,unspecified,0.0,unspecified,0.0,todo,Mapped from old baseline
PRES_787d114bd2,2019,Roerich Readings,«Цветомыслие» в Древней Индии (вербальный текст и стенопись),unspecified,unspecified,0.0,unspecified,0.0,todo,Mapped from old baseline
PRES_8402d54487,2019,Roerich Readings,Дайва-арадхана Тулунаду (Южная Индия): сценарий и воплощение,unspecified,unspecified,0.0,unspecified,0.0,todo,Mapped from old baseline
PRES_914c6126f3,2019,Roerich Readings,Старый парк Пушпакарандаки (одна из загадок «Глиняной повозки»),unspecified,unspecified,0.0,unspecified,0.0,todo,Mapped from old baseline
PRES_b3fefc9375,2019,Roerich Readings,Восхваление табака в поэме «Пухейилей видутуду» тамильского поэта Сини Саккарей Пулавара,unspecified,unspecified,0.0,unspecified,0.0,todo,Mapped from old baseline
PRES_bda473a7a5,2019,Roerich Readings,"Семь сокровищ чакравартина и их пространственная локализация (палийский канон, «Артхашастра»)",unspecified,unspecified,0.0,unspecified,0.0,todo,Mapped from old baseline
PRES_c0a5930788,2019,Roerich Readings,К вопросу о дхарани и Дхаранипитаке,unspecified,unspecified,0.0,unspecified,0.0,todo,Mapped from old baseline
PRES_e09ac364ea,2019,Roerich Readings,Фронтальное и трёхчетвертное изображение лица в западно-индийской миниатюре XII–XV вв,unspecified,unspecified,0.0,unspecified,0.0,todo,Mapped from old baseline
PRES_f9cfeb6efc,2019,Roerich Readings,«Белые шапки»: интерпретации и эндемичность религиозного символа в начале XVIII в,unspecified,unspecified,0.0,unspecified,0.0,todo,Mapped from old baseline
PRES_14bfa123b5,2018,Zograf Readings,Путешествие И. П. Минаева в Непал: обстоятельства и результаты,history_and_culture,,0.0,,0.0,todo,
PRES_b31fdcce35,2018,Zograf Readings,Обучение Бодхисаттвы в «Лалитавистаре»,unspecified,unspecified,0.0,unspecified,0.0,todo,Mapped from old baseline
PRES_3e0cb6e9f2,2018,Zograf Readings,"Содержательное обоснование порядка в перечне прамей (Ньяя-сутра, Ньяя-бхашья)",religion_and_philosophy,,0.0,,0.0,todo,
PRES_65f6503bf8,2018,Zograf Readings,Концепция причинности в текстах «Абхидхамма-питаки»,unspecified,unspecified,0.0,unspecified,0.0,todo,Mapped from old baseline
PRES_72334d3683,2018,Zograf Readings,«Мысленный эксперимент» Васубандху,unspecified,unspecified,0.0,unspecified,0.0,todo,Mapped from old baseline
PRES_cdd11d4e20,2018,Zograf Readings,Сравнительный анализ образов сакрального в тамильских храмовых мифах и в сказах П. П. Бажова,religion_and_philosophy,,0.0,,0.0,todo,
PRES_55ef7cbfd8,2018,Zograf Readings,Два новых сборника «индийских текстов» Далджита Награ,unspecified,unspecified,0.0,unspecified,0.0,todo,Mapped from old baseline
PRES_003d1790e6,2018,Zograf Readings,Опись Л. А. Мерварт коллекции № 3015 в собрании МАЭ РАН как образец музейного документа,history_and_culture,,0.0,,0.0,todo,
PRES_12ec234be3,2018,Zograf Readings,Mārganātyam. Театральная практика и теория «Натьяшастры» сегодня,unspecified,unspecified,0.0,unspecified,0.0,todo,Mapped from old baseline
PRES_1fe8cfb29c,2018,Zograf Readings,Музыкальные инструменты в руках богов. К вопросу об иконографических атрибутах в искусстве Индии V—Х вв,religion_and_philosophy,,0.0,,0.0,todo,
PRES_a6921c45d9,2018,Zograf Readings,Культ Рудры-Кхандобы в исследованиях Г. Д. Зонтхаймера и его индоевропейские параллели,unspecified,,0.0,,0.0,todo,
PRES_c8fbaa4af7,2018,Zograf Readings,Ведды в современном укладе жизни Шри Ланки,unspecified,unspecified,0.0,unspecified,0.0,todo,Mapped from old baseline
PRES_dc8dcc77cd,2018,Zograf Readings,Меч-посох из собрания МАЭ,unspecified,unspecified,0.0,unspecified,0.0,todo,Mapped from old baseline
PRES_f6eb9ee12e,2018,Zograf Readings,Тамильская пьеса о Карне,unspecified,unspecified,0.0,unspecified,0.0,todo,Mapped from old baseline
PRES_0285ee0cb7,2018,Roerich Readings,Традиция «Лалитавистары» и ее истоки. Новые наблюдения,unspecified,unspecified,0.0,unspecified,0.0,todo,Mapped from old baseline
PRES_10d033beaa,2018,Roerich Readings,«Ратнавали» Нагарджуны и «Дашабхумика-сутра»: явные и неявные связи,unspecified,unspecified,0.0,unspecified,0.0,todo,Mapped from old baseline
PRES_26341e4a7b,2018,Roerich Readings,«Видимый» и «невидимый» мир в теоретико-культурном дискурсе Древней Индии,unspecified,unspecified,0.0,unspecified,0.0,todo,Mapped from old baseline
PRES_3f663f57ec,2018,Roerich Readings,Вода и водоемы в трактатах по вастувидье в пуранах,unspecified,unspecified,0.0,unspecified,0.0,todo,Mapped from old baseline
PRES_43bdc7ab3f,2018,Roerich Readings,Индийские нумерационные системы. По материалам трактата Махавирачарьи «Собрание основных положений науки о вычислениях» (сер. IX в.),unspecified,unspecified,0.0,unspecified,0.0,todo,Mapped from old baseline
PRES_454d44aaed,2018,Roerich Readings,Еще раз к вопросу о сандаловой статуе Будды,unspecified,unspecified,0.0,unspecified,0.0,todo,Mapped from old baseline
PRES_6329aa3fb2,2018,Roerich Readings,Чидамбарам и его дикшитары в зеркале «Панниру тирумурей»,unspecified,unspecified,0.0,unspecified,0.0,todo,Mapped from old baseline
PRES_9ecbe3104e,2018,Roerich Readings,Имперская идея или этнический стереотип? Концепт «монгол» в первой половине XIII в,unspecified,unspecified,0.0,unspecified,0.0,todo,Mapped from old baseline
PRES_9fe3408640,2018,Roerich Readings,Брахмадева и его комментарий к «Дравья-санграха-вритти» в контексте джайнской текстовой традиции,unspecified,unspecified,0.0,unspecified,0.0,todo,Mapped from old baseline
PRES_b8048f3ae8,2018,Roerich Readings,"Вопрос о соотношении субъекта-пудгалы, дискретности мышления-читты и устойчивости характеристик личности в тексте «Катхаваттху» (фрагмент 1.1.193-1.1.196)",unspecified,unspecified,0.0,unspecified,0.0,todo,Mapped from old baseline
PRES_d648392ad9,2018,Roerich Readings,Несколько слов о «я» и Адвайте в свете узнавания себя как предельного обладающего в толкованиях Абхинавагупты на «Ишварапратьябхиджня-карике» Утпаладевы,unspecified,unspecified,0.0,unspecified,0.0,todo,Mapped from old baseline
PRES_150fd1b901,2017,Roerich Readings,"Анкхья-нат: обряд и драма средневекового Ассама, и их возрождение сегодня",unspecified,unspecified,0.0,unspecified,0.0,todo,Mapped from old baseline
PRES_22c3c585a3,2017,Roerich Readings,К вопросу о могольском изобразительном «мультилингвизме» и культурной экстравертности,unspecified,unspecified,0.0,unspecified,0.0,todo,Mapped from old baseline
PRES_3a9030ea71,2017,Roerich Readings,Первые известные изображения раг. Тексты и контекст,unspecified,unspecified,0.0,unspecified,0.0,todo,Mapped from old baseline
PRES_6c4f1eceba,2017,Roerich Readings,Семантика изображений птицы на каменных изваяниях степей Евразии,unspecified,unspecified,0.0,unspecified,0.0,todo,Mapped from old baseline
PRES_762c65297f,2017,Roerich Readings,Проблемы методологии при интертекстуальном анализе палийских и санскритских текстов,unspecified,unspecified,0.0,unspecified,0.0,todo,Mapped from old baseline
PRES_82a1a1029b,2017,Roerich Readings,Культ Нарасинхи в трактатах по вастувидье в пуранах,unspecified,unspecified,0.0,unspecified,0.0,todo,Mapped from old baseline
PRES_a81b81e251,2017,Roerich Readings,Использование вторичного текста (цитирование) как средство ведения дискуссии в «Вопросе о субъекте (пудгале)» в «Катхаваттху 1.1»,unspecified,unspecified,0.0,unspecified,0.0,todo,Mapped from old baseline
PRES_af70362099,2017,Roerich Readings,К выходу Антологии индо-ирландских текстов,unspecified,unspecified,0.0,unspecified,0.0,todo,Mapped from old baseline
PRES_c892e395b5,2017,Roerich Readings,"Изображение Канакавасты, архата из Кашмира: часть полиптиха или отдельная танка? (Танка из собрания Кабинета Ю.Н. Рериха, ИВ РАН, Москва)",unspecified,unspecified,0.0,unspecified,0.0,todo,Mapped from old baseline
PRES_0bb0a01234,2016,Roerich Readings,Особенности художественной структуры тамильской антологии «Калиттохей» (на примере песни 92),unspecified,unspecified,0.0,unspecified,0.0,todo,Mapped from old baseline
PRES_3c97651b93,2016,Roerich Readings,Всадник Шамбалы (танка из собрания Мемориального кабинета Ю.Н. Рериха ИВ РАН),unspecified,unspecified,0.0,unspecified,0.0,todo,Mapped from old baseline
PRES_3da4b2c217,2016,Roerich Readings,Бхаджаны-проповеди Миры Баи: к вопросу о стилистике жанра,unspecified,unspecified,0.0,unspecified,0.0,todo,Mapped from old baseline
PRES_5553ddc3b0,2016,Roerich Readings,Власть как дар Неба,unspecified,unspecified,0.0,unspecified,0.0,todo,Mapped from old baseline
PRES_5e73ba89b7,2016,Roerich Readings,Санскара «посвящение в ученики» (упанаяна): её место и значение в ряду других санскар и в древней разработке стратификации индийского общества,unspecified,,0.0,,0.0,todo,
PRES_77c95981ae,2016,Roerich Readings,Миф о сожжении Трипуры на перекрестках ведийской и эпической традиции,religion_and_philosophy,,0.0,,0.0,todo,
PRES_90144b87a9,2016,Roerich Readings,О происхождении некоторых ашрамных практик в произведениях Калидасы,unspecified,unspecified,0.0,unspecified,0.0,todo,Mapped from old baseline
PRES_d3a1014be2,2016,Roerich Readings,Чувство времени (венок сонетов),unspecified,unspecified,0.0,unspecified,0.0,todo,Mapped from old baseline
PRES_e4714d395f,2016,Roerich Readings,Культ Нарасинхи в трактатах по вастувидье в пуранах,unspecified,unspecified,0.0,unspecified,0.0,todo,Mapped from old baseline
PRES_efa644ebfa,2016,Roerich Readings,Еретики локаятики и ортодокс Каутса,unspecified,unspecified,0.0,unspecified,0.0,todo,Mapped from old baseline
PRES_05e39adcc0,2015,Roerich Readings,Воспоминание как основание для тождества «Я» в «Ишварапратьябхиджня-вимаршини» Абхинавагупты,unspecified,unspecified,0.0,unspecified,0.0,todo,Mapped from old baseline
PRES_0d8900f50f,2015,Roerich Readings,Будда Вайрочана и космология «Аватамсака- сутры» в Японии,unspecified,unspecified,0.0,unspecified,0.0,todo,Mapped from old baseline
PRES_3115290bfc,2015,Roerich Readings,Проблемы интерпретации концепции восьми опровержений в «Катхаватху»,unspecified,unspecified,0.0,unspecified,0.0,todo,Mapped from old baseline
PRES_6f09bca977,2015,Roerich Readings,Изменение межкастовых взаимоотношений в домусульманском Кашмире,unspecified,unspecified,0.0,unspecified,0.0,todo,Mapped from old baseline
PRES_8a501640a4,2015,Roerich Readings,Наги как персонажи непальских легенд,unspecified,unspecified,0.0,unspecified,0.0,todo,Mapped from old baseline
PRES_8cf371186b,2015,Roerich Readings,Тюркский каган и сасанидский шаханшах: к вопросу об идеологических заимствованиях древних тюрков у иранцев,unspecified,unspecified,0.0,unspecified,0.0,todo,Mapped from old baseline
PRES_9a58e03451,2015,Roerich Readings,Об индийских названиях нуля,unspecified,unspecified,0.0,unspecified,0.0,todo,Mapped from old baseline
PRES_b0e2c5bfd8,2015,Roerich Readings,О термине татхагата в палийском каноне,unspecified,unspecified,0.0,unspecified,0.0,todo,Mapped from old baseline
PRES_b67b7540fa,2015,Roerich Readings,Индийские гана в зеркале китайских гуа,unspecified,unspecified,0.0,unspecified,0.0,todo,Mapped from old baseline
PRES_c245e46b6e,2015,Roerich Readings,Сакральная география Бодхгаи и текстовая традиция,unspecified,unspecified,0.0,unspecified,0.0,todo,Mapped from old baseline
PRES_e5272eecdd,2015,Roerich Readings,Обряд освящения статуи (адхивасана) и его роль в текстах по строительству (вастувидье) в пуранах,unspecified,unspecified,0.0,unspecified,0.0,todo,Mapped from old baseline
PRES_fa1f4db445,2015,Roerich Readings,Неизвестный иллюстрированный манускрипт из Непала из собрания кабинета Ю.Н. Рериха Института востоковедения РАН,unspecified,unspecified,0.0,unspecified,0.0,todo,Mapped from old baseline
PRES_09ea1d8846,2014,Zograf Readings,Абхидхармакоша: проблема авторства,unspecified,unspecified,0.0,unspecified,0.0,todo,Mapped from old baseline
PRES_149689b11e,2014,Zograf Readings,What is Ahi Budhnya: some remarks on the Serpent of the Deep as in the Rigveda and elsewhere,unspecified,unspecified,0.0,unspecified,0.0,todo,Mapped from old baseline
PRES_1ec138c017,2014,Zograf Readings,Концепция аватар Вишну в поэме Магхи «Шишупалавадха»,unspecified,unspecified,0.0,unspecified,0.0,todo,Mapped from old baseline
PRES_25a34c0006,2014,Zograf Readings,Тангутские ксилографы письмом ‘сиддхам’ из собрания ИВР РАН,unspecified,unspecified,0.0,unspecified,0.0,todo,Mapped from old baseline
PRES_2f9d65e45b,2014,Zograf Readings,"The ideal man in the Mahābhārata. The consciousness of the ""budhyamāna"" on one's way to salvation",unspecified,unspecified,0.0,unspecified,0.0,todo,Mapped from old baseline
PRES_6fd8f32d77,2014,Zograf Readings,И. П. Минаев как собиратель рукописей,unspecified,,0.0,,0.0,todo,
PRES_3eb2ccd62e,2014,Zograf Readings,"Мандала-классификация нечестных трансакций в ответ на упрек (Ангуттара-никая. Аттаканипата, Ассаколанкасутта)",unspecified,unspecified,0.0,unspecified,0.0,todo,Mapped from old baseline
PRES_71c7cc1a09,2014,Zograf Readings,"Спхота, джати, пашьянти и пратибха в «Вакьяпадии» — к проблеме разграничения терминов",unspecified,unspecified,0.0,unspecified,0.0,todo,Mapped from old baseline
PRES_25c542e83e,2014,Zograf Readings,Религия как инструмент внутренней политики Индии,unspecified,unspecified,0.0,unspecified,0.0,todo,Mapped from old baseline
PRES_667fb09140,2014,Zograf Readings,Община парсов в мультикультурном Бомбее (по произведениям Рохинтона Мистри),unspecified,unspecified,0.0,unspecified,0.0,todo,Mapped from old baseline
PRES_7eec57e19f,2014,Zograf Readings,Духи умерших в представлениях и обрядовой жизни веддов Шри Ланки,unspecified,unspecified,0.0,unspecified,0.0,todo,Mapped from old baseline
PRES_859698dc47,2014,Zograf Readings,", Dr. Prof., Head of the department for Indian Philology and Religion, Cotman University (Panama). Nâgârjuna - tetraktus & catuskotis - Pythagorean sources of Buddhism",unspecified,unspecified,0.0,unspecified,0.0,todo,Mapped from old baseline
PRES_9857501571,2014,Zograf Readings,«Лирическая героиня» Миры Баи,unspecified,unspecified,0.0,unspecified,0.0,todo,Mapped from old baseline
PRES_9c47837d30,2014,Zograf Readings,Концепция «марьяда» в непальских надписях,unspecified,unspecified,0.0,unspecified,0.0,todo,Mapped from old baseline
PRES_b0ead2dd43,2014,Zograf Readings,"Одержимость, служение и лицедейство. Традиции Bhoota-kolam и Theyyam Тулунаду",unspecified,unspecified,0.0,unspecified,0.0,todo,Mapped from old baseline
PRES_b6bc9faa10,2014,Zograf Readings,Значение творчества Тирумулара для формирования изобразительного канона Шивы Натараджи в Чидамбараме,unspecified,unspecified,0.0,unspecified,0.0,todo,Mapped from old baseline
PRES_04dccf8d10,2013,Zograf Readings,Представление о Брахмане в ранней вишишта-адвайте,unspecified,unspecified,0.0,unspecified,0.0,todo,Mapped from old baseline
PRES_3aa6b03a07,2013,Zograf Readings,Герасим Лебедев и британская элита колониальной Калькутты: момент разрыва,history_and_culture,unspecified,0.0,unspecified,0.0,todo,Mapped from old baseline
