presentation_id,year,series,title,existing_theme_code,l1_baseline,l1_conf,l3_baseline,l3_conf,review_status,notes
PRES_494f681f96,2020,Zograf Readings,Еще раз к вопросу о теме нейдаль в тамильской поэзии,literature_and_poetry,literature_and_poetry,1.0,unspecified,1.0,todo,Mapped from old baseline
PRES_9a160371a2,2020,Zograf Readings,Параллельный санскритско-русский корпус,linguistics_and_philology,linguistics_and_philology,1.0,unspecified,1.0,todo,Mapped from old baseline
PRES_c3f8ffb231,2020,Zograf Readings,О телесном и духовном бессмертии в индуистском тантризме,religion_and_philosophy,religion_and_philosophy,1.0,unspecified,1.0,todo,Mapped from old baseline
PRES_ec58f38bb5,2020,Zograf Readings,Традиции и ритуалы почитания манускриптов в писаниях шайва,religion_and_philosophy,religion_and_philosophy,1.0,unspecified,1.0,todo,Mapped from old baseline
PRES_882c47d896,2020,Zograf Readings,Буддизм пудгалавады: к постановке вопроса о субъекте-пудгале,religion_and_philosophy,religion_and_philosophy,1.0,unspecified,1.0,todo,Mapped from old baseline
PRES_d1043e6e8c,2020,Zograf Readings,О философской и религиозной значимости некоторых текстов Веданта Дешики,religion_and_philosophy,religion_and_philosophy,1.0,unspecified,1.0,todo,Mapped from old baseline
PRES_0816ac8f85,2020,Zograf Readings,История Ситы и Рамы глазами современных индийских поэтов-мистиков и ее релевантность для современного индийского общества,history_and_culture,history_and_culture,1.0,unspecified,1.0,todo,Mapped from old baseline
PRES_4341e890df,2020,Zograf Readings,Пример использования парибхаш при прочтении сутр Панини,linguistics_and_philology,linguistics_and_philology,1.0,unspecified,1.0,todo,Mapped from old baseline
PRES_48f4e3c3a8,2020,Zograf Readings,Дискурсивные слова в языке хинди,linguistics_and_philology,linguistics_and_philology,1.0,unspecified,1.0,todo,Mapped from old baseline
PRES_76087dcbbe,2020,Zograf Readings,Индийский мифологический сериал как средство идеологической пропаганды,religion_and_philosophy,religion_and_philosophy,1.0,unspecified,1.0,todo,Mapped from old baseline
PRES_a5949e68cd,2020,Zograf Readings,Санскритские наречия в трудах бенгальских грамматистов (Дживы Госвамина и Баларамы Панчананы),linguistics_and_philology,linguistics_and_philology,1.0,unspecified,1.0,todo,Mapped from old baseline
PRES_d1a01cb53b,2020,Zograf Readings,Онлайн-корпус текстов на языках южных мунда: задачи и специфика,linguistics_and_philology,linguistics_and_philology,1.0,unspecified,1.0,todo,Mapped from old baseline
PRES_d1a01cb53b,2020,Zograf Readings,Онлайн-корпус текстов на языках южных мунда: задачи и специфика,linguistics_and_philology,linguistics_and_philology,1.0,unspecified,1.0,todo,Mapped from old baseline
PRES_f137ba2a62,2020,Zograf Readings,Разрази его гром! Метеорологические явления в песенном фольклоре на диалектах хинди Центральной Индии,linguistics_and_philology,linguistics_and_philology,1.0,unspecified,1.0,todo,Mapped from old baseline
PRES_0db520ec9e,2020,Zograf Readings,Интерпретация кровавых событий раздела Индии и Пакистана в романе Кхушванта Сингха «Поезд в Пакистан»,literature_and_poetry,literature_and_poetry,1.0,unspecified,1.0,todo,Mapped from old baseline
PRES_a4ec277571,2020,Zograf Readings,Ритуалы божественной старости,religion_and_philosophy,religion_and_philosophy,1.0,unspecified,1.0,todo,Mapped from old baseline
PRES_215f0bcf2e,2020,Roerich Readings,"«Во отдаленном краю границы пребывающий, исповедая веру манджушринову»: о буддийском дискурсе в калмыцкой политике императора Юнчжэна (1723–1735)",religion_and_philosophy,religion_and_philosophy,1.0,unspecified,1.0,todo,Mapped from old baseline
PRES_977099cdb8,2020,Roerich Readings,"Происхождение китайского иероглифа 佛 «фо» (Будда, буддизм)",religion_and_philosophy,religion_and_philosophy,1.0,unspecified,1.0,todo,Mapped from old baseline
PRES_2bb37e704c,2020,Roerich Readings,Интерпретация датировки появления буддизма в Японии в традиционных источниках и храмовых хрониках энги,history_and_culture,history_and_culture,1.0,unspecified,1.0,todo,Mapped from old baseline
PRES_705d6f4e9c,2020,Roerich Readings,Мотивный анализ сюжета «Джатаки о павлине» Харибхатты (IV–V вв. н.э.),literature_and_poetry,literature_and_poetry,1.0,unspecified,1.0,todo,Mapped from old baseline
PRES_d84550d538,2020,Roerich Readings,Ṛddhi и священные следы прошлого: чудо в картине мира буддиста-паломника,religion_and_philosophy,religion_and_philosophy,1.0,unspecified,1.0,todo,Mapped from old baseline
PRES_273faaf1c4,2020,Roerich Readings,"Шива Саптасварамурти из Пареля. Иконография, интерпретации, параллели",art_and_material_culture,art_and_material_culture,1.0,unspecified,1.0,todo,Mapped from old baseline
PRES_4c303a7d1a,2020,Roerich Readings,Антропоморфная образность «игры знания»: телесная метафора и метафора путешествия,history_and_culture,history_and_culture,1.0,unspecified,1.0,todo,Mapped from old baseline
PRES_5e3f146897,2020,Roerich Readings,Небывальщины и парадоксы в средневековой североиндийской поэзии,literature_and_poetry,literature_and_poetry,1.0,unspecified,1.0,todo,Mapped from old baseline
PRES_69020aec6c,2020,Roerich Readings,"К анализу стиха Ригведа 1.120.11, или Предварительные заметки о ведийском автомобиле",religion_and_philosophy,religion_and_philosophy,1.0,unspecified,1.0,todo,Mapped from old baseline
PRES_75e95131c2,2020,Roerich Readings,Санскритская грамматика и мирская мудрость,linguistics_and_philology,linguistics_and_philology,1.0,unspecified,1.0,todo,Mapped from old baseline
PRES_33bcacf231,2020,Roerich Readings,Смена парадигмы? Числовые «коды» в структуре индийских математических сочинений древности и средневековья,literature_and_poetry,literature_and_poetry,1.0,unspecified,1.0,todo,Mapped from old baseline
PRES_a95408ba26,2020,Roerich Readings,Феномен речевого сбоя как средство художественной выразительности в структуре классической санскритской драмы,linguistics_and_philology,linguistics_and_philology,1.0,unspecified,1.0,todo,Mapped from old baseline
PRES_14243281d6,2019,Zograf Readings,Санскритские очки европейской лингвистики XIX века,linguistics_and_philology,linguistics_and_philology,1.0,unspecified,1.0,todo,Mapped from old baseline
PRES_334a9aca0b,2019,Zograf Readings,Двести лет санскритской лексикографии (1819‒2019),linguistics_and_philology,linguistics_and_philology,1.0,unspecified,1.0,todo,Mapped from old baseline
PRES_4468815627,2019,Zograf Readings,Атхарваведа 1.2. (Шаунака): дополнение к переводам,religion_and_philosophy,religion_and_philosophy,1.0,unspecified,1.0,todo,Mapped from old baseline
PRES_6916d4ad70,2019,Zograf Readings,Четыре народа в «Йогини-тантре»,religion_and_philosophy,religion_and_philosophy,1.0,unspecified,1.0,todo,Mapped from old baseline
PRES_7d5c21c3e8,2019,Zograf Readings,Боги «из разряда синих» в предании о дарении чаши в «Лалитавистаре»,religion_and_philosophy,religion_and_philosophy,1.0,unspecified,1.0,todo,Mapped from old baseline
PRES_a9c412982f,2019,Zograf Readings,Речь во сне и грезы наяву в классической санскритской драме,linguistics_and_philology,linguistics_and_philology,1.0,unspecified,1.0,todo,Mapped from old baseline
PRES_c416cbbb2d,2019,Zograf Readings,Конь без всадника и дерево джамбу: к интерпретации рельефа на восточных воротах Большой Ступы в Санчи,art_and_material_culture,art_and_material_culture,1.0,unspecified,1.0,todo,Mapped from old baseline
PRES_f38580f0b7,2019,Zograf Readings,«Махабхарата» и мотив «заточенных в пещере»,literature_and_poetry,literature_and_poetry,1.0,unspecified,1.0,todo,Mapped from old baseline
PRES_6d5d70424b,2019,Zograf Readings,«Гадья» Рамануджи: венец или крест исследователя философии вишишта-адвайты?,religion_and_philosophy,religion_and_philosophy,1.0,unspecified,1.0,todo,Mapped from old baseline
PRES_790adfed32,2019,Zograf Readings,"Отношение к женщине в эпосе (на примере «Рамаяны» Вальмики, «Адбхута Рамаяны» и «Адхьятма Рамаяны»)",literature_and_poetry,literature_and_poetry,1.0,unspecified,1.0,todo,Mapped from old baseline
PRES_daaacd2c46,2019,Zograf Readings,О предмете индийской философии,religion_and_philosophy,religion_and_philosophy,1.0,unspecified,1.0,todo,Mapped from old baseline
PRES_dff783fb28,2019,Zograf Readings,Понятие блаженства (ананды) в индуистском тантризме,religion_and_philosophy,religion_and_philosophy,1.0,unspecified,1.0,todo,Mapped from old baseline
PRES_0b4661b2e8,2019,Zograf Readings,Ритуалы жизненного цикла у народности лимбу,religion_and_philosophy,religion_and_philosophy,1.0,unspecified,1.0,todo,Mapped from old baseline
PRES_4855e1d50a,2019,Zograf Readings,Социовозрастная инициация и монашеское посвящение в неварском буддизме,religion_and_philosophy,religion_and_philosophy,1.0,unspecified,1.0,todo,Mapped from old baseline
PRES_d06d5a1c3b,2019,Zograf Readings,Прием лейтмотива в классической индийской поэзии,literature_and_poetry,literature_and_poetry,1.0,unspecified,1.0,todo,Mapped from old baseline
PRES_e356e4ef9c,2019,Zograf Readings,Семантика терминологии родства в языке брахуи в общедравидийском контексте,linguistics_and_philology,linguistics_and_philology,1.0,unspecified,1.0,todo,Mapped from old baseline
PRES_71f87de89c,2019,Zograf Readings,Ритуальная жизнь делийского даргаха,religion_and_philosophy,religion_and_philosophy,1.0,unspecified,1.0,todo,Mapped from old baseline
PRES_890d18051e,2019,Zograf Readings,Основные сюжеты и персонажи индийского театра теней,literature_and_poetry,literature_and_poetry,1.0,unspecified,1.0,todo,Mapped from old baseline
PRES_c73e8b22d5,2019,Zograf Readings,Кукольный театр Западной Бенгалии,linguistics_and_philology,linguistics_and_philology,1.0,unspecified,1.0,todo,Mapped from old baseline
PRES_eab49a194a,2019,Zograf Readings,«Возрожденные» ведийские ритуалы: яджна на Асси гхат и в школе девочек «Панини Канья Махавидьялая» в Варанаси,religion_and_philosophy,religion_and_philosophy,1.0,unspecified,1.0,todo,Mapped from old baseline
PRES_f4d3508725,2019,Zograf Readings,Эстетика религиозной драмы: теория и практика драмы в контексте бенгальского вайшнавизма,linguistics_and_philology,linguistics_and_philology,1.0,unspecified,1.0,todo,Mapped from old baseline
PRES_11e2a3c771,2019,Roerich Readings,Обряд адхивасана («вселение») и его роль в формировании образов храма и города,religion_and_philosophy,religion_and_philosophy,1.0,unspecified,1.0,todo,Mapped from old baseline
PRES_12417b5ae3,2019,Roerich Readings,Опыт передачи эпической шлоки в русской переводческой традиции,history_and_culture,history_and_culture,1.0,unspecified,1.0,todo,Mapped from old baseline
PRES_1343fa2056,2019,Roerich Readings,Роль представителя династии Тхакури (Тхакуджуджу) в ритуальной передаче власти в Непале,religion_and_philosophy,religion_and_philosophy,1.0,unspecified,1.0,todo,Mapped from old baseline
PRES_1d811c4689,2019,Roerich Readings,Ю.Н. Рерих и история индологии в России,history_and_culture,history_and_culture,1.0,unspecified,1.0,todo,Mapped from old baseline
PRES_220562c90f,2019,Roerich Readings,Феномен недосказанной речи ардхокти в санскритской драме,linguistics_and_philology,linguistics_and_philology,1.0,unspecified,1.0,todo,Mapped from old baseline
PRES_77c1b8528e,2019,Roerich Readings,«Парамаартхасара» Абхинавагупты: руководство по обретению «сингулярности» или свидетельство о невозможности бытия Бога (Бытия/Бога),religion_and_philosophy,religion_and_philosophy,1.0,unspecified,1.0,todo,Mapped from old baseline
PRES_913d0cd9c3,2019,Roerich Readings,К вопросу о замещениях (pratinidhi) при проведении шраута-ритуалов,religion_and_philosophy,religion_and_philosophy,1.0,unspecified,1.0,todo,Mapped from old baseline
PRES_e19a817c80,2019,Roerich Readings,«Унмей вилаккам» как источник по иконологии Шивы Натараджи,history_and_culture,history_and_culture,1.0,unspecified,1.0,todo,Mapped from old baseline
PRES_e64009085a,2019,Roerich Readings,Возможности понимания и написания термина «санскрит»,linguistics_and_philology,linguistics_and_philology,1.0,unspecified,1.0,todo,Mapped from old baseline
PRES_f86793d7d0,2019,Roerich Readings,Монгольские ритуалы в русских летописях,religion_and_philosophy,religion_and_philosophy,1.0,unspecified,1.0,todo,Mapped from old baseline
PRES_2310631e31,2018,Zograf Readings,От демонической к человеческой сексуальности? Индо-иранский миф о первобытном инцесте Ями и Ямы и его индоевропейские корни,religion_and_philosophy,religion_and_philosophy,1.0,unspecified,1.0,todo,Mapped from old baseline
PRES_2b4a64bbcc,2018,Zograf Readings,Женские образы древнеиндийского эпоса и позднейшего фольклора на фоне норм дхармашастры,literature_and_poetry,literature_and_poetry,1.0,unspecified,1.0,todo,Mapped from old baseline
PRES_378d36af5c,2018,Zograf Readings,"Будда Дипанкара, идущий по дороге. Сюжеты пророчества в ранней буддийской литературе",literature_and_poetry,literature_and_poetry,1.0,unspecified,1.0,todo,Mapped from old baseline
PRES_5c4c8855b2,2018,Zograf Readings,О джатакаставе как разновидности буддийского гимна,religion_and_philosophy,religion_and_philosophy,1.0,unspecified,1.0,todo,Mapped from old baseline
PRES_7a7018c850,2018,Zograf Readings,101 синоним воды в ведийском словаре «Нигханту»,religion_and_philosophy,religion_and_philosophy,1.0,unspecified,1.0,todo,Mapped from old baseline
PRES_d5cc99b5ac,2018,Zograf Readings,"Источники сознания, компоненты познавательного акта и учение о трех мирах в Абхидхарма-самуччае Асанги",history_and_culture,history_and_culture,1.0,unspecified,1.0,todo,Mapped from old baseline
PRES_d78288c37d,2018,Zograf Readings,Мантра и сутра как форма построения ведийских текстов,religion_and_philosophy,religion_and_philosophy,1.0,unspecified,1.0,todo,Mapped from old baseline
PRES_d9f00bda70,2018,Zograf Readings,Оговорка как композиционный прием в санскритской драме,linguistics_and_philology,linguistics_and_philology,1.0,unspecified,1.0,todo,Mapped from old baseline
PRES_222529a490,2018,Zograf Readings,Индуистская тантрическая телеология,religion_and_philosophy,religion_and_philosophy,1.0,unspecified,1.0,todo,Mapped from old baseline
PRES_73a0d9241a,2018,Zograf Readings,Вьявахара как универсум установления достоверности знания в индийской эпистемологии и логике (праманаваде),religion_and_philosophy,religion_and_philosophy,1.0,unspecified,1.0,todo,Mapped from old baseline
PRES_7a0a9c4cff,2018,Zograf Readings,Тантра в учении Ошо,religion_and_philosophy,religion_and_philosophy,1.0,unspecified,1.0,todo,Mapped from old baseline
PRES_96387f23ed,2018,Zograf Readings,Роль мифов о творении мира в индийской философии,religion_and_philosophy,religion_and_philosophy,1.0,unspecified,1.0,todo,Mapped from old baseline
PRES_f528d24e03,2018,Zograf Readings,Учение д-ра Маханамбраты Брахмачари как квинтэссенция идей бенгальского ренессанса и его влияние на Томаса Мертона,linguistics_and_philology,linguistics_and_philology,1.0,unspecified,1.0,todo,Mapped from old baseline
PRES_4bd0bdc72b,2018,Zograf Readings,«Экологический» роман Махуа Маджи,literature_and_poetry,literature_and_poetry,1.0,unspecified,1.0,todo,Mapped from old baseline
PRES_55d481f42e,2018,Zograf Readings,Родство по крови и родство по духу: М. К. Ганди о мотивах отказа Арджуны от сражения,literature_and_poetry,literature_and_poetry,1.0,unspecified,1.0,todo,Mapped from old baseline
PRES_9729e86e04,2018,Zograf Readings,«Чариягити» и Тагор,literature_and_poetry,literature_and_poetry,1.0,unspecified,1.0,todo,Mapped from old baseline
PRES_be126cbf86,2018,Zograf Readings,Семантика терминологии родства в малых дравидийских языках: когнитивные аспекты,linguistics_and_philology,linguistics_and_philology,1.0,unspecified,1.0,todo,Mapped from old baseline
PRES_c2d5f88f68,2018,Zograf Readings,Образ жизни в шри-вишнуизме: самашраяна (панчасамскара) и ее основания,literature_and_poetry,literature_and_poetry,1.0,unspecified,1.0,todo,Mapped from old baseline
PRES_e3c5dc3b74,2018,Zograf Readings,Борьба за собственный язык в Ладакхе (на материале полевых исследований),linguistics_and_philology,linguistics_and_philology,1.0,unspecified,1.0,todo,Mapped from old baseline
PRES_08e215b99f,2018,Zograf Readings,Раджа Рави Варма: художник и основатель «Рави Варма Пресс»,art_and_material_culture,art_and_material_culture,1.0,unspecified,1.0,todo,Mapped from old baseline
PRES_282d250a63,2018,Zograf Readings,Кумаонский Голудев: локальный вариант индуизма,religion_and_philosophy,religion_and_philosophy,1.0,unspecified,1.0,todo,Mapped from old baseline
PRES_e98648b76f,2018,Zograf Readings,Иконография и функции непальских дхара/хити,art_and_material_culture,art_and_material_culture,1.0,unspecified,1.0,todo,Mapped from old baseline
PRES_0ad046733d,2018,Roerich Readings,Семантика глагольного корня bhram и его дериватов на материале древнеиндийского эпоса и поэзии,literature_and_poetry,literature_and_poetry,1.0,unspecified,1.0,todo,Mapped from old baseline
PRES_0bcd9a42ef,2018,Roerich Readings,Идеал sajjana в литературе гуптской эпохи,literature_and_poetry,literature_and_poetry,1.0,unspecified,1.0,todo,Mapped from old baseline
PRES_587468d32d,2018,Roerich Readings,Текст в контексте: образ идеального сикхского правителя в кодексе Прем Сумараг в позднесредневековых панджабских реалиях,religion_and_philosophy,religion_and_philosophy,1.0,unspecified,1.0,todo,Mapped from old baseline
PRES_59d889fde6,2018,Roerich Readings,Обращение к буддийским сутрам «неясного» происхождения при императорском дворе в Японии в VIII в,religion_and_philosophy,religion_and_philosophy,1.0,unspecified,1.0,todo,Mapped from old baseline
PRES_5b31649829,2018,Roerich Readings,Тантрическая традиция в искусстве индийского модернизма,religion_and_philosophy,religion_and_philosophy,1.0,unspecified,1.0,todo,Mapped from old baseline
PRES_690401765d,2018,Roerich Readings,Деепричастия пассивного залога в языке пали?,linguistics_and_philology,linguistics_and_philology,1.0,unspecified,1.0,todo,Mapped from old baseline
PRES_8ccd58e4ca,2018,Roerich Readings,Нетибетская лексика в тибетских диалектах Балтистана и Каргила: попытка этимологической классификации,linguistics_and_philology,linguistics_and_philology,1.0,unspecified,1.0,todo,Mapped from old baseline
PRES_9991b02531,2018,Roerich Readings,Путешествие «Тысячи и одной ночи» в Ирландию,history_and_culture,history_and_culture,1.0,unspecified,1.0,todo,Mapped from old baseline
PRES_9e7c42bb8a,2018,Roerich Readings,Богиня с гхантой и гхатом. Дурга (?) в иконографической программе буддийского храма Аурангабада,religion_and_philosophy,religion_and_philosophy,1.0,unspecified,1.0,todo,Mapped from old baseline
PRES_a0f09ba677,2018,Roerich Readings,Тема «мадаль» (обряд самоистязания) в тамильской поэзии,literature_and_poetry,literature_and_poetry,1.0,unspecified,1.0,todo,Mapped from old baseline
PRES_eb1a5f1b93,2018,Roerich Readings,Буддийская миссия Н.К. Рериха в Лхасу,religion_and_philosophy,religion_and_philosophy,1.0,unspecified,1.0,todo,Mapped from old baseline
PRES_edcf9f8de0,2018,Roerich Readings,Некоторые аспекты культа живой богини Кумари в Непале,religion_and_philosophy,religion_and_philosophy,1.0,unspecified,1.0,todo,Mapped from old baseline
PRES_0e88c0544b,2017,Roerich Readings,Синтаксические конструкции с ti и -bhāva в языке пали,linguistics_and_philology,linguistics_and_philology,1.0,unspecified,1.0,todo,Mapped from old baseline
PRES_2bdddbacaf,2017,Roerich Readings,Поэма «Десять песен»: перевод и чтение на тамильском языке,linguistics_and_philology,linguistics_and_philology,1.0,unspecified,1.0,todo,Mapped from old baseline
PRES_32246c7904,2017,Roerich Readings,Полемика о субъекте между буддистами и ньяя-вайшешиками в «Таттвасанграхе» Шантаракшиты,religion_and_philosophy,religion_and_philosophy,1.0,unspecified,1.0,todo,Mapped from old baseline
PRES_3d081ec308,2017,Roerich Readings,Тамильская баллада «Сказание о Кусалаване» (kucalavaṉ katai): особенности трактовки фрагмента «Рамаяны»,literature_and_poetry,literature_and_poetry,1.0,unspecified,1.0,todo,Mapped from old baseline
PRES_5b6f4c9c6a,2017,Roerich Readings,Ритуальный текст из «Махавасту»,religion_and_philosophy,religion_and_philosophy,1.0,unspecified,1.0,todo,Mapped from old baseline
