presentation_id,year,series,title,existing_theme_code,l1_baseline,l1_conf,l3_baseline,l3_conf,review_status,notes
PRES_055b23183b,2026,Zograf Readings,Абхисамаяаланкара: вводная часть,unspecified,,0.0,,0.0,todo,
PRES_0ec718e125,2026,Zograf Readings,Теория познания в мадхьямаке-сватантрике (по трактату Бхававивеки «Мадхьямака-хридая»),unspecified,,0.0,,0.0,todo,
PRES_23a87e494f,2026,Zograf Readings,Фарс Шанкхадхары «Латакамелака» и ее рукопись из Библиотеки им. Кешара (Катманду),unspecified,,0.0,,0.0,todo,
PRES_23a87e494f,2026,Zograf Readings,Фарс Шанкхадхары «Латакамелака» и ее рукопись из Библиотеки им. Кешара (Катманду),unspecified,,0.0,,0.0,todo,
PRES_40d669e631,2026,Zograf Readings,Александр Михайлович Мерварт: судьба ученого,unspecified,,0.0,,0.0,todo,
PRES_422bda6a2b,2026,Zograf Readings,"Востоковед Павел Яковлевич Петров (1814–1875), его библиотека и архив",unspecified,,0.0,,0.0,todo,
PRES_422bda6a2b,2026,Zograf Readings,"Востоковед Павел Яковлевич Петров (1814–1875), его библиотека и архив",unspecified,,0.0,,0.0,todo,
PRES_51a9cb36b9,2026,Zograf Readings,Зачем спорили хэшан Махаяна и Камалашила?,unspecified,,0.0,,0.0,todo,
PRES_5327ab9216,2026,Zograf Readings,Вера Александровна Новикова (1918-1972) и послевоенная бенгалистика в Ленинграде,unspecified,,0.0,,0.0,todo,
PRES_6d7c21fb70,2026,Zograf Readings,«Шри Рамананда-чаритам» Рамбхадрачарьи как образец современной санскритской махакавьи,unspecified,,0.0,,0.0,todo,
PRES_8a20127ede,2026,Zograf Readings,Индийское паломничество в сравнительном аспекте,unspecified,,0.0,,0.0,todo,
PRES_8aa850a4e6,2026,Zograf Readings,Предание в тексте и предание в камне: сюжет просветления Будды на рельефе Большой Ступы в Санчи,unspecified,,0.0,,0.0,todo,
PRES_987fd62e14,2026,Zograf Readings,А.А. Сталь-Гольштейн как участник научно-издательской серии «Bibliotheca Buddhica»,unspecified,,0.0,,0.0,todo,
PRES_b130fb70d2,2026,Zograf Readings,Эпическая санкхья в беседе царя Джанаки и отшельницы Сулабхи (МБХ 12.308),unspecified,,0.0,,0.0,todo,
PRES_d51a127759,2026,Zograf Readings,«Они из секты Пифагора»: представления об индуизме трех итальянских купцов второй половины XVI в.,unspecified,,0.0,,0.0,todo,
PRES_e0f3741a4a,2026,Zograf Readings,По следам Петербуржца в Индии: путешествие князя Салтыкова,unspecified,,0.0,,0.0,todo,
PRES_f261db19db,2026,Zograf Readings,Заметки о роли индийской диаспоры в пропаганде языка и литературы хинди,unspecified,,0.0,,0.0,todo,
PRES_0b6581f9ff,2026,Zograf Readings,Синтез сложных слов tatpuruṣa и karmadhāraya в грамматике Панини,unspecified,,0.0,,0.0,todo,
PRES_1637f642c2,2026,Zograf Readings,Южноандаманские языки: к вопросу о возможностях внешнего сравнения,unspecified,,0.0,,0.0,todo,
PRES_215ed69350,2026,Zograf Readings,Салман Рушди и русская литература: тайный роман?,unspecified,,0.0,,0.0,todo,
PRES_266f877d3f,2026,Zograf Readings,Перевод в практике преподавания хинди в средней школе,unspecified,,0.0,,0.0,todo,
PRES_32b950f0fe,2026,Zograf Readings,"Средневековая фольклорная формула и литературное клише: образ, мотив",unspecified,,0.0,,0.0,todo,
PRES_4f410bea98,2026,Zograf Readings,Сон Урмилы в современной индийской прозе,unspecified,,0.0,,0.0,todo,
PRES_5112b0355f,2026,Zograf Readings,"""Башни с нишами"" в индуизме. Об одном типе храмовых шикхар в архитектуре Чалукьев",unspecified,,0.0,,0.0,todo,
PRES_6a2b1904a8,2026,Zograf Readings,«Местный колорит» в литературной традиции Ориссы,unspecified,,0.0,,0.0,todo,
PRES_952dc38711,2026,Zograf Readings,Чему и как учит Панчатантра,unspecified,,0.0,,0.0,todo,
PRES_a20db0593f,2026,Zograf Readings,Паришишты как исторический источник: проблемы датировки и классификации поздневедийской ритуальной литературы,unspecified,,0.0,,0.0,todo,
PRES_a58cb0ccf6,2026,Zograf Readings,Метод кодировки чисел в трудах индийского математика Арьябхаты,unspecified,,0.0,,0.0,todo,
PRES_b2cbcb90c5,2026,Zograf Readings,Лексика языка куллуи: этимологии 2026 года,unspecified,,0.0,,0.0,todo,
PRES_c922a3c1aa,2026,Zograf Readings,Имперфект в древнеиндийском эпосе,unspecified,,0.0,,0.0,todo,
PRES_fb340723de,2026,Zograf Readings,Пословицы и поговорки Индии и России как аспект межкультурной коммуникации (проектная деятельность на уроках языка хинди),unspecified,,0.0,,0.0,todo,
PRES_0b6e4e4519,2026,Zograf Readings,Прамана-вада «Таттва-сандарбхи» Дживы Госвами в оптике неклассической эпистемологии науки,unspecified,,0.0,,0.0,todo,
PRES_2026748a9a,2026,Zograf Readings,Индийская философия в свете компаративного подхода Поля Массон-Урселя,unspecified,,0.0,,0.0,todo,
PRES_2af47bc093,2026,Zograf Readings,Вклад Абхинавагупты в развитие шиваитской доктрины философского монизма в отличной от адвайта- веданты парадигме,unspecified,,0.0,,0.0,todo,
PRES_314bc5bec5,2026,Zograf Readings,Интерпретация идей Упанишад в философском наследии Р. Тагора: религиозная онтология,unspecified,,0.0,,0.0,todo,
PRES_3f4d3d50e9,2026,Zograf Readings,Уроки Герхарда Оберхаммера. По следам перевода книги «Структуры йоговской медитации»,unspecified,,0.0,,0.0,todo,
PRES_43b3dacf96,2026,Zograf Readings,"Санньяса и Брахмалока: смерть, социальная или физическая, как опосредующий этап пути к освобождению в адвайта-веданте",unspecified,,0.0,,0.0,todo,
PRES_45a22e8318,2026,Zograf Readings,Коннотативные особенности йогической лексики Виджнянабхикшу (на примере комментария к 1.1 «Pātañjalayogaśāstram»),unspecified,,0.0,,0.0,todo,
PRES_6912669e4d,2026,Zograf Readings,"Особая священная игра» Гулабрао Махараджа как игровая модель индуистской сотериологии: космология, философия и бхакти",unspecified,,0.0,,0.0,todo,
PRES_6e8842a256,2026,Zograf Readings,"Традиция толкования упанишад: контекст, философское значение и интерпретация ключевой фразы «tat tvam asi» («Ты есть то»)",unspecified,,0.0,,0.0,todo,
PRES_939dd4f1e1,2026,Zograf Readings,Структура ниданы из «Панчавимшатика-праджняпарамиты» в аспекте ритуальной практики,unspecified,,0.0,,0.0,todo,
PRES_b73c531378,2026,Zograf Readings,Идеи йогачары в трактате Асанги «Абхидхармасамуччая» (первая глава),unspecified,,0.0,,0.0,todo,
PRES_f9adb6ffd3,2026,Zograf Readings,Можно ли считать мадхьямаку нигилизмом?,unspecified,,0.0,,0.0,todo,
PRES_fa188bec9a,2026,Zograf Readings,«Сказание о Лиле» в «Йога- васиштхе»,unspecified,,0.0,,0.0,todo,
PRES_0ccccd2f0f,2026,Zograf Readings,Тело агхори как «живой текст»: визуальность и перформанс в производстве религиозного авторитета,unspecified,,0.0,,0.0,todo,
PRES_16c469b6c2,2026,Zograf Readings,Непальский вариант Гаруды,unspecified,,0.0,,0.0,todo,
PRES_1c157737ea,2026,Zograf Readings,"Jati, gotra and marriage system in Haryana: a change in perspective",unspecified,,0.0,,0.0,todo,
PRES_2af0d9ba1e,2026,Zograf Readings,Ведийский ритуал Праваргья (pravargya): текстовая традиция и ритуальная практика,unspecified,,0.0,,0.0,todo,
PRES_2d9228675d,2026,Zograf Readings,Миф о Потопе и тыкве у племен западной Индии,unspecified,,0.0,,0.0,todo,
PRES_4125041435,2026,Zograf Readings,"Огонь, вода и память: погребальные практики сикхов в мультикультурной среде",unspecified,,0.0,,0.0,todo,
PRES_589e161411,2026,Zograf Readings,К истории поступления индийских памятников в Эрмитаж: новые открытия,unspecified,,0.0,,0.0,todo,
PRES_702d8347a7,2026,Zograf Readings,Об одном диафильме В. Чатопадаева из коллекции МАЭ РАН,unspecified,,0.0,,0.0,todo,
PRES_702d8347a7,2026,Zograf Readings,Об одном диафильме В. Чатопадаева из коллекции МАЭ РАН,unspecified,,0.0,,0.0,todo,
PRES_a1bf82cfc8,2026,Zograf Readings,Златоликие образы Дипанкары Будды и традиция проведения фестиваля Самьяк маха дана в Патане. Шишова-Маретина Ксения Александровна (Санкт-Петербург). Архетип опасной женственности в индуизме,unspecified,,0.0,,0.0,todo,
PRES_a28cfd6115,2026,Zograf Readings,Окна в иной мир: изобразительные тексты и линия жизни индийской художницы-парси Катаюн Саклат (1938- 2026): антропологический взгляд,unspecified,,0.0,,0.0,todo,
PRES_bc3de7e23c,2026,Zograf Readings,"Яйцо, курица и Тримурти: миф о Шакти в фольклоре мадига",unspecified,,0.0,,0.0,todo,
PRES_f8dfe74eae,2026,Zograf Readings,Голод в Бенгалии 1943 года и его отражение в творчестве индийских художников,unspecified,,0.0,,0.0,todo,
PRES_96863ca3fa,2025,Zograf Readings,Арьядэва и Чандракирти о концепции anātma,unspecified,unspecified,0.0,unspecified,0.0,todo,Mapped from old baseline
PRES_cac95e2161,2025,Zograf Readings,В защиту Вишну Шипивишты: «Аз есьм Шипивишта!» (РВ 7.100.6),unspecified,unspecified,0.0,unspecified,0.0,todo,Mapped from old baseline
PRES_e84196d92a,2025,Zograf Readings,К интерпретации Ригведы: śiśnadevāḥ,unspecified,unspecified,0.0,unspecified,0.0,todo,Mapped from old baseline
PRES_fc83b6c79d,2025,Zograf Readings,Возвращаясь к третьей книге Махабхараты: новый взгляд,literature_and_poetry,unspecified,0.0,unspecified,0.0,todo,Mapped from old baseline
PRES_493f0d6ac7,2025,Zograf Readings,Восхождение Урмилы в поэме Майтхилишарана Гупты «Сакет»,unspecified,unspecified,0.0,unspecified,0.0,todo,Mapped from old baseline
PRES_da938d5fcc,2025,Zograf Readings,Проблема индианизации колониальной армии на страницах индийской прессы в 1910-х — 1940-х годах,unspecified,unspecified,0.0,unspecified,0.0,todo,Mapped from old baseline
PRES_ea35d438ad,2025,Zograf Readings,Еще раз о структуре Чарьягити,unspecified,unspecified,0.0,unspecified,0.0,todo,Mapped from old baseline
PRES_355e93f896,2025,Zograf Readings,Женщины и сатьяграха: взгляд М. К. Ганди,unspecified,unspecified,0.0,unspecified,0.0,todo,Mapped from old baseline
PRES_3bb427ea8d,2025,Zograf Readings,Ауробиндо Гхош: между разумом и мистической интуицией,unspecified,unspecified,0.0,unspecified,0.0,todo,Mapped from old baseline
PRES_8c979b88c9,2025,Zograf Readings,О «Yogavārttika» Виджнянабхикшу: Ansatz,unspecified,unspecified,0.0,unspecified,0.0,todo,Mapped from old baseline
PRES_aac636d1e0,2025,Zograf Readings,«Наишкармья-сиддхи» (I. 52) Сурешвары как структура для реконструкции учения Шанкары об освобождении,unspecified,unspecified,0.0,unspecified,0.0,todo,Mapped from old baseline
PRES_b5cfc79e4e,2025,Zograf Readings,Комментарии Б. Н. Пандита на «Шивасутры»: новый взгляд на коренной текст трики,unspecified,unspecified,0.0,unspecified,0.0,todo,Mapped from old baseline
PRES_bb1c4eafea,2025,Zograf Readings,Особенности толкования Нового Завета в учении Свами Вивекананды,unspecified,unspecified,0.0,unspecified,0.0,todo,Mapped from old baseline
PRES_c02d591918,2025,Zograf Readings,Проблемы реконструкции системы йоги Патанджали на основе переводов «корневого» текста «Йога-сутр» и толкования Бходжи («Rājamārtaṇḍa»),unspecified,unspecified,0.0,unspecified,0.0,todo,Mapped from old baseline
PRES_f876cc0069,2025,Zograf Readings,Интерпретация теизма «Бхагавадгиты» Шанкарой и Абхинавагуптой (на материале их комментариев к «Бхагавадгите),unspecified,unspecified,0.0,unspecified,0.0,todo,Mapped from old baseline
PRES_0cf40964d4,2025,Zograf Readings,Экспедиция Психо-Неврологического института в Индию в 1913,unspecified,unspecified,0.0,unspecified,0.0,todo,Mapped from old baseline
PRES_84de88fb0f,2025,Zograf Readings,От демоницы к мстительнице: Переосмысление образа ведьмы в современном индийском кинематографе,unspecified,unspecified,0.0,unspecified,0.0,todo,Mapped from old baseline
PRES_ae8474fa94,2025,Zograf Readings,Самбхары в обряде установления жертвенных огней (agnyādheya),unspecified,unspecified,0.0,unspecified,0.0,todo,Mapped from old baseline
PRES_9bacebbe98,2025,Roerich Readings,Аланкара как аспект стилистики текста,unspecified,unspecified,0.0,unspecified,0.0,todo,Mapped from old baseline
PRES_fad14d11c0,2025,Roerich Readings,Prasādapratibhodbhava (Śatapañcāśatka) Матричеты: тохарский перевод и комментарий,unspecified,,0.0,,0.0,todo,
PRES_fad14d11c0,2025,Roerich Readings,Prasādapratibhodbhava (Śatapañcāśatka) Матричеты: тохарский перевод и комментарий,unspecified,,0.0,,0.0,todo,
PRES_5c44ffa32f,2025,Roerich Readings,Исторические и историографические особенности монгольской летописи начала XVIII в.: Гомбоджаб. «Течение Ганга»,unspecified,,0.0,,0.0,todo,
PRES_5c44ffa32f,2025,Roerich Readings,Исторические и историографические особенности монгольской летописи начала XVIII в.: Гомбоджаб. «Течение Ганга»,unspecified,,0.0,,0.0,todo,
PRES_a86c239aaf,2025,Roerich Readings,Роль персоязычных версий индийских текстов в формировании средневековой тюркоязычной литературы Южного Кавказа (на примере памятника «Калила и Димна»),unspecified,,0.0,,0.0,todo,
PRES_d6c59acf5e,2025,Roerich Readings,Описание Центральной Азии в «Хождении в пять индийских царств»,unspecified,unspecified,0.0,unspecified,0.0,todo,Mapped from old baseline
PRES_d767707d9d,2025,Roerich Readings,Этапы сложения имперской идеологии у средневековых монголов,unspecified,unspecified,0.0,unspecified,0.0,todo,Mapped from old baseline
PRES_679dbfd494,2025,Roerich Readings,Выкуп невесты (śulka) в Древней Индии: шастрическая и эпическая традиции,unspecified,unspecified,0.0,unspecified,0.0,todo,Mapped from old baseline
PRES_aa9ddea8aa,2025,Roerich Readings,О теории просодии в «Натьяшастре»,unspecified,unspecified,0.0,unspecified,0.0,todo,Mapped from old baseline
PRES_f40d5bacac,2025,Roerich Readings,Представления пуран о священном тексте как культовом предмете,unspecified,unspecified,0.0,unspecified,0.0,todo,Mapped from old baseline
PRES_5f755d36b3,2025,Roerich Readings,Треугольник Паскаля или Пингалы?,unspecified,unspecified,0.0,unspecified,0.0,todo,Mapped from old baseline
PRES_b9413943b6,2025,Roerich Readings,Яджня Ригведы и «другая яджня» палийского канона,unspecified,unspecified,0.0,unspecified,0.0,todo,Mapped from old baseline
PRES_2819d33fcb,2025,Roerich Readings,Индийские шастры с точки зрения современной методологии познания,unspecified,unspecified,0.0,unspecified,0.0,todo,Mapped from old baseline
PRES_a903b2de1b,2025,Roerich Readings,Метафорический дискурс «Бхаванакрамы» Камалашилы,unspecified,,0.0,,0.0,todo,
PRES_ea27687ed5,2025,Roerich Readings,Рецепция Маджджхима-никаи в рукописях Э. Гуссерля,unspecified,unspecified,0.0,unspecified,0.0,todo,Mapped from old baseline
PRES_095045ced7,2024,Zograf Readings,От эпического предания до буддийского сказания и обратно: история Шьямы,unspecified,,0.0,,0.0,todo,
PRES_16bca7ecfe,2024,Zograf Readings,Бодхисаттва — стрелок из лука. Буддийский сюжет и его аналоги,unspecified,,0.0,,0.0,todo,
PRES_2e44fd3b07,2024,Zograf Readings,Гадание о суженом по зеркалу в «Махабхарате»: индоиранский и индоевропейский фон,unspecified,,0.0,,0.0,todo,
PRES_36658fe404,2024,Zograf Readings,Переписка О.Н. Бетлингка по поводу Петербургских словарей и судьба лексикографа,unspecified,,0.0,,0.0,todo,
PRES_6b13d39224,2024,Zograf Readings,Интерпретация эвтаназии в буддийской картине мира,unspecified,,0.0,,0.0,todo,
PRES_92abfea9fd,2024,Zograf Readings,Вредные существа и животные в авестийской и ведической традиции,unspecified,,0.0,,0.0,todo,
PRES_a39bbb97f1,2024,Zograf Readings,Образ времени в поэзии Бхартрихари,unspecified,,0.0,,0.0,todo,
PRES_b02d534334,2024,Zograf Readings,Абхисамаяланкара как предмет буддийского образования,unspecified,,0.0,,0.0,todo,
PRES_b481edbec8,2024,Zograf Readings,Индийские корреспонденты Е.Е. Обермиллера,unspecified,,0.0,,0.0,todo,
PRES_ccb5812059,2024,Zograf Readings,«Тень» Ситы и «призрак» Елены: две истории о похищенных жёнах,unspecified,,0.0,,0.0,todo,
PRES_ec0380288a,2024,Zograf Readings,"Поэтическое представление о духовном и мирском благе в гимнах наянаров (сборник ""Деварам"")",unspecified,,0.0,,0.0,todo,
PRES_f7005c0259,2024,Zograf Readings,Бодхисаттва в образе пишачи: следы комической традиции в описании аскезы Гаутамы,unspecified,,0.0,,0.0,todo,
PRES_0ee4f09fc9,2024,Zograf Readings,Четыре вида непосредственного восприятия в «Капле логики» Дхармакирти,unspecified,,0.0,,0.0,todo,
PRES_2a660819f9,2024,Zograf Readings,Онтология и сотериология «Ананда-сутр» П.Р. Саркара,unspecified,,0.0,,0.0,todo,
PRES_56fc72bc0c,2024,Zograf Readings,Телеологический аргумент в пользу существования Бога в учении Свами Вивекананды,unspecified,,0.0,,0.0,todo,
PRES_5d7e0395b2,2024,Zograf Readings,Стадии пути к освобождению по «Найшкармья-сиддхи» (I.52) Сурешвары,unspecified,,0.0,,0.0,todo,
PRES_6024934b6c,2024,Zograf Readings,Монистический теизм (адвайта-ишваравада) Абхинавагупты в сопоставлении с ишваравадой адвайты Шанкары на материале их комментариев к «Бхагавадгите».,unspecified,,0.0,,0.0,todo,
PRES_8410b1d47f,2024,Zograf Readings,Обоснование невозможности чувственного познания в «Прасаннападе» Чандракирти,unspecified,,0.0,,0.0,todo,
PRES_8ef9132d46,2024,Zograf Readings,Обряд панчамакара в каулических тантрах,unspecified,,0.0,,0.0,todo,
PRES_91ce32f17e,2024,Zograf Readings,Парадигмальное мышление брахманов. Связь философских универсалий и варно-кастовой системы в Индии,unspecified,,0.0,,0.0,todo,
PRES_963b9bd836,2024,Zograf Readings,Как лучше представить западному читателю историю индийской философии: размышление по поводу книги В. Эльтшингера и И. Ратье «Что такое индийская философия?»,unspecified,,0.0,,0.0,todo,
PRES_9a54ac1874,2024,Zograf Readings,Преображение богини Кали: точка зрения «Маханирвана-тантры»,unspecified,,0.0,,0.0,todo,
PRES_c8253960c0,2024,Zograf Readings,Проблема сознания в философии адвайта-веданты Сурешвары.,unspecified,,0.0,,0.0,todo,
PRES_ea2d7c759c,2024,Zograf Readings,Был ли Бхартрихари сторонником шабда-адвайты?,unspecified,,0.0,,0.0,todo,
PRES_f18f8d1465,2024,Zograf Readings,Модели интерпретации телесности в хатха-йоге,unspecified,,0.0,,0.0,todo,
PRES_ff586f57a2,2024,Zograf Readings,"Развертка, свертка и смысл в индийской философии",unspecified,,0.0,,0.0,todo,
PRES_2b2a1fc14b,2024,Zograf Readings,Сравнительный анализ космологических представлений на полях вишнуитской и джайнской «джняна чаупады» (игры знания) XVIII — XIX вв,ethnography,,0.0,,0.0,todo,
PRES_2fcaeeff79,2024,Zograf Readings,Несколько этимологий арготических слов среднеазиатских цыган на фоне дискуссий последнего полувека об истории цыган,unspecified,,0.0,,0.0,todo,
PRES_33433905b0,2024,Zograf Readings,Образы тигра и рыбы в бенгальской фразеологии,unspecified,,0.0,,0.0,todo,
PRES_4204d1cf31,2024,Zograf Readings,Суфизм в Индии: истоки и течения,unspecified,,0.0,,0.0,todo,
PRES_4df4b11b2d,2024,Zograf Readings,“Чорджапод”: история и перспективы исследования,unspecified,,0.0,,0.0,todo,
PRES_99759d2e3f,2024,Zograf Readings,Три системы бенгальского стихосложения,literature,,0.0,,0.0,todo,
PRES_a4e21c2702,2024,Zograf Readings,«Город победы» Рушди — ответ «Рамаяне» самого скандального автора 20 столетия,literature,,0.0,,0.0,todo,
PRES_a610f81125,2024,Zograf Readings,Женские голоса в каввали: гендер и традиции,unspecified,,0.0,,0.0,todo,
