presentation_id,year,series,title,existing_theme_code,l1_baseline,l1_conf,l3_baseline,l3_conf,review_status,notes
PRES_e9f41a40c8,2010,Roerich Readings,Проблема сновидения и «ошибочные действия» в натаке Бхасы «Свапнавасавадатта»,unspecified,,0.0,,0.0,todo,
PRES_ea0097faa8,2010,Roerich Readings,Китайские переводы Лалитавистары как источник по истории текста,unspecified,,0.0,,0.0,todo,
PRES_eda7195a4d,2010,Roerich Readings,Непал: от конфессионального компромисса до секуляризма (Некоторые штрихи истории духовной культуры),unspecified,,0.0,,0.0,todo,
PRES_fe7f9d9625,2010,Roerich Readings,Юрий Николаевич Рерих — исследователь тибетского языка,unspecified,,0.0,,0.0,todo,
PRES_1a48b15a55,2009,Zograf Readings,"Южный поход личчхавов 14.00. Зеленый зал СПбФ ИВ РАН (Дворцовая наб., 18)",unspecified,,0.0,,0.0,todo,
PRES_422410f9af,2009,Zograf Readings,Происхождение атомизма: лингвистическая гипотеза,unspecified,,0.0,,0.0,todo,
PRES_523a56fd5b,2009,Zograf Readings,Концепция Ишвары в классической йоге и в Кашмирском шиваизме,unspecified,,0.0,,0.0,todo,
PRES_5579f7916f,2009,Zograf Readings,Сказание об Индейском царстве» как источник представлений об Индии в древней Руси,unspecified,,0.0,,0.0,todo,
PRES_7323c9c9b1,2009,Zograf Readings,Еще раз о сюжете эпической «Шакунталы»,unspecified,,0.0,,0.0,todo,
PRES_9627d4dfc0,2009,Zograf Readings,"Восток, Запад и русский перевод",unspecified,,0.0,,0.0,todo,
PRES_9bda829b36,2009,Zograf Readings,Ведийское samudra-: к вопросу о широких водных пространствах в текстах самхит,unspecified,,0.0,,0.0,todo,
PRES_9e464b8281,2009,Zograf Readings,"Книга о побоище палицами (Махабхарата, XVI)",unspecified,,0.0,,0.0,todo,
PRES_aa2399a11e,2009,Zograf Readings,Паломничество в Калика-пуране,unspecified,,0.0,,0.0,todo,
PRES_c1761df1ca,2009,Zograf Readings,Древний тибетский сборник текстов по культам Махакалы и Вишну из рукописной коллекции ИВР РАН,unspecified,,0.0,,0.0,todo,
PRES_e62ebf0bd0,2009,Zograf Readings,К определению термина «джатака» в палийском каноне,unspecified,,0.0,,0.0,todo,
PRES_5b4245709b,2009,Zograf Readings,«Коровьи войны» (на материале скотоводческого эпоса народов Центральной Индии и Декана),unspecified,,0.0,,0.0,todo,
PRES_6213023bf5,2009,Zograf Readings,Сат-чит-ананда как мост между христианством и индуизмом,unspecified,,0.0,,0.0,todo,
PRES_6e5ecd56b8,2009,Zograf Readings,К вопросу о классификации храмовых сооружений в Вишнудхармоттара-пуране,unspecified,,0.0,,0.0,todo,
PRES_7efa09f3b2,2009,Zograf Readings,"Сказители, музыканты и танцоры. К вопросу о происхождении и кастовой дхарме так называемых катхаков Раджастхана",unspecified,,0.0,,0.0,todo,
PRES_96f8e44e84,2009,Zograf Readings,"Абхидхарма и абхивиная: взгляд со стороны двух раннебуддийских традиций 14.30. МАЭ (Университетская наб., 3), ДЕТСКИЙ ЦЕНТР",unspecified,,0.0,,0.0,todo,
PRES_9b2118961f,2009,Zograf Readings,Иконографические типы бронзовых образов Натараджи: их сложение и проблемы классификации,unspecified,,0.0,,0.0,todo,
PRES_a05b916ad8,2009,Zograf Readings,Ордалия освященной водой (kosha),unspecified,,0.0,,0.0,todo,
PRES_a5cd9e04c7,2009,Zograf Readings,Язык богини Кали: проблемы интерпретации,unspecified,,0.0,,0.0,todo,
PRES_b3dcf19ef2,2009,Zograf Readings,Индоевропейская формула «храни мужей и скот» в ведийских и постведийских текстах,unspecified,,0.0,,0.0,todo,
PRES_e0b8b1bdd4,2009,Zograf Readings,Новые открытия на Гонур-тепе. Предварительное сообщение,unspecified,,0.0,,0.0,todo,
PRES_22c7444e36,2009,Zograf Readings,Символические модели Абсолютного Сознания в религиозно-мистической философии Кашмирского шиваизма. Некоторые методологические вопросы,unspecified,,0.0,,0.0,todo,
PRES_2cb004016e,2009,Zograf Readings,"Посвящение в знание мудрости в Гухьясамаджатантре (на основе Abhishekanirukti) 14.30. СПбГУ, ВОСТОЧНЫЙ ФАКУЛЬТЕТ. Ауд. 175",unspecified,,0.0,,0.0,todo,
PRES_86c16283af,2009,Zograf Readings,Ранневишнуитская Веданта,unspecified,,0.0,,0.0,todo,
PRES_9550fd0f6b,2009,Zograf Readings,Индийский текст индийской диаспоры,unspecified,,0.0,,0.0,todo,
PRES_ad9e0be839,2009,Zograf Readings,Махишасурамардини и девы-воительницы,unspecified,,0.0,,0.0,todo,
PRES_beb45aac0a,2009,Zograf Readings,«Рамаяна» Криттибаса Оджхи в культуре Бенгалии XV-XVI веков,unspecified,,0.0,,0.0,todo,
PRES_d7d30097a4,2009,Zograf Readings,Терминология суфийской проповеди в «Падмават» Малика Мухаммада Джаяси,unspecified,,0.0,,0.0,todo,
PRES_e2499adc9f,2009,Zograf Readings,Проблема соотношения этики и знания в йоге и индуистской тантре,unspecified,,0.0,,0.0,todo,
PRES_e85f779ed9,2009,Zograf Readings,Уровень смысла в текстах шастр: концепты или понятия?,unspecified,,0.0,,0.0,todo,
PRES_f5b1c223f2,2009,Zograf Readings,Особенности интерпретации традиционных текстов мыслителями Бенгальского Возрождения,unspecified,,0.0,,0.0,todo,
PRES_2ec1e17cb0,2009,Roerich Readings,Буддийские святыни в «Записках» Сюань-Цзана: построение текста,unspecified,,0.0,,0.0,todo,
PRES_3ec7076b0a,2009,Roerich Readings,"Соотношение «чистая земля» – «нечистая земля», «чистый народ – «нечистый народ» по материалам «Манусмрити» и «Артхашастры» Каутильи",unspecified,,0.0,,0.0,todo,
PRES_405fb6e1fc,2009,Roerich Readings,"Миф, пространство, время у алтайских народов",unspecified,,0.0,,0.0,todo,
PRES_4fc95cdd1b,2009,Roerich Readings,Махабхарата и шастры в ранней индийской эпиграфике,unspecified,,0.0,,0.0,todo,
PRES_51d2d7154d,2009,Roerich Readings,Тибетская джатака о Маллике как исток образа бхавачакры,unspecified,,0.0,,0.0,todo,
PRES_53b81c004f,2009,Roerich Readings,Письмо в культуре от Бактрии до Индии по материалам многоязычных надписей 3 в. до н. э. – 5 в. н. э. (К проблеме социоскрипторики),unspecified,,0.0,,0.0,todo,
PRES_5889e63ab3,2009,Roerich Readings,Фисаматы из Ольвийского декрета в честь Протогена,unspecified,,0.0,,0.0,todo,
PRES_64abe774d2,2009,Roerich Readings,Ордалия раскаленной монетой: шастрический текст и «свидетельства» испытаний,unspecified,,0.0,,0.0,todo,
PRES_6d5c58b0b0,2009,Roerich Readings,Пространство и его описание в строительных трактатах пуран,unspecified,,0.0,,0.0,todo,
PRES_6dadb0e4d7,2009,Roerich Readings,Этимология (нирукта) в качестве герменевтической науки в кашмирском шиваизме,unspecified,,0.0,,0.0,todo,
PRES_6f1e98755f,2009,Roerich Readings,«Абхисамаяланкара»: от первых трех глав к четвертой. Сознание творит реальность,unspecified,,0.0,,0.0,todo,
PRES_77d4fd8170,2009,Roerich Readings,К интерпретации термина намарупа в тхеравадинской комментаторской литературе,unspecified,,0.0,,0.0,todo,
PRES_96f005355d,2009,Roerich Readings,Махабхарата в тамильской поэзии,unspecified,,0.0,,0.0,todo,
PRES_9cec165a1d,2009,Roerich Readings,О ритуале помазания царя на царство в «Яджнявалкья-смрити»,unspecified,,0.0,,0.0,todo,
PRES_a38177a26d,2009,Roerich Readings,Место и значение «Бхактамара-стотры» в джайнской традиции,unspecified,,0.0,,0.0,todo,
PRES_d991c450bc,2009,Roerich Readings,Зеркало. Конец иллюзии. (Из истории одной концепции в кашмирском шиваизме),unspecified,,0.0,,0.0,todo,
PRES_dc9fbd292b,2009,Roerich Readings,Востоковед Ю.Н. Рерих: начало пути в науке,unspecified,,0.0,,0.0,todo,
PRES_dcfff95b9e,2009,Roerich Readings,"Сравнительный анализ описаний буддийских монахинь в тибетской, китайской и японской агиографической литературе",unspecified,,0.0,,0.0,todo,
PRES_df7b4cf816,2009,Roerich Readings,Некоторые историко-культурные аспекты символики национального флага Непала (V – XXI вв.),unspecified,,0.0,,0.0,todo,
PRES_f457799a1b,2009,Roerich Readings,Об одной возможной буддийской параллели к новозаветному пассажу МФ 5.19,unspecified,,0.0,,0.0,todo,
PRES_0c496dfec3,2008,Zograf Readings,Об эволюции образа Рудры-Шивы в священных текстах шрути,unspecified,,0.0,,0.0,todo,
PRES_59dba9b943,2008,Zograf Readings,Истоки формулы сат-чит-ананда в Упанишадах,unspecified,,0.0,,0.0,todo,
PRES_6da6054f73,2008,Zograf Readings,Атманепада в санскрите и в грамматиках,unspecified,,0.0,,0.0,todo,
PRES_7a09ad99d1,2008,Zograf Readings,Атхарваведа-паришишта XIXb: к вопросу о происхождении ритуалов Натьяшастры,unspecified,,0.0,,0.0,todo,
PRES_9b61667329,2008,Zograf Readings,Что стоит за стилями у Дандина?,unspecified,,0.0,,0.0,todo,
PRES_9d84234785,2008,Zograf Readings,Терминология и грамматика в «Энциклопедии Абхидхармы» Васубандху,unspecified,,0.0,,0.0,todo,
PRES_9d84234785,2008,Zograf Readings,Терминология и грамматика в «Энциклопедии Абхидхармы» Васубандху,unspecified,,0.0,,0.0,todo,
PRES_cac5d44443,2008,Zograf Readings,О символике ладьи в «Ригведе». 14.30. Зеленый зал ИВР РАН,unspecified,,0.0,,0.0,todo,
PRES_0404e32168,2008,Zograf Readings,«Сахар в молоке»: Ауто-представления об «индийском» и «персидском» в современной религиозной культуре парсов,unspecified,,0.0,,0.0,todo,
PRES_13fafa99b6,2008,Zograf Readings,Махатмья «Бхагаватапураны»,unspecified,,0.0,,0.0,todo,
PRES_293775e85d,2008,Zograf Readings,О происхождении культурных архаизмов в позднем слое содержания «Махабхараты» (на примере темы воинских братств),unspecified,,0.0,,0.0,todo,
PRES_7af57f160f,2008,Zograf Readings,Образ птицы в масочном театре сингалов (Шри Ланка),unspecified,,0.0,,0.0,todo,
PRES_844f6b86ea,2008,Zograf Readings,Образы фантастических животных в средневековой архитектуре Индии,unspecified,,0.0,,0.0,todo,
PRES_8b2df737b9,2008,Zograf Readings,Ордалия весами: проблемы интерпретации результатов взвешивания,unspecified,,0.0,,0.0,todo,
PRES_93c2e24013,2008,Zograf Readings,"«О Неодолимая Богиня, поклонение да будет тебе!» (О ритуальной части Калика-пураны) 14.00. Детский центр МАЭ РАН",unspecified,,0.0,,0.0,todo,
PRES_9e65f5de1e,2008,Zograf Readings,«Другая Савитри»: Сказание о Савитри в «Андхрамахабхарате»,unspecified,,0.0,,0.0,todo,
PRES_b3e877cd66,2008,Zograf Readings,О зооморфной символике в протоиндийских текстах,unspecified,,0.0,,0.0,todo,
PRES_c23e6409da,2008,Zograf Readings,О языке и стиле эпических риши,unspecified,,0.0,,0.0,todo,
PRES_5e317967c2,2008,Zograf Readings,Udāharaņa в «Вакьяпадии»,unspecified,,0.0,,0.0,todo,
PRES_9ffe685fd2,2008,Zograf Readings,Аспекты влияния религиозно-философских доктрин на творчество Кабира. Закрытие конференции,unspecified,,0.0,,0.0,todo,
PRES_a9e0852a8d,2008,Zograf Readings,Традиция в интерпретации мыслителей Бенгальского Возрождения,unspecified,,0.0,,0.0,todo,
PRES_c05d6f805a,2008,Zograf Readings,Так что же такое карма? 14.00. СПбГУ: Восточный факультет. Ауд. 75,unspecified,,0.0,,0.0,todo,
PRES_d5a74ed7f6,2008,Zograf Readings,Народный театр «джатра» и его роль в формировании новой бенгальской литературы,unspecified,,0.0,,0.0,todo,
PRES_e4b6786e6b,2008,Zograf Readings,Как сравнивать индийскую и западную эпистемологию? Опыт создания методологии компаративного исследования,unspecified,,0.0,,0.0,todo,
PRES_fea1defc8d,2008,Zograf Readings,Множество жизней поэмы Тулси Даса (некоторые аспекты современного бытования «Рамачаритаманасы»),unspecified,,0.0,,0.0,todo,
PRES_ff28a9ff47,2008,Zograf Readings,Концепт Ишвары в «Бхагавадгите»,unspecified,,0.0,,0.0,todo,
PRES_08257e3ccf,2008,Roerich Readings,Альтернативные социальные классификации в палийском каноне,unspecified,,0.0,,0.0,todo,
PRES_08e8316d53,2008,Roerich Readings,Кыргызы в Центральной Азии (9 век),unspecified,,0.0,,0.0,todo,
PRES_0fe8007200,2008,Roerich Readings,К вопросу о самоназваниях школы махасангхиков-локоттаравадинов,unspecified,,0.0,,0.0,todo,
PRES_3374abc140,2008,Roerich Readings,Двойная мандала в тибетском трактате «Вайдурья-карпо»,unspecified,,0.0,,0.0,todo,
PRES_415fb1eb4c,2008,Roerich Readings,Степные кочевники – иранцы II тыс. до н. э. – I тыс. н. э. и их языки,unspecified,,0.0,,0.0,todo,
PRES_448f6392bc,2008,Roerich Readings,Строительный ритуал и его роль в текстах вастувидьи (по материалам пуран),unspecified,,0.0,,0.0,todo,
PRES_506157c4da,2008,Roerich Readings,Тема времени в буддийских преданиях о Варанаси,unspecified,,0.0,,0.0,todo,
PRES_54fab21323,2008,Roerich Readings,Теистические установки в классической йоге и «Шветашватара-упанишаде»,unspecified,,0.0,,0.0,todo,
PRES_73205188c4,2008,Roerich Readings,«Очищение от терниев» в «Артхашастре» и дхармашастрах,unspecified,,0.0,,0.0,todo,
PRES_925074e2a5,2008,Roerich Readings,Агамы как источник философии радикальной Адвайты,unspecified,,0.0,,0.0,todo,
PRES_a7fa4ac110,2008,Roerich Readings,Н.К. Рерих с семьей в Синцзяне в 1926 г,unspecified,,0.0,,0.0,todo,
PRES_b97d25a759,2008,Roerich Readings,Мандалы Ваджрачхедики в коллекции Одесского Музея Западного и Восточного Искусства,unspecified,,0.0,,0.0,todo,
PRES_c305a62ca7,2008,Roerich Readings,Институт гутхи в древнем и средневековом Непале,unspecified,,0.0,,0.0,todo,
PRES_e3afc7dbb4,2008,Roerich Readings,Трава дарбха и самбодхи Будды,unspecified,,0.0,,0.0,todo,
PRES_e9159cba78,2008,Roerich Readings,К проблеме «тривадрумского цикла»,unspecified,,0.0,,0.0,todo,
PRES_eabb2c0db9,2008,Roerich Readings,Ордалии в дхармашастрах,unspecified,,0.0,,0.0,todo,
PRES_f0655c51e6,2008,Roerich Readings,Гоштхи (гутхи) в надписях Личчхавов,unspecified,,0.0,,0.0,todo,
PRES_f15fea41e4,2008,Roerich Readings,Текст – персонаж в древней махакавье,unspecified,,0.0,,0.0,todo,
PRES_f60e19e1b7,2008,Roerich Readings,О некоторых принципах тамильской поэтики по антологии «Наджиней»,unspecified,,0.0,,0.0,todo,
PRES_ff0d548615,2008,Roerich Readings,Что стоит за стилем у Дандина?,unspecified,,0.0,,0.0,todo,
PRES_10c2c66c17,2007,Zograf Readings,Древнеиндийские диалекты в ранних фонетических трактатах,unspecified,,0.0,,0.0,todo,
PRES_55fff640ca,2007,Zograf Readings,К вопросу о средствах передвижения в Ригведе,unspecified,,0.0,,0.0,todo,
PRES_632589d9f1,2007,Zograf Readings,От смерти к новому рождению. Учение о промежуточном существовании в «Абхидхармакоше» Васубандху,unspecified,unspecified,0.0,unspecified,0.0,todo,Mapped from old baseline
PRES_c5943e6066,2007,Zograf Readings,Описания военной техники в индийском сочинении XI века «Шри Калачакра тантра раджа». 14.00. Там же,unspecified,,0.0,,0.0,todo,
PRES_e564be93e3,2007,Zograf Readings,«Великие» и «малые» в надписях Ашоки,unspecified,unspecified,0.0,unspecified,0.0,todo,Mapped from old baseline
PRES_3fd8e2489c,2007,Zograf Readings,Кинематографический текст в современной индийской культуре,unspecified,,0.0,,0.0,todo,
PRES_7f36ed5c1e,2007,Zograf Readings,Джьотиша и Аюрведа: астрологическая семантика в классической индийской медицине. 14.00. Там же,unspecified,,0.0,,0.0,todo,
PRES_a7d32d94a9,2007,Zograf Readings,Типология храмовых сооружений в текстах пуран и «Брихатсамхите»,unspecified,,0.0,,0.0,todo,
PRES_c2c6d7f2b6,2007,Zograf Readings,К вопросу об эндогамии касты,unspecified,unspecified,0.0,unspecified,0.0,todo,Mapped from old baseline
PRES_f24e720def,2007,Zograf Readings,(Москва). Тема марудам в старой тамильской поэзии,unspecified,,0.0,,0.0,todo,
PRES_183a38da3a,2007,Zograf Readings,Некоторые проблемы становления вишишта-адвайты. 14.00. Там же,unspecified,,0.0,,0.0,todo,
PRES_57ccd5c672,2007,Zograf Readings,Дидактические шатаки в литературе телугу (К характеристике жанровых особенностей). 3. Т. Г .Скороходова (Пенза). Интерпретация традиционного индийского текста либеральными мыслителями Бенгальского Возрождения,unspecified,,0.0,,0.0,todo,
PRES_37a471ecf5,2006,Zograf Readings,К проблеме древнеиндийской хронологии,unspecified,unspecified,0.0,unspecified,0.0,todo,Mapped from old baseline
PRES_49eb37c334,2006,Zograf Readings,Орфоэпическая практика и древнеиндийская фонетика,unspecified,,0.0,,0.0,todo,
PRES_5b0c00b805,2006,Zograf Readings,Технические приспособления для рубрикации корней в «Дхатупатхе» Панини,unspecified,,0.0,,0.0,todo,
PRES_960adc4efb,2006,Zograf Readings,Вытеснение согласного во избежание возникновения тяжелой группы трех шумных согласных в индоиранском,unspecified,unspecified,0.0,unspecified,0.0,todo,Mapped from old baseline
PRES_bb69fb252f,2006,Zograf Readings,О соотношении санскритского и тибетского текстов «Гимна Превосходящему богов» Шанкарасвамина,unspecified,,0.0,,0.0,todo,
PRES_dfef1a443f,2006,Zograf Readings,Представления об обществе и власти в «Бхагавата-пуране»,unspecified,unspecified,0.0,unspecified,0.0,todo,Mapped from old baseline
PRES_fa7c38b2f3,2006,Zograf Readings,«Энциклопедия Абхидхармы» Васубандху как произведение санскритской литературы,unspecified,,0.0,,0.0,todo,
PRES_fa7c38b2f3,2006,Zograf Readings,«Энциклопедия Абхидхармы» Васубандху как произведение санскритской литературы,unspecified,,0.0,,0.0,todo,
PRES_594bd8ec61,2006,Zograf Readings,Некоторые наблюдения над царской титулатурой индо-греков. 4. С.-,unspecified,,0.0,,0.0,todo,
PRES_933f4317bd,2006,Zograf Readings,Об особенностях самосознания представителей «низких каст» в современных условиях,unspecified,unspecified,0.0,unspecified,0.0,todo,Mapped from old baseline
PRES_aaee698889,2006,Zograf Readings,Жизнеописание праведного царя Ашоки в индийских и тайских источниках,unspecified,,0.0,,0.0,todo,
PRES_41b4c6fe83,2006,Zograf Readings,Комментарий к комментарию (Г.С.Лебедев и культурная жизнь Калькутты в 1790-х годах),unspecified,unspecified,0.0,unspecified,0.0,todo,Mapped from old baseline
PRES_aa8c66a571,2006,Zograf Readings,«Ādau vāda āsīt»: о переводах Библии на санскрит. В программе возможны изменения и дополнения,unspecified,,0.0,,0.0,todo,
PRES_2a08c0cb86,2004,Zograf Readings,Актуальные проблемы изучения «Бхагавадгиты»,unspecified,,0.0,,0.0,todo,
PRES_3faf9b7b24,2004,Zograf Readings,Сюжет о Трите: этноисторическая основа,unspecified,,0.0,,0.0,todo,
PRES_8ee46835ab,2004,Zograf Readings,Мокша в Бхагавата-пуране,unspecified,,0.0,,0.0,todo,
PRES_92c5268a51,2004,Zograf Readings,Фигура царя и представления о времени в «Махабхарате»,unspecified,,0.0,,0.0,todo,
PRES_97ad954200,2004,Zograf Readings,Лук (оружие),unspecified,,0.0,,0.0,todo,
PRES_a535b2a757,2004,Zograf Readings,Замечания по формальной стороне Рикпратишакхьи,unspecified,,0.0,,0.0,todo,
PRES_ba501c2543,2004,Zograf Readings,Эротика в Ригведе: мужское и женское начало,unspecified,,0.0,,0.0,todo,
PRES_c567f22f17,2004,Zograf Readings,Лексика эпизода и его значение (на материале завершающих книг «Махабхараты»),unspecified,,0.0,,0.0,todo,
PRES_ceb3b3ba00,2004,Zograf Readings,Деви-гита из Девибхагавата-пураны,unspecified,unspecified,0.0,unspecified,0.0,todo,Mapped from old baseline
PRES_ec5840a950,2004,Zograf Readings,Еще раз о слове ātman в Ригведе,unspecified,,0.0,,0.0,todo,
PRES_3dfb43981f,2004,Zograf Readings,«Ум и знание» - тибетский учебник по теории познания,unspecified,,0.0,,0.0,todo,
PRES_4dc8f2c386,2004,Zograf Readings,Об астрологической герменевтике в медицинских текстах (Аюрведа),unspecified,,0.0,,0.0,todo,
