presentation_id,year,series,title,existing_theme_code,l1_baseline,l1_conf,l3_baseline,l3_conf,review_status,notes
PRES_d09e98a1d7,2019,Zograf Readings,О некоторых специфических жестах в бытовом этикете сингалов,unspecified,unspecified,0.0,unspecified,0.0,todo,Mapped from old baseline
PRES_02f8421750,2019,Roerich Readings,О двух подходах к одному тексту «Калачакра-тантры»,unspecified,,0.0,,0.0,todo,
PRES_0f8aeee7b2,2019,Roerich Readings,Музыкальные колонны Южной Индии,unspecified,unspecified,0.0,unspecified,0.0,todo,Mapped from old baseline
PRES_40c79b3a10,2019,Roerich Readings,"О стихах, приписываемых Бхартрихари",unspecified,unspecified,0.0,unspecified,0.0,todo,Mapped from old baseline
PRES_6274f89872,2019,Roerich Readings,Вербальный панегирик индийского монаршего портрета эпохи Моголов. 9.12.19,unspecified,unspecified,0.0,unspecified,0.0,todo,Mapped from old baseline
PRES_787d114bd2,2019,Roerich Readings,«Цветомыслие» в Древней Индии (вербальный текст и стенопись),unspecified,unspecified,0.0,unspecified,0.0,todo,Mapped from old baseline
PRES_8402d54487,2019,Roerich Readings,Дайва-арадхана Тулунаду (Южная Индия): сценарий и воплощение,unspecified,unspecified,0.0,unspecified,0.0,todo,Mapped from old baseline
PRES_914c6126f3,2019,Roerich Readings,Старый парк Пушпакарандаки (одна из загадок «Глиняной повозки»),unspecified,unspecified,0.0,unspecified,0.0,todo,Mapped from old baseline
PRES_b3fefc9375,2019,Roerich Readings,Восхваление табака в поэме «Пухейилей видутуду» тамильского поэта Сини Саккарей Пулавара,unspecified,unspecified,0.0,unspecified,0.0,todo,Mapped from old baseline
PRES_bda473a7a5,2019,Roerich Readings,"Семь сокровищ чакравартина и их пространственная локализация (палийский канон, «Артхашастра»)",unspecified,unspecified,0.0,unspecified,0.0,todo,Mapped from old baseline
PRES_c0a5930788,2019,Roerich Readings,К вопросу о дхарани и Дхаранипитаке,unspecified,unspecified,0.0,unspecified,0.0,todo,Mapped from old baseline
PRES_df9726f3c8,2019,Roerich Readings,Рай Амитабхи в традиции школы ньигма,unspecified,,0.0,,0.0,todo,
PRES_e09ac364ea,2019,Roerich Readings,Фронтальное и трёхчетвертное изображение лица в западно-индийской миниатюре XII–XV вв,unspecified,unspecified,0.0,unspecified,0.0,todo,Mapped from old baseline
PRES_f9cfeb6efc,2019,Roerich Readings,«Белые шапки»: интерпретации и эндемичность религиозного символа в начале XVIII в,unspecified,unspecified,0.0,unspecified,0.0,todo,Mapped from old baseline
PRES_009b94d14c,2018,Zograf Readings,Путешествие И. П. Минаева в Непал: обстоятельства и результаты,unspecified,,0.0,,0.0,todo,
PRES_1bd2292421,2018,Zograf Readings,Обучение Бодхисаттвы в «Лалитавистаре»,unspecified,unspecified,0.0,unspecified,0.0,todo,Mapped from old baseline
PRES_c78df41b2d,2018,Zograf Readings,О названиях пчелы в ведийском языке,unspecified,,0.0,,0.0,todo,
PRES_044e408c57,2018,Zograf Readings,«Мысленный эксперимент» Васубандху,unspecified,unspecified,0.0,unspecified,0.0,todo,Mapped from old baseline
PRES_8d99375954,2018,Zograf Readings,Сравнительный анализ образов сакрального в тамильских храмовых мифах и в сказах П. П. Бажова,unspecified,,0.0,,0.0,todo,
PRES_a71b76d799,2018,Zograf Readings,Концепция причинности в текстах «Абхидхамма-питаки»,unspecified,unspecified,0.0,unspecified,0.0,todo,Mapped from old baseline
PRES_d9b790f37d,2018,Zograf Readings,"Содержательное обоснование порядка в перечне прамей (Ньяя-сутра, Ньяя-бхашья)",unspecified,,0.0,,0.0,todo,
PRES_3cc35591bb,2018,Zograf Readings,Образ Индии в словацкой литературе XIX в,unspecified,,0.0,,0.0,todo,
PRES_702b845b3f,2018,Zograf Readings,Два новых сборника «индийских текстов» Далджита Награ,unspecified,unspecified,0.0,unspecified,0.0,todo,Mapped from old baseline
PRES_89479d5fc5,2018,Zograf Readings,Кришна исполняет зикр: следы влияния бхакти на суфизм братства Чиштийя,unspecified,,0.0,,0.0,todo,
PRES_1f28ca6ef7,2018,Zograf Readings,Тамильская пьеса о Карне,unspecified,unspecified,0.0,unspecified,0.0,todo,Mapped from old baseline
PRES_340def002b,2018,Zograf Readings,Ведды в современном укладе жизни Шри Ланки,unspecified,unspecified,0.0,unspecified,0.0,todo,Mapped from old baseline
PRES_6068a2f698,2018,Zograf Readings,Mārganātyam. Театральная практика и теория «Натьяшастры» сегодня,unspecified,unspecified,0.0,unspecified,0.0,todo,Mapped from old baseline
PRES_63cc937793,2018,Zograf Readings,Музыкальные инструменты в руках богов. К вопросу об иконографических атрибутах в искусстве Индии V—Х вв,unspecified,,0.0,,0.0,todo,
PRES_94531fde5d,2018,Zograf Readings,Индо-иранская сабля-шамшир из собрания МАЭ,unspecified,,0.0,,0.0,todo,
PRES_94531fde5d,2018,Zograf Readings,Индо-иранская сабля-шамшир из собрания МАЭ,unspecified,,0.0,,0.0,todo,
PRES_98cc0d1f3a,2018,Zograf Readings,Меч-посох из собрания МАЭ,unspecified,unspecified,0.0,unspecified,0.0,todo,Mapped from old baseline
PRES_a61c28b64e,2018,Zograf Readings,Культ Рудры-Кхандобы в исследованиях Г. Д. Зонтхаймера и его индоевропейские параллели,unspecified,,0.0,,0.0,todo,
PRES_de921762ec,2018,Zograf Readings,Опись Л. А. Мерварт коллекции № 3015 в собрании МАЭ РАН как образец музейного документа,unspecified,,0.0,,0.0,todo,
PRES_0285ee0cb7,2018,Roerich Readings,Традиция «Лалитавистары» и ее истоки. Новые наблюдения,unspecified,unspecified,0.0,unspecified,0.0,todo,Mapped from old baseline
PRES_07124e17dc,2018,Roerich Readings,Еще раз о буквальном переводе третьей версии «Калачакра-тантры» Буддийского канона,unspecified,,0.0,,0.0,todo,
PRES_10d033beaa,2018,Roerich Readings,«Ратнавали» Нагарджуны и «Дашабхумика-сутра»: явные и неявные связи,unspecified,unspecified,0.0,unspecified,0.0,todo,Mapped from old baseline
PRES_26341e4a7b,2018,Roerich Readings,«Видимый» и «невидимый» мир в теоретико-культурном дискурсе Древней Индии,unspecified,unspecified,0.0,unspecified,0.0,todo,Mapped from old baseline
PRES_3f663f57ec,2018,Roerich Readings,Вода и водоемы в трактатах по вастувидье в пуранах,unspecified,unspecified,0.0,unspecified,0.0,todo,Mapped from old baseline
PRES_43bdc7ab3f,2018,Roerich Readings,Индийские нумерационные системы. По материалам трактата Махавирачарьи «Собрание основных положений науки о вычислениях» (сер. IX в.),unspecified,unspecified,0.0,unspecified,0.0,todo,Mapped from old baseline
PRES_454d44aaed,2018,Roerich Readings,Еще раз к вопросу о сандаловой статуе Будды,unspecified,unspecified,0.0,unspecified,0.0,todo,Mapped from old baseline
PRES_4afd142d6d,2018,Roerich Readings,Божества и образы триграмм китайской «Книги Перемен» на свитке из коллекции Рерихов в Государственном Музее Востока,unspecified,,0.0,,0.0,todo,
PRES_5a50ff4176,2018,Roerich Readings,«Апастамба-яджна-парибхашасутра» (Āpastamba-yajña-paribhāṣāsūtra): проблемы перевода,unspecified,,0.0,,0.0,todo,
PRES_6329aa3fb2,2018,Roerich Readings,Чидамбарам и его дикшитары в зеркале «Панниру тирумурей»,unspecified,unspecified,0.0,unspecified,0.0,todo,Mapped from old baseline
PRES_9ecbe3104e,2018,Roerich Readings,Имперская идея или этнический стереотип? Концепт «монгол» в первой половине XIII в,unspecified,unspecified,0.0,unspecified,0.0,todo,Mapped from old baseline
PRES_9fe3408640,2018,Roerich Readings,Брахмадева и его комментарий к «Дравья-санграха-вритти» в контексте джайнской текстовой традиции,unspecified,unspecified,0.0,unspecified,0.0,todo,Mapped from old baseline
PRES_b8048f3ae8,2018,Roerich Readings,"Вопрос о соотношении субъекта-пудгалы, дискретности мышления-читты и устойчивости характеристик личности в тексте «Катхаваттху» (фрагмент 1.1.193-1.1.196)",unspecified,unspecified,0.0,unspecified,0.0,todo,Mapped from old baseline
PRES_d648392ad9,2018,Roerich Readings,Несколько слов о «я» и Адвайте в свете узнавания себя как предельного обладающего в толкованиях Абхинавагупты на «Ишварапратьябхиджня-карике» Утпаладевы,unspecified,unspecified,0.0,unspecified,0.0,todo,Mapped from old baseline
PRES_00c3fc1661,2017,Zograf Readings,Вопрос о божественности Будды в «Катхаваттху» 21.5—21.6,unspecified,,0.0,,0.0,todo,
PRES_0ebfa0f118,2017,Zograf Readings,Плач матери Будды по мертвому сыну: об одном эпизоде из легенды о просветлении,unspecified,,0.0,,0.0,todo,
PRES_45c0547868,2017,Zograf Readings,О методах описания санскритских классических стихотворных размеров,unspecified,,0.0,,0.0,todo,
PRES_575e445638,2017,Zograf Readings,Жанр послания в религиозной поэзии,unspecified,,0.0,,0.0,todo,
PRES_6521310efe,2017,Zograf Readings,В начале странствий. Эпизод абхинишкрамана в «Сутре о благом явлении царевича»,unspecified,,0.0,,0.0,todo,
PRES_6808a220bb,2017,Zograf Readings,"Мифология «Йогини-тантры» 15.00. ИВР РАН, Зеленый зал",unspecified,,0.0,,0.0,todo,
PRES_73e8c6e787,2017,Zograf Readings,"«Мудрость незапятнанная, окруженная свитой...». О структуре определения термина «abhidharma» в «Абхидхармакошабхашье» Васубандху",unspecified,,0.0,,0.0,todo,
PRES_a03dded834,2017,Zograf Readings,Культура повседневности британского чиновничества в Индии и Непале (по наблюдениям И. П. Минаева),unspecified,,0.0,,0.0,todo,
PRES_a0726a7b77,2017,Zograf Readings,История Капилавасту в поэме Ашвагхоши «Саундарананда»,unspecified,,0.0,,0.0,todo,
PRES_c47dbe060a,2017,Zograf Readings,"Ритуалы начала и прекращения изучения Вед (upākaraṇa, utsarga)",unspecified,,0.0,,0.0,todo,
PRES_f4fcdf4f99,2017,Zograf Readings,Образ бога Рудры в Шатарудрии в сравнении с германо-скандинавским богом Одином,unspecified,,0.0,,0.0,todo,
PRES_0928c0dd29,2017,Zograf Readings,«Диалоги об индусской философии» Кришномохана Банерджи: история мысли в интерпретации индийского христианина,unspecified,,0.0,,0.0,todo,
PRES_19c807a65f,2017,Zograf Readings,Философское учение Веданта Дешики в системе вишишта-адвайта-веданты,unspecified,,0.0,,0.0,todo,
PRES_205565b3d7,2017,Zograf Readings,"К вопросу о периодизации истории индийской философии 15.00. Русская христианская гуманитарная академия (наб. р. Фонтанки, д. 15). 5-й этаж, Актовый зал",unspecified,,0.0,,0.0,todo,
PRES_491dee99e0,2017,Zograf Readings,Классификация видов духовного освобождения в индуистской тантре,unspecified,,0.0,,0.0,todo,
PRES_6564eeace5,2017,Zograf Readings,Критика буддизма в «Ишвара-пратьябхиджня-вимаршини» Абхинавагупты,unspecified,,0.0,,0.0,todo,
PRES_6623706082,2017,Zograf Readings,Майя в учениях новых индийских гуру — иллюзия или реальность,unspecified,,0.0,,0.0,todo,
PRES_aeb8d4bed8,2017,Zograf Readings,Критика целей дефиниций (лакшана) в «Кхандана-кханда-кхадья» Шри Харши (на примере дефиниции восприятия),unspecified,,0.0,,0.0,todo,
PRES_b153547ebf,2017,Zograf Readings,Буддийская феноменология бессамостности (Опыт анализа концептов Я и «просто-я» Чже Цонкапы),unspecified,,0.0,,0.0,todo,
PRES_b2127f6e87,2017,Zograf Readings,Диалоги в ранних Упанишадах: от агона к риторике,unspecified,,0.0,,0.0,todo,
PRES_b88ce66786,2017,Zograf Readings,Индийская схема рациональности и некоторые ее приложения к индийской философии,unspecified,,0.0,,0.0,todo,
PRES_fd1c7dd152,2017,Zograf Readings,«Народная веданта» в произведениях Шричандры (XVI в.),unspecified,,0.0,,0.0,todo,
PRES_1aaabe5423,2017,Zograf Readings,Специфика бенгальских анекдотов,unspecified,,0.0,,0.0,todo,
PRES_4884ab035e,2017,Zograf Readings,Карибский текст индийской диаспоры,unspecified,,0.0,,0.0,todo,
PRES_536a630888,2017,Zograf Readings,Тамильские родственники в общедравидийском контексте: семантика и типология,unspecified,,0.0,,0.0,todo,
PRES_56ba477abf,2017,Zograf Readings,Борьба за собственный язык в Ладакхе,unspecified,,0.0,,0.0,todo,
PRES_7495ae17bb,2017,Zograf Readings,Как Кришна с Горакхой силой мерялись: Столкновение разных мистических течений в творчестве Малика Мухаммада Джаяси,unspecified,,0.0,,0.0,todo,
PRES_79b076d481,2017,Zograf Readings,К вопросу о лексике индивидуального субъективного начала в ведийском языке,unspecified,,0.0,,0.0,todo,
PRES_85a6141248,2017,Zograf Readings,Писатели хинди нового поколения: Кто они и зачем пришли в литературу,unspecified,,0.0,,0.0,todo,
PRES_fe20d5625c,2017,Zograf Readings,Поэзия Кабира и раджастханский фольклор,unspecified,,0.0,,0.0,todo,
PRES_3ce89a6762,2017,Zograf Readings,Брак с божеством как форма медиации в неварском обществе,unspecified,,0.0,,0.0,todo,
PRES_3e55ce15ac,2017,Zograf Readings,Особенности культа лингама в традиции вирашайвов,unspecified,,0.0,,0.0,todo,
PRES_47078a3292,2017,Zograf Readings,Фольклорные элементы в сказании о Ратне (XVII век),unspecified,,0.0,,0.0,todo,
PRES_6954835b7d,2017,Zograf Readings,Индийские божества судьбы и их индоевропейские параллели,unspecified,,0.0,,0.0,todo,
PRES_6b31c6dfea,2017,Zograf Readings,«Костыль факира»: атрибуция и некоторые вопросы бытования,unspecified,,0.0,,0.0,todo,
PRES_6e1915099b,2017,Zograf Readings,Особенности празднования Холи в Раджастхане (по материалам полевых исследований),unspecified,,0.0,,0.0,todo,
PRES_6e57a8cfb1,2017,Zograf Readings,Размышления по поводу двух древнегреческих сосудов (XVI — VII вв. до н. э.),unspecified,,0.0,,0.0,todo,
PRES_787c7a7fe6,2017,Zograf Readings,Тальварная рукоять и ее символика 15.00. МАЭ (Кунсткамера) РАН. Конференц-зал (Детский центр),unspecified,,0.0,,0.0,todo,
PRES_787c7a7fe6,2017,Zograf Readings,Тальварная рукоять и ее символика 15.00. МАЭ (Кунсткамера) РАН. Конференц-зал (Детский центр),unspecified,,0.0,,0.0,todo,
PRES_7dc7b85b87,2017,Zograf Readings,Христианская книга на индийских языках XVI — XVII вв.: ретроспективный библиографический указатель,unspecified,,0.0,,0.0,todo,
PRES_98436ca474,2017,Zograf Readings,Дифференциация веддов (взгляд извне и изнутри),unspecified,,0.0,,0.0,todo,
PRES_b29b6d6f36,2017,Zograf Readings,Метафора сосуда в непальском буддизме,unspecified,,0.0,,0.0,todo,
PRES_c0492c73f2,2017,Zograf Readings,Sattriya Ассама: о преобразовании ритуального представления бхакатов в еще один «классический танцевальный стиль» Индии,unspecified,,0.0,,0.0,todo,
PRES_e15e0cc931,2017,Zograf Readings,Живопись и графика из собрания И. П. Минаева (МАЭ РАН): опыт классификации,unspecified,,0.0,,0.0,todo,
PRES_0ab3c85533,2017,Roerich Readings,Легенда о рыбаке (на ирландском языке),unspecified,,0.0,,0.0,todo,
PRES_0e4533e715,2017,Roerich Readings,Содержание первой главы Шрикалачакра-тантры согласно ее комментарию,unspecified,,0.0,,0.0,todo,
PRES_150fd1b901,2017,Roerich Readings,"Анкхья-нат: обряд и драма средневекового Ассама, и их возрождение сегодня",unspecified,unspecified,0.0,unspecified,0.0,todo,Mapped from old baseline
PRES_22c3c585a3,2017,Roerich Readings,К вопросу о могольском изобразительном «мультилингвизме» и культурной экстравертности,unspecified,unspecified,0.0,unspecified,0.0,todo,Mapped from old baseline
PRES_3a9030ea71,2017,Roerich Readings,Первые известные изображения раг. Тексты и контекст,unspecified,unspecified,0.0,unspecified,0.0,todo,Mapped from old baseline
PRES_3f2a8362cc,2017,Roerich Readings,О поздней версии Калачакра-тантры,unspecified,,0.0,,0.0,todo,
PRES_6c4f1eceba,2017,Roerich Readings,Семантика изображений птицы на каменных изваяниях степей Евразии,unspecified,unspecified,0.0,unspecified,0.0,todo,Mapped from old baseline
PRES_762c65297f,2017,Roerich Readings,Проблемы методологии при интертекстуальном анализе палийских и санскритских текстов,unspecified,unspecified,0.0,unspecified,0.0,todo,Mapped from old baseline
PRES_82a1a1029b,2017,Roerich Readings,Культ Нарасинхи в трактатах по вастувидье в пуранах,unspecified,unspecified,0.0,unspecified,0.0,todo,Mapped from old baseline
PRES_a81b81e251,2017,Roerich Readings,Использование вторичного текста (цитирование) как средство ведения дискуссии в «Вопросе о субъекте (пудгале)» в «Катхаваттху 1.1»,unspecified,unspecified,0.0,unspecified,0.0,todo,Mapped from old baseline
PRES_af70362099,2017,Roerich Readings,К выходу Антологии индо-ирландских текстов,unspecified,unspecified,0.0,unspecified,0.0,todo,Mapped from old baseline
PRES_c892e395b5,2017,Roerich Readings,"Изображение Канакавасты, архата из Кашмира: часть полиптиха или отдельная танка? (Танка из собрания Кабинета Ю.Н. Рериха, ИВ РАН, Москва)",unspecified,unspecified,0.0,unspecified,0.0,todo,Mapped from old baseline
PRES_d76b9f1f7f,2017,Roerich Readings,Изменение роли яджаманы в шраута-ритуалах: традиция и современность,unspecified,,0.0,,0.0,todo,
PRES_10a4d70166,2016,Zograf Readings,"Ведийские истоки перспективизма Бхартрихари С. Л. Бурмистров. Пауль Дойссен (1845—1919): веданта, европейская философия и философская компаративистика",unspecified,,0.0,,0.0,todo,
PRES_11bae7431c,2016,Zograf Readings,Образ «распутницы» в пракритской лирике,unspecified,,0.0,,0.0,todo,
PRES_18af79d949,2016,Zograf Readings,"Научная ценность труда И.П.Минаева «Буддизм.Исследования и материалы» (СПб.,1887)",unspecified,,0.0,,0.0,todo,
PRES_2a0e1b2cbb,2016,Zograf Readings,К вопросу об индоевропейских параллелях ведийским vrātya,unspecified,,0.0,,0.0,todo,
PRES_3d94fe9cb2,2016,Zograf Readings,Основные идеи религиозной герменевтики Г. Оберхаммера в аспекте изучения вишишта-адвайта-веданты,unspecified,,0.0,,0.0,todo,
PRES_41f97da7ea,2016,Zograf Readings,"О сборнике садхан, переведенном Б. И. Панкратовым в 1930-е гг. в Пекине",unspecified,,0.0,,0.0,todo,
PRES_505b9c3a7b,2016,Zograf Readings,Понимание высшей истины (парамартха) у Чже Цонкапы,unspecified,,0.0,,0.0,todo,
PRES_625c10aa1b,2016,Zograf Readings,Об основаниях интерпретации терминов «dharma» и «saṃskāra» в контексте «Абхидхармасамуччаи»,unspecified,,0.0,,0.0,todo,
PRES_707faba145,2016,Zograf Readings,Чайтанья и его учение в североиндийской литературе XVII в. (на примере «Бхактамалы» Госвами Набхадаса),unspecified,,0.0,,0.0,todo,
PRES_71ed8e82c3,2016,Zograf Readings,Формирование иконографии и ритуала бхактотсава в тамильском шайва-бхакти (от «Тируттондаттохей» Сундарара до «Махотсававидхи» Агхорашивы),unspecified,,0.0,,0.0,todo,
PRES_74cd40949e,2016,Zograf Readings,Понятие фундаментальности в индологии,unspecified,,0.0,,0.0,todo,
PRES_74f987e071,2016,Zograf Readings,"Словарь «Амаракоша» как отражение индийской картины мира 15.00. ИВР РАН, Зеленый зал",unspecified,,0.0,,0.0,todo,
PRES_7c33afdee0,2016,Zograf Readings,«Век Кроноса» и «Сатья-юга»: два вида «первобытного коммунизма» и античных теорий социогенеза,unspecified,,0.0,,0.0,todo,
PRES_a4f7b5c51d,2016,Zograf Readings,Проблема квалия в свете буддийской философии,unspecified,,0.0,,0.0,todo,
PRES_afb804b1d8,2016,Zograf Readings,"Метафизика, мифология, повседневная жизнь: гендерный ракурс южноиндийской традиции",unspecified,,0.0,,0.0,todo,
PRES_ba7098c9bc,2016,Zograf Readings,К интерпретации ведийского понятия krátu-,unspecified,,0.0,,0.0,todo,
PRES_bb48ba0772,2016,Zograf Readings,Историографический обзор философско-поэтического наследия Ведантачарьи (Веданта Дешики),unspecified,,0.0,,0.0,todo,
PRES_becc032ebd,2016,Zograf Readings,Критика Шанкарой доктрины спхотавады,unspecified,,0.0,,0.0,todo,
