presentation_id,year,series,title,existing_theme_code,l1_baseline,l1_conf,l3_baseline,l3_conf,review_status,notes
PRES_04d1dbb4f8,2026,Zograf Readings,Предание в тексте и предание в камне: сюжет просветления Будды на рельефе Большой Ступы в Санчи,unspecified,,0.0,,0.0,todo,
PRES_09a1e1c8ac,2026,Zograf Readings,Индийское паломничество в сравнительном аспекте,history_and_culture,,0.0,,0.0,todo,
PRES_0d145ad80b,2026,Zograf Readings,Фарс Шанкхадхары «Латакамелака» и ее рукопись из Библиотеки им. Кешара (Катманду),unspecified,,0.0,,0.0,todo,
PRES_0d145ad80b,2026,Zograf Readings,Фарс Шанкхадхары «Латакамелака» и ее рукопись из Библиотеки им. Кешара (Катманду),unspecified,,0.0,,0.0,todo,
PRES_1469802faf,2026,Zograf Readings,По следам Петербуржца в Индии: путешествие князя Салтыкова,unspecified,,0.0,,0.0,todo,
PRES_429df46bef,2026,Zograf Readings,Зачем спорили хэшан Махаяна и Камалашила?,history_and_culture,,0.0,,0.0,todo,
PRES_454ec814a4,2026,Zograf Readings,Вера Александровна Новикова (1918-1972) и послевоенная бенгалистика в Ленинграде,unspecified,,0.0,,0.0,todo,
PRES_47c9b6e551,2026,Zograf Readings,«Они из секты Пифагора»: представления об индуизме трех итальянских купцов второй половины XVI в.,unspecified,,0.0,,0.0,todo,
PRES_49871ff2ee,2026,Zograf Readings,Александр Михайлович Мерварт: судьба ученого,unspecified,,0.0,,0.0,todo,
PRES_a23748a106,2026,Zograf Readings,Теория познания в мадхьямаке-сватантрике (по трактату Бхававивеки «Мадхьямака-хридая»),religion_and_philosophy,,0.0,,0.0,todo,
PRES_a468274027,2026,Zograf Readings,Эпическая санкхья в беседе царя Джанаки и отшельницы Сулабхи (МБХ 12.308),religion_and_philosophy,,0.0,,0.0,todo,
PRES_a94e17b6dc,2026,Zograf Readings,"Востоковед Павел Яковлевич Петров (1814-1875), его библиотека и архив",unspecified,,0.0,,0.0,todo,
PRES_c6cbde7b3d,2026,Zograf Readings,Заметки о роли индийской диаспоры в пропаганде языка и литературы хинди,unspecified,,0.0,,0.0,todo,
PRES_ca8800ec45,2026,Zograf Readings,Абхисамаяаланкара: вводная часть,history_and_culture,,0.0,,0.0,todo,
PRES_de83f64419,2026,Zograf Readings,«Шри Рамананда-чаритам» Рамбхадрачарьи как образец современной санскритской махакавьи,unspecified,,0.0,,0.0,todo,
PRES_f613b85148,2026,Zograf Readings,А.А. Сталь-Гольштейн как участник научно-издательской серии «Bibliotheca Buddhica»,history_and_culture,,0.0,,0.0,todo,
PRES_0191a9931d,2026,Zograf Readings,Сон Урмилы в современной индийской прозе,unspecified,,0.0,,0.0,todo,
PRES_05c3fd2ae3,2026,Zograf Readings,«Башни с нишами» в индуизме. Об одном типе храмовых шикхар в архитектуре Чалукьев,unspecified,,0.0,,0.0,todo,
PRES_0b9610a3e7,2026,Zograf Readings,Синтез сложных слов tatpuruṣa и karmadhāraya в грамматике Панини,unspecified,,0.0,,0.0,todo,
PRES_2739e10d32,2026,Zograf Readings,«Местный колорит» в литературной традиции Ориссы,unspecified,,0.0,,0.0,todo,
PRES_62a2c637da,2026,Zograf Readings,Салман Рушди и русская литература: тайный роман?,literature_and_poetry,,0.0,,0.0,todo,
PRES_704c51dc8f,2026,Zograf Readings,Чему и как учит Панчатантра,unspecified,,0.0,,0.0,todo,
PRES_753eef11a6,2026,Zograf Readings,Перевод в практике преподавания хинди в средней школе,unspecified,,0.0,,0.0,todo,
PRES_7d7ea74779,2026,Zograf Readings,Южноандаманские языки: к вопросу о возможностях внешнего сравнения,linguistics_and_philology,,0.0,,0.0,todo,
PRES_89d287993e,2026,Zograf Readings,"Средневековая фольклорная формула и литературное клише: образ, мотив",unspecified,,0.0,,0.0,todo,
PRES_9ea6f5bc67,2026,Zograf Readings,Лексика языка куллуи: этимологии 2026 года,linguistics_and_philology,,0.0,,0.0,todo,
PRES_a386a029c9,2026,Zograf Readings,Метод кодировки чисел в трудах индийского математика Арьябхаты,linguistics_and_philology,,0.0,,0.0,todo,
PRES_aa0065628d,2026,Zograf Readings,Паришишты как исторический источник: проблемы датировки и классификации поздневедийской ритуальной литературы,history_and_culture,,0.0,,0.0,todo,
PRES_cc5564b317,2026,Zograf Readings,Пословицы и поговорки Индии и России как аспект межкультурной коммуникации (проектная деятельность на уроках языка хинди),unspecified,,0.0,,0.0,todo,
PRES_f012dba963,2026,Zograf Readings,Имперфект в древнеиндийском эпосе,linguistics_and_philology,,0.0,,0.0,todo,
PRES_0a815e1eea,2026,Zograf Readings,Идеи йогачары в трактате Асанги «Абхидхармасамуччая» (первая глава),religion_and_philosophy,,0.0,,0.0,todo,
PRES_38f205e4bd,2026,Zograf Readings,«Сказание о Лиле» в «Йога-васиштхе»,literature_and_poetry,,0.0,,0.0,todo,
PRES_397e3963d9,2026,Zograf Readings,Вклад Абхинавагупты в развитие шиваитской доктрины философского монизма в отличной от адвайта-веданты парадигме,unspecified,,0.0,,0.0,todo,
PRES_449a8a5d83,2026,Zograf Readings,Структура ниданы из «Панчавимшатика-праджняпарамиты» в аспекте ритуальной практики,unspecified,,0.0,,0.0,todo,
PRES_4e2973826e,2026,Zograf Readings,Индийская философия в свете компаративного подхода Поля Массон-Урселя,religion_and_philosophy,,0.0,,0.0,todo,
PRES_5efd5cf3d6,2026,Zograf Readings,Коннотативные особенности йогической лексики Виджнянабхикшу (на примере комментария к 1.1 «Pātañjalayogaśāstram»),unspecified,,0.0,,0.0,todo,
PRES_707967d832,2026,Zograf Readings,"«Особая священная игра» Гулабрао Махараджа как игровая модель индуистской сотериологии: космология, философия и бхакти",unspecified,,0.0,,0.0,todo,
PRES_8278d320e8,2026,Zograf Readings,Интерпретация идей Упанишад в философском наследии Р. Тагора: религиозная онтология,religion_and_philosophy,,0.0,,0.0,todo,
PRES_ac9683df6e,2026,Zograf Readings,Уроки Герхарда Оберхаммера. По следам перевода книги «Структуры йоговской медитации»,unspecified,,0.0,,0.0,todo,
PRES_ae940b9946,2026,Zograf Readings,Прамана-вада «Таттва-сандарбхи» Дживы Госвами в оптике неклассической эпистемологии науки,religion_and_philosophy,,0.0,,0.0,todo,
PRES_aea5eb08fe,2026,Zograf Readings,Можно ли считать мадхьямаку нигилизмом?,religion_and_philosophy,,0.0,,0.0,todo,
PRES_d1ede4663f,2026,Zograf Readings,"Традиция толкования упанишад: контекст, философское значение и интерпретация ключевой фразы «tat tvam asi» («Ты есть то»)",religion_and_philosophy,,0.0,,0.0,todo,
PRES_f20b1ace74,2026,Zograf Readings,"Санньяса и Брахмалока: смерть, социальная или физическая, как опосредующий этап пути к освобождению в адвайта-веданте",religion_and_philosophy,,0.0,,0.0,todo,
PRES_0b8a983777,2026,Zograf Readings,Окна в иной мир: изобразительные тексты и линия жизни индийской художницы-парси Катаюн Саклат (1938-2026): антропологический взгляд,unspecified,,0.0,,0.0,todo,
PRES_1be3cfc48b,2026,Zograf Readings,К истории поступления индийских памятников в Эрмитаж: новые открытия,history_and_culture,,0.0,,0.0,todo,
PRES_6b88ca7841,2026,Zograf Readings,Тело агхори как «живой текст»: визуальность и перформанс в производстве религиозного авторитета,religion_and_philosophy,,0.0,,0.0,todo,
PRES_6e4151c4c6,2026,Zograf Readings,Миф о Потопе и тыкве у племен западной Индии,religion_and_philosophy,,0.0,,0.0,todo,
PRES_9970e6d559,2026,Zograf Readings,Об одном диафильме В. Чатопадаева из коллекции МАЭ РАН,unspecified,,0.0,,0.0,todo,
PRES_9970e6d559,2026,Zograf Readings,Об одном диафильме В. Чатопадаева из коллекции МАЭ РАН,unspecified,,0.0,,0.0,todo,
PRES_a21ffcc50d,2026,Zograf Readings,"Jati, gotra and marriage system in Haryana: a change in perspective",unspecified,,0.0,,0.0,todo,
PRES_bf93ca6932,2026,Zograf Readings,Непальский вариант Гаруды,unspecified,,0.0,,0.0,todo,
PRES_c6ba86e6a2,2026,Zograf Readings,"Яйцо, курица и Тримурти: миф о Шакти в фольклоре мадига",religion_and_philosophy,,0.0,,0.0,todo,
PRES_c9e5f9602f,2026,Zograf Readings,Ведийский ритуал Праваргья (pravargya): текстовая традиция и ритуальная практика,religion_and_philosophy,,0.0,,0.0,todo,
PRES_d6d1aa17d4,2026,Zograf Readings,"Огонь, вода и память: погребальные практики сикхов в мультикультурной среде",unspecified,,0.0,,0.0,todo,
PRES_ec92e3cbe5,2026,Zograf Readings,Златоликие образы Дипанкары Будды и традиция проведения фестиваля Самьяк маха дана в Патане,unspecified,,0.0,,0.0,todo,
PRES_f31d73160b,2026,Zograf Readings,Голод в Бенгалии 1943 года и его отражение в творчестве индийских художников,linguistics_and_philology,,0.0,,0.0,todo,
PRES_96863ca3fa,2025,Zograf Readings,Арьядэва и Чандракирти о концепции anātma,unspecified,unspecified,0.0,unspecified,0.0,todo,Mapped from old baseline
PRES_cac95e2161,2025,Zograf Readings,В защиту Вишну Шипивишты: «Аз есьм Шипивишта!» (РВ 7.100.6),unspecified,unspecified,0.0,unspecified,0.0,todo,Mapped from old baseline
PRES_e84196d92a,2025,Zograf Readings,К интерпретации Ригведы: śiśnadevāḥ,unspecified,unspecified,0.0,unspecified,0.0,todo,Mapped from old baseline
PRES_fc83b6c79d,2025,Zograf Readings,Возвращаясь к третьей книге Махабхараты: новый взгляд,literature_and_poetry,unspecified,0.0,unspecified,0.0,todo,Mapped from old baseline
PRES_493f0d6ac7,2025,Zograf Readings,Восхождение Урмилы в поэме Майтхилишарана Гупты «Сакет»,unspecified,unspecified,0.0,unspecified,0.0,todo,Mapped from old baseline
PRES_da938d5fcc,2025,Zograf Readings,Проблема индианизации колониальной армии на страницах индийской прессы в 1910-х — 1940-х годах,unspecified,unspecified,0.0,unspecified,0.0,todo,Mapped from old baseline
PRES_ea35d438ad,2025,Zograf Readings,Еще раз о структуре Чарьягити,unspecified,unspecified,0.0,unspecified,0.0,todo,Mapped from old baseline
PRES_8c979b88c9,2025,Zograf Readings,О «Yogavārttika» Виджнянабхикшу: Ansatz,unspecified,unspecified,0.0,unspecified,0.0,todo,Mapped from old baseline
PRES_aac636d1e0,2025,Zograf Readings,«Наишкармья-сиддхи» (I. 52) Сурешвары как структура для реконструкции учения Шанкары об освобождении,unspecified,unspecified,0.0,unspecified,0.0,todo,Mapped from old baseline
PRES_b7fe4e5874,2025,Zograf Readings,Ауробиндо Гхош: между разумом и мистической интуицией,unspecified,unspecified,0.0,unspecified,0.0,todo,Mapped from old baseline
PRES_c02d591918,2025,Zograf Readings,Проблемы реконструкции системы йоги Патанджали на основе переводов «корневого» текста «Йога-сутр» и толкования Бходжи («Rājamārtaṇḍa»),unspecified,unspecified,0.0,unspecified,0.0,todo,Mapped from old baseline
PRES_c4b18b7d44,2025,Zograf Readings,Интерпретация теизма «Бхагавадгиты» Шанкарой и Абхинавагуптой (на материале их комментариев к «Бхагавадгите),unspecified,unspecified,0.0,unspecified,0.0,todo,Mapped from old baseline
PRES_d601a42cd5,2025,Zograf Readings,Комментарии Б. Н. Пандита на «Шивасутры»: новый взгляд на коренной текст трики,unspecified,unspecified,0.0,unspecified,0.0,todo,Mapped from old baseline
PRES_eabea1fbe3,2025,Zograf Readings,Женщины и сатьяграха: взгляд М. К. Ганди,unspecified,unspecified,0.0,unspecified,0.0,todo,Mapped from old baseline
PRES_f1d137e03c,2025,Zograf Readings,Особенности толкования Нового Завета в учении Свами Вивекананды,unspecified,unspecified,0.0,unspecified,0.0,todo,Mapped from old baseline
PRES_015d1064e6,2025,Zograf Readings,От демоницы к мстительнице: Переосмысление образа ведьмы в современном индийском кинематографе,unspecified,unspecified,0.0,unspecified,0.0,todo,Mapped from old baseline
PRES_45038e9f46,2025,Zograf Readings,Самбхары в обряде установления жертвенных огней (agnyādheya),unspecified,unspecified,0.0,unspecified,0.0,todo,Mapped from old baseline
PRES_b0da2392d3,2025,Zograf Readings,Экспедиция Психо-Неврологического института в Индию в 1913,unspecified,unspecified,0.0,unspecified,0.0,todo,Mapped from old baseline
PRES_9bacebbe98,2025,Roerich Readings,Аланкара как аспект стилистики текста,unspecified,unspecified,0.0,unspecified,0.0,todo,Mapped from old baseline
PRES_eb96cea429,2025,Roerich Readings,", О. В. Лундышева (РНБ Сектор восточных фондов Отдела рукописей; ИКВИА НИУ ВШЭ, Санкт-Петербург - Москва). Prasādapratibhodbhava (Śatapañcāśatka) Матричеты: тохарский перевод и комментарий",unspecified,unspecified,0.0,unspecified,0.0,todo,Mapped from old baseline
PRES_d6c59acf5e,2025,Roerich Readings,Описание Центральной Азии в «Хождении в пять индийских царств»,unspecified,unspecified,0.0,unspecified,0.0,todo,Mapped from old baseline
PRES_d767707d9d,2025,Roerich Readings,Этапы сложения имперской идеологии у средневековых монголов,unspecified,unspecified,0.0,unspecified,0.0,todo,Mapped from old baseline
PRES_679dbfd494,2025,Roerich Readings,Выкуп невесты (śulka) в Древней Индии: шастрическая и эпическая традиции,unspecified,unspecified,0.0,unspecified,0.0,todo,Mapped from old baseline
PRES_aa9ddea8aa,2025,Roerich Readings,О теории просодии в «Натьяшастре»,unspecified,unspecified,0.0,unspecified,0.0,todo,Mapped from old baseline
PRES_f40d5bacac,2025,Roerich Readings,Представления пуран о священном тексте как культовом предмете,unspecified,unspecified,0.0,unspecified,0.0,todo,Mapped from old baseline
PRES_5f755d36b3,2025,Roerich Readings,Треугольник Паскаля или Пингалы?,unspecified,unspecified,0.0,unspecified,0.0,todo,Mapped from old baseline
PRES_b9413943b6,2025,Roerich Readings,Яджня Ригведы и «другая яджня» палийского канона,unspecified,unspecified,0.0,unspecified,0.0,todo,Mapped from old baseline
PRES_2819d33fcb,2025,Roerich Readings,Индийские шастры с точки зрения современной методологии познания,unspecified,unspecified,0.0,unspecified,0.0,todo,Mapped from old baseline
PRES_ea27687ed5,2025,Roerich Readings,Рецепция Маджджхима-никаи в рукописях Э. Гуссерля,unspecified,unspecified,0.0,unspecified,0.0,todo,Mapped from old baseline
PRES_e9afc8c101,2024,Zograf Readings,Бодхисаттва — стрелок из лука. Буддийский сюжет и его аналоги.Островская Е.П. (СПб) Интерпретация эвтаназии в буддийской картине мира.Комиссаров Д.А. (Москва) Бодхисаттва в образе пишачи: следы комической традиции в описании аскезы Гаутамы.Фивейская А.В. (Москва) От эпического предания до буддийского сказания и обратно: история Шьямы.Крапивина Р.Н. (СПб) Абхисамаяланкара как предмет буддийского образования.Леонов М.В. (Москва) Образ времени в поэзии Бхартрихари,literature_and_poetry,,0.0,,0.0,todo,
PRES_ff3dd9cd99,2024,Zograf Readings,Телеологический аргумент в пользу существования Бога в учении Свами Вивекананды. Пахомов С.В. (Санкт-Петербург) Модели интерпретации телесности в хатха-йоге. Лобанов С.В. (Москва) Монистический теизм (адвайта-ишваравада) Абхинавагупты в сопоставлении с ишваравадой адвайты Шанкары на материале их комментариев к «Бхагавадгите»..Игнатьев А.А. (Калининград) Обряд панчамакара в каулических тантрах,religion_and_philosophy,,0.0,,0.0,todo,
PRES_956af043cd,2024,Roerich Readings,Посох Чанакьи,unspecified,unspecified,0.0,unspecified,0.0,todo,Mapped from old baseline
PRES_48742ecace,2024,Roerich Readings,Индийские классификации: принципы различения поэтических украшений (аланкар),unspecified,unspecified,0.0,unspecified,0.0,todo,Mapped from old baseline
PRES_9c0c80bea0,2024,Roerich Readings,"Традиционные индийские классификации: образцовые, удобные, проблематичные",unspecified,unspecified,0.0,unspecified,0.0,todo,Mapped from old baseline
PRES_89de2df795,2024,Roerich Readings,О нарративной символике бронзовой фигурки танцующего Бала-Кришны,unspecified,unspecified,0.0,unspecified,0.0,todo,Mapped from old baseline
PRES_28cd0cf2d2,2024,Roerich Readings,Ирония в пьесе Ватсараджи «Киратарджуния» (XII в.),unspecified,unspecified,0.0,unspecified,0.0,todo,Mapped from old baseline
PRES_04be156989,2024,Roerich Readings,Принципы построения верениц древнеиндийских имён в «Вишнусахасранаме» («Махабхарата» XII.135),unspecified,unspecified,0.0,unspecified,0.0,todo,Mapped from old baseline
PRES_7522e9718b,2024,Roerich Readings,Многообразие культурных традиций и влияний в средневековой Индии: от династий до социальных изменений,unspecified,unspecified,0.0,unspecified,0.0,todo,Mapped from old baseline
PRES_3262a00942,2024,Roerich Readings,Ю.Н. Рерих о происхождении монгольской письменности,unspecified,unspecified,0.0,unspecified,0.0,todo,Mapped from old baseline
PRES_e7ec05b05b,2024,Roerich Readings,Угроза монгольских вторжений в Японию глазами Нитирэна,unspecified,unspecified,0.0,unspecified,0.0,todo,Mapped from old baseline
PRES_611497ab1e,2023,Zograf Readings,Почему Брахман наделен природой звука (шабда-таттва)?,unspecified,unspecified,0.0,unspecified,0.0,todo,Mapped from old baseline
PRES_6f434a621b,2023,Zograf Readings,О не-волшебной помощнице в сказках парья: вариант фольклорного мотива.Комиссаров Дмитрий Алексеевич (Москва). Склонность к конфликтам в образе Махакашьяпы в буддийских канонических текстах,literature_and_poetry,,0.0,,0.0,todo,
PRES_bfeac6bacd,2023,Zograf Readings,Дворец небесный и дворец земной: две схожие главы «Лалитавистары» и их функциональная роль в общей композиции текста,unspecified,,0.0,,0.0,todo,
PRES_e9dfb67a80,2023,Zograf Readings,Драма как категория и жанр в древнеиндийской поэтике. Челнокова Анна Витальевна (Санкт-Петербург). Россия и русские в произведениях Салмана Рушди.Леонов Максим Владимирович (Москва). О возможности передачи санскритских стихотворных размеров в русских переводах,literature_and_poetry,,0.0,,0.0,todo,
PRES_956381eb58,2023,Zograf Readings,Анализ аморальных поступков в «Абхидхармакоше» Васубандху.Ермакова Татьяна Викторовна (Санкт-Петербург). Научные связи Ф.И.Щербатского с британскими востоковедами в 1930-е гг.Гордийчук Николай Валентинович (Москва). Тема угона скота (veṭci) в древнетамильской поэзии и литературной теории.Котин Игорь Юрьевич (Санкт-Петербург). Политик читает и пересказывает эпос. «Рамаяна» и «Махабхарата» в переложении Чакраварти Раджагопалачари.Смирнитская Анна Александровна (Москва). «Моя мать и твоя мать – какая родня?» Об обозначениях братьев и сестер и возможностях прадравидийской реконструкции.Костина Екатерина Александровна (Санкт-Петербург). Значения и функционирование лексемы ye в бенгальском языке,literature_and_poetry,,0.0,,0.0,todo,
PRES_f2f30f7f8b,2023,Zograf Readings,Средний залог в санскрите. К семантике категории.Скороходова Татьяна Григорьевна (Пенза). Найти нормативную этику в традиционных текстах: сверхзадача и её решение мыслителями Бенгальского Возрождения..Лекарева Ева Павловна (Санкт-Петербург). Поздний Р.Тагор и «Бхагавадгита»: переосмысляя концепцию о долге.Гасунс Марцис Юрьевич (Обнинск). Древнеиндийская ономастика в «Вишнусахасранаме»,linguistics_and_philology,,0.0,,0.0,todo,
